class,text
1,ITunes can be downloaded from the enclosed CD or for free from the Apple site.    
0,"Also, diapers and wipes get stuck in the grove below the piston."
0, The interface took a little getting used to.
1,This is my first MP3 player and I am so impressed with what such a small device can do.  
0,i just bought one and returned it as defective for good reason . 
1,i have not had any distortion problems with this phone and am more pleased with this phone than any i 've used before . 
1,They're easy to use. 
1, I especially love the ` remote ' controller stand with it 's big volume knob and simple selector buttons .
0,The collet for the 1/4 inch bits is a pain to get in and even harder to get out.
1," Overall, this product is AWESOME. "
1,the service from the supplier was exceptional . 
0,c ) the scroll bar is a travesty -- enough said 
0,"Unfortunately, Creative offered scant few pages of instruction, which meant that I was on own from the outset. "
1,Battery : A Big Big plus. 
0," Have the latest firmware but as many others have described , the router will randomly stop working for 5 minutes then work again ."
0,"After 4 attempted installs, I have finally given up."
0,"First of all, I've never been big on earbuds - they're just not that comfortable."
1,I couldn't believe what I had been missing.
0," After that , the router would never even respond to its own internal browser link ."
0,"I hope you have a magnifying glass, because the number displayed as well as most of the pop up options are tiny."
0,"There will be much erasing of text as, one would tend to type something instead of the actual letters."
1,"I am just in love with this phone, especially after using a more primitve phone about 3 years."
1,"unarguably better than Apple's, and nice earbuds to boot.  "
0,"The program brings more problems than a virus, albeit not as major problems, just not what you expect for 70 bucks."
1,feels solid in hand . 
0,i 've had this thing just over a month and the headphone jack has already come loose . 
0,The Diaper Genie needs it's own refill bags in order to work and that's just more money that you don't have to spend.
1,"try before you buy if at all possible : although i am a mac addict now for over a decade and everyone i know has previously bought an ipod , the nomad zen xtra was a far better value and is just as easy to use with regards to both hardware and software interface . "
1,"i 've only had it a week , but so far , everything about this camera is making me happy . "
1," The speakers have a very rich sound and good bass also , obviously not thumping bass for which you would need a huge subwoofer !!"
1," Harmon international has done a great job on all of these equipment , the AVR 525 produces crystal clear sound with excellent clarity ."
0, Since it would not work as advertised I called support .
1,I've been incredibly happy with this camera.
1,"the battery life is very good , i got about 90 minutes with the lcd turned on all the time , the first time around , and i have been using it with the lcd off every now and then , and have yet needed to recharge it . "
0,I dont use the belt clip cuz it fails to hold the player securely (design problem). 
1,the best 4 megapixel/4x optical zoom camera available and fairly easy to use . 
1,FM tuner & Microphone : Having a tuner in the player is a blessing. 
1,The display and brightness on this phone is quite extraordinary.
0,"so , i 've had it for a month , and the headphone jack went out . "
0,"it would spin , read , spin some more and then show on the display that there was no disc . "
1, It has good color and price was great .
1,as said before this works perfectly . 
1,"it has great battery life , fm radio , excellent signal , hands free speakerphone ( which i have to say is probably my favorite function ) and downloadable java apps . "
1,"sure , this thing is definitely more cost-effective than an ipod . "
1,"The nokia 6600 is a great phone, good games, good camera."
1, Music sounds great but having surround sound in game is nice and a big difference from headphones .
1,it has lots of features such as the calendar which works like my outlook calendar . 
0,"It feels like I'm back to the days of 56k dial-up internet service, even though I'm running a Dell 2GHz Pentium 4 with 256MB memory and have had excellent broadband service for the past year."
1,"Battery life is exceptional, lasting longer than the 8-10 hours that seem reasonable with most music players on the market.  "
0, I would not recommend this or any Acer product to anyone except perhaps my ex .
1,am i ever glad that i decided on this camera ! 
1,we take this camera with us everywhere and are constantly amazed at the quality of the pictures that we get and the number of different ways the camera allows for pictures to be taken . 
1,"Also, it takes any kitchen sized trash bag, so there is no special bag to stock."
1,"2 ) the player user interface ( ui ) is intuitive to use , and allows easy navigation of a large or small collection . "
1,speakerphone - loud and clear has some nice extra features like currency converter and a stopwatch . 
1, This netbook is very light but still powerful .
1,"If I had to do it over, I wouldn't buy anything else."
1, Awesome sound system .
1," However , if speed , reliability , and power to transmit a signal across the house are your requirements , then this router will do the job ."
1,"4mp , 4x optical zoom , takes absolutely beautiful photos with detail that challenges all of the above 5mp cameras , easy to understand and use ( has a great swivel lcd screen ) , a lot of features and add-on options , comes with great software ( not to be overlooked ) , and last but by far not least , received my fiance 's stamp of approval ( two thumbs up ! ) "
0,it was ( i sold it after a few months ) too expensive for the shots that i got . 
0,"The box proudly displays ""SecureEasySetup (TM)"" ""Wireless Made Simple"" ""One Touch Setup Button"" ""Easy Start"" ""Easy Security"" ""Easy Everyday""   Apparently Linksys/Cisco knows that ease of setup is crucial. "
0,this player is not worth any price and i recommend that you do n't purchase it . 
1,"The sound is bright and clear, the ability to store any MP3's (and not just Apple-approved files) is great, and I plan to make use of the storage space and sound recording from time to time.    "
0,"the only minor nits i have with the camera are it is fairly boxy looking , it needs a wrist strap instead of a neck strap , and it is a bit slow between shots . "
0,"I am an advanced computer user, so I cannot even imagine how a new or novice user would ever get this terrible program to work!"
0,the only two minor issues i have with the camera are the lens cap ( it is not very snug and can come off too easily ) and the lens itself ( it partially obstructs the view through the viewfinder but not views through the lcd ) . 
1, In addition the price point is spectacular .
1,"the possibilities with auto , manual , and the very helpful "" scene "" mode , which offers 11 optimized situational settings like portrait , landscape , beach / snow , sunset etc. , are endless . "
0,"i purchased a jukebox , it got fried while being recharged , they asked for $ 20usd just to look at it and said that they would charge me for repaing the damned thing . "
1,The Phone offers a 32 Mb MMC card and I think that is certainly the most exciting feature.
1,I would put the Hitachi up with the best!
0,"have tried to contact apex via e-mail ( customerservice@apexdigital.com ) , but the e-mail address is not valid . "
1,3 ) user replaceable battery 
1,Mine installed no problem (but I DID uninstall my Norton Anti-Virus 2002 & Personal Firewall 2002 first).
1," Without a doubt I would say that these speakers have the same sound quality as the jbl on stage , and are truly portable -LRB- can be played without a power outlet , I love that feature -RRB- ."
0,have had problems since the first day 
1,start up is so quick  
1, The way I have to put in my I-Pod was a little tricky but when it was done the speakers sound really good .
1,very cool features... great camera with zoom...cool quality pictures... great ringtones... bluetooth feature is great....
1, It seems that with every firmware release the router gets better & better .
1,this is my first digital camera and i could n't be happier . 
1,i like the auto fit feature = you can stretch widescreen dvd 's to normal . 
1, It also has excellent coverage through our two story house .
1,They also sound excellent compared to other earbuds including retail sets like Panasonics and Sennheisers. 
1,"In short, the Nokia 6600 is an evolution but not a revolution."
0," BATTERY: Compared to the other players on the market, the iPod has one of the worst batteries around."
1,the apex 2600 has been a steady performer for me . 
1,"The voice recorders good, but you can't record songs off the radio for ring tones."
1,What makes it so great is the versatility and the number of features it has.
1," Great product , works perfectly for my office !!!"
1,i have only had this camera for one full day and i have to say that it is wonderful . 
1," Again , the sounds were spot-on and projected from where they should , the front of the TV ."
1,Picture quality's great for still and video with sound.
1,"touchups , redeye , and so on are very easy to alter , and correct . "
0,"Seems the ""program scan"" feature did NOT find the EXE file for Outlook!"
0," The router failed today -LRB- completely dead -RRB- , when I need to work from home due to heavy snow !"
1,This is a fantastic tool to use.
0,. the movie clips taken will always have some ' noise ' in it - you can 't avoid that . 
1, Absolutely love it and cant beat the price !
1,2.  It can be operated with one hand - Leaving a hand on your baby on the changing table.
0,what a disappointment ! 
1,We empty ours every day and we have never had an odors from it!
1,"The FM tuner, the 5G of storage, and the removable disk are all great features.  "
0,The sliding latch is does not stay in place.
1," I 'm very happy with these , I 'll probably buy 2 more for the front channels ."
0,"I must say, this one is quite slow to open an application."
1,It was so easy my toddler would dispose of her on diapers.
1,And the biggest plus is that you don't have to buy any expensive refills.
0,you can see the lens barrel in the view-finder . 
0,"on several different occasions it has displayed "" no disc "" with a disc inside . "
1,mixed bag i guess but the price was right . 
1,"the two biggest things is the excellent working speakerphone "" unlike the nokia 3650 "" and the superb reception nokia is known for in the gsm phones they make ... "
1,"Also included in the ""games"" section is the great music trivia option - which tests your skill at being able to quickly place your own songs. "
1,"Also, you have to use it with iTunes - or they'll sue, dammit!  But iTunes is about as good as anything. "
1, The Satellites are good but the corsair is more responsive and clean .
1,"It's easy to use. Not too small, and not too big."
1,APPLICATIONS: It has lots of applications and they work very well... when you eventually find where they are and they finally open.
1,"for the first few weeks , this player was everything i expected it to be , an affordable multi-format dvd player with a stylish slim case as advertised . "
0,The installation software CD crashed repeatedly. 
0,It still smelled.
1,"- Audio Formats: supports both MP3, WMA... And yeah, WAV too.  "
0,"The support has been less than impressive, considering the cost. "
1,"I give this product five stars for its usability,performance, expandability, and definitely looks!"
1,"it looks very cool , and seems quite small to me and very light . "
1,"However after playing with it for three weeks now, I'm convinced, the Zen Micro is superior. "
1,The phone is sturdy.
1, Looks great .
1,i 'm very pleased with my zx so here 's a quick review . 
1,"it has several play options , one of the best is an option to shuffle , based on all or a certain playlist . "
0, I started accessing and transfering files to find it to be extremely SLOW .
0," ##Cons. 1. Configuration is not easy as it made out to be 2.Lousy Initial Software 3. Does not work with BitSpirit with UPnP, Besides that its an excellent choice , If you know your way around network configuration go for it."
1, It allows the USB interface on the router to be used either for NAS or print server .
0,"well , within 45 days the video output quit working ( both rca & optic ) . "
1,without a doubt the finest looking apex dvd player that i 've seen . 
1, I do n't want to be a sensationalist but this computer is incredible .
1,it plays original dvds and cds and plays mp3s and jpegs . 
1,"the mobile text messaging , chat , picture sharing etc. other nicities , that you would enjoy . "
0,"the catch with the canon g3 camera , ( and perhaps all of digital cameras ) is that its unresponsiveness will cause you to miss precious shots . "
0," The range of response seems a little limited to me -LRB- changing the EQ setting on the iPod produces a definite change in the sound , but I would expect a little more richness in the changes -RRB- ."
0,"it took several days of attempts before things finally "" worked "" again and i have n't a clue why . "
0,I occassionally flip songs while working out as i accidently hit the pad even lightly (yes i have it in maximum desensitized mode). 
0,the one i purchased for a frend as a gift will not read any dvd disc . 
0,"3 ) it does not work automatically like a hard drive when you connect it to your computer , like some players "
1,The sound is amazing. 
0,is not as intuitive as I would like.  
1,"By focusing exclusively on quality rather than excessive marketing, they have introduced a player that can look the Ipod straight in the eye and not flinch.  "
0,"also , i can 't understand why the software does not ignore "" the "" when it lists the cds in alphabetical order . "
0,"first , the cons ... a tad bulky ... not the most asthetic looking player ... and does n't support a folder stucture . "
1,it has all the features one would need in a cellphone . 
0,"d ) software is another great misfortune -- hard to operate , crashes frequently , screwed my music library up , doesnt work with mp4s , the list goes on and on "
0,"i know this unit will have problems in the future and the $ 40 for the 2 year "" no questions asked "" replacement warranty will be worth it , since creative will only warrant it for 90 days - which in itself is totally ridiculous ! "
1, Ca n't beat it for the price .
1,"When the overall image quality (especially natural colours, details, natural looking of the pictures) is the most important thing, then this camera ist top notch and very impressive. "
1,"what got me to buy was the reviewer that said it would play dvd-rs fill of files ( e. , mp3s ) . "
1,"ripping & transferring tunes is basic , and pretty fast ( even on a 1.1 usb ) . "
1,"even better , with the optional headset you can listen to music over the integrated radio . "
1, Build quality is great .
0,Stay away from this product!
1,"it 's small , light and nice looking and the display is decent as well . "
1,the design is sleek and the color screen has good resolution . 
1,"I have ripped over 100 songs from my CD collection and it was so easy and fast, and they all sound great.  "
1,But I wanted to do some raised panel work and needed more power and variable speed to run the large-diameter bits.
0, In fact others say not bright enough ?
0,"The FM radio's reception isn't spectacular, but it will pick up the most powerful stations in any given metro area. "
1,the dvd player is fine . 
0,the other thing i do n't like about this 2600 is that it makes the color look over saturated . 
0,seems it is always difficult to press to make a selection . 
0,3 . the pictures come out hazy if your hands shake even for a moment during the entire process of taking a picture . 
0,and supply those stupid white Headphones. 
0,got way too many blurry pictures . 
0," The hard drive I had attached to the USB port was sometimes accessible , sometimes not ."
1,"i use it for ripping cds , which it does a pretty good job of . "
1,"Personally, I am VERY pleased with the Diaper Champ."
1,"i do like this phone overall ( would give it a 3.5 ) , but unforutnately , i am returning it . "
1,the phones are awesome . 
0,* main dial is not backlit . 
0," All in all , bad device , bad customer service ... run like hell from this product ."
1,The interface is simple to use.
1,3) The joystick design they are using on the new Nokias gives you a great degree of control.
1, Set up went pretty well and things seemed good .
0,the scroll button is overly sensitive at times ; not sensitive enough at others . 
1,So for the money it costs for one of those top-of-the-line models I've got a good router & a nice table to put it in & I like that.
0,This router was a huge disapointment.
0,"it wo n't play 80 % of my movies , which are all store boughten . "
0,"if you want to rename a cd title that you have already transferred , you will become frustrated quite quickly . "
1,"I upgraded from an older 801.11b router to the Linksys WRT54G for its improved security, and of course, speed. "
0,"HOWEVER after just one month my headphone jack was BROKEN as a result of normal, every-day use.  "
1, Relatively small desktop footprint too .
1,Goes ~3 days after a charge.
1,The router works fine for both wired and wireless.  
0,i tried to contact apex to return it ( i missed the amazon return period ) and it took 3 months to get through to their customer service dept . 
0, The buttons are confusing and super small .
1,This is a GREAT product!
0,"the scroll wheel , to be blunt , sucks . "
1,"It's very quiet for a universal motor-driven tool, and the height adjustment stick and variable speed control are great."
0,"Luckily the soft start helped before it took the wood and tossed it or worse case, a finger."
1,for the money apex machines have good features . 
0,"When you consider expandability (downloads via computer), the numerous features, two transmission programs and multiple storage devices, dependability - this is a phone that isn't easy to out-grow."
0," I have been disappointed to find that there is no printed instructions with it , just a crude pictorial instruction of installation , which leaves a great deal of information missing ."
1," My 2 XBoxs , Ipod , Iphone , Ipad are all catching a nice strong signal ."
0," I called the tech support and they helped me install new firmware , but this did not solve the problem ."
1,i am enjoying my phone a lot .... 
1,Have not had any issues with the headphones or fragility.  
1,"there are lots of interesting features included such as eax , and customization . "
1, For the price there 's nothing better .
1,"For me, it is as important that the tool be comfortable to use as it is that it produce a high-quality result."
1,"i compared this to a lot of other cameras , believe me , it 's value for money . "
1,"Nokia makes great phones, and this one is the cream of the crop."
0,you can't do that with a Sony T610 (which i traded for a 6600).
0," I unplugged it , plugged it back in , and the power supply failed ."
0,there was occasionally a lip-sync issue ( the lips were n't moving in time to the dialogue ) . 
0,"one beef is the scroll , it does n't work as well as i 'd like . "
1,excellent sound - i found the music reproduced faithfully through the jukebox . 
1,As I drove across the country I lost reception only in eastern Kentucky's mountains.
1,"the menu allows you to search for files by artist , genre , and album quite easily . "
0,"i only have one complaint , and that is the 8mb card included . "
1, Then I would say that this LCD monitor have many feature in one piece .
0,"some movies it played yesterday , it wo n't play today . "
1,I must add to the dismay/delight of readers this phone is simply the most groundbreaking phone mankind has ever held.
1,i love it ! ! 
1,The extra Gb is just a bonus.  
1,it is the most bang-for-the-buck out there . 
0,"finally , i reiterate my thumbs-down rating for t-mobile as a carrier . "
1, Sound quality and base is amazing .
0,creative labs customer support website is useless . 
0,"typically , the problem is the headphone jack -- it was for me and many others . "
1,"As I mentioned in my first paragraph, it supports WPA security, which is far superior to WEP.  "
1,"i wo n't go into the details here , as the online sites ( stevesdigicams , dpreviews ) go into great depth in their reviews , but i am very pleased with the features , the speed , the picture quality , the flexibility , the automation , and the functional conveniences this camera offers . "
1,At 128 the songs sound very good.  
1,"considering the price and specs , this might be the best buy out there for a large memory mp3 player . "
1,"The latter will provide better coverage in more remote areas of The States but still operates in many countries, excluding New Zealand and Australia."
1,"Songs transfer lightning fast, and the two batteries that came in my box give me 24 hours of listen time. "
1,another point of note : the battery life is incredible ! 
1,"for those of us that like to tinker , i think creative offers some advantages . "
1,"but , if you 're looking for my opinion of the apex dvd player , i love it ! "
1,it takes great pictures . 
0,"Although I disabled Norton AntiSpam, it is still there."
1,"either way , can 't go wrong with this price . "
1,"the camera is a dream to operate in automode , but also gives tremendous flexibility in aperture priority , shutter priority , and manual modes . "
1,The Ipod is a fine cousin to the early macs and current offerings from Jobs and Company. 
1,i really have no complaints over this unit . 
1," The screen is a very pleasing matte , and the colors are great ."
0," While my laptop and netbook have decent speakers , the volume on such devices is inherently lower than with standard speakers , making it harder to hear some audio ."
0,There are 2 things that need fixing  First is the battery life. It will run for 6 hrs without problems with medium usage of the buttons. 
1,yet after ensuring that all the id3 tags are in order ( with the software which is actually not as bad as people make it out ) it actually turns out to be really handy . 
1,I think it's great.
1,This is a MUST HAVE product for all new moms!
1,You do get 1 more GB than an iPod mini.  
1,"the headphone earbuds are average , so just use your regular pair instead . "
0," It 's a fun little gadget , do n't expect high definition sound ."
0,- no option for caller-id pictures or individualized ringtones . 
0," So slow , that it is not useable for files of any size or back-ups ."
1,i also use the phone as my modem via bluetooth to my Apple powerbook!
1,I am impressed with this camera inside and out.
1,It is a great router for a table and with the depth adjustment knob it is easy to adjust depth prescisely.
0,"It just tells you to start disconnecting and attaching cables without any input as to whether your current setup includes a pre-existing router (mine does), without any clarity as to whether you should be running the wizard on a hard-wired PC or a wireless equipped PC. "
1,"While they all seem to have their own positives and negatives, I picked the Zen Micro over the Ipod mini, because I am not an Apple person, never has been - I wanted something that is fully compatible with Windows Media Player. "
0,also the feature to automatically put in the song information is n't always accurate . 
1, I personally would recommend this router in every house hold or small buisiness environmnets .
1,User Interface: The software is simple and straight forward. 
0,I could hardly use it without a recharge in 2 days!
0,"Unfortunately, the touch-pad issues [non-intuitive] and poor instruction guide killed it. "
1,You do not have to waste money or time trying to purchase special bags for the Champ.
0,"Also if you do manage to get it installed, any problems with LiveUpdate or with System Works will also affect the functionality and/or the process of updating Internet Security."
1,"i 've been pleased with the picture quality and durability in snow , car , boat and wind . "
1,I have the black one and adore it. 
1,"8 ) creative mediasource , although not as sleek looking as windows mediaplayer , is effective in organizing your collection and is linked to a good cddb service ( gracenotes ). "
0, D-Link got greedy and in trying to sell you their pathetic extras made the product unusable .
1,"however , for a $ 600 - $ 800 budget , i think this camera is an excellent choice . "
0,"At first glance, I thought this phone was a little too big for me, maybe a little too complicated."
1,But you can download some really good ones like pac-man or mafia wars.
1," Lastly , I feel that the speakers were over priced for what I got -LRB- unless there is some inherent benefit in the Bose label that I do n't know of -RRB- ."
0,"It took me three days, to the tune of Neil Young's song ""Piece Of Cr--!"", to get this to work with the satellite hookup I was hired to connect this wireless network up to.  "
1, The first 2 routers worked good for years .
1,"but at the same time , it takes wonderful pictures very easily in "" auto "" mode , so that even an average joe like me can use it ! "
1,"get it , it 's woth every penny ! ! "
1, It works flawlessly during installation of cx501 .
1,"+Sorts music by artist, album, genre, etc... it's easy to wade through 5 gigs of tunes to find what you're looking for. "
1,"ive seen em all , the archos , dell , ipods , everything ... good price and great sound makes this one the best in my opinion . "
1, Very good range and seemed to be better in the horizontal position .
0,"because the ""engineers"" at Creative screwed up the design of the headphone jack. "
