class,text
0,T610 supports only midi files.
0,"If you have no previous version of  nortron security on your system, or Nortron Antivirus, the installation will go fine, otherwise dig in and in to do a major registery clean up!the old programs will leave a trace that will mess up the new installation, even if you uninstalled the old programs perfectly."
1," For a small , portable , unit , this allows you to listen to , as well as share Ipod music , and podcasts , in an intimate setting ."
1,"Many of these programs are shareware, some can be purchased by paying a little bit of bucks."
0,"then my dvds would stop playing in the middle , or not even be read at all . "
1,We use the cheap $1.99 13 gallon vanilla scented bags from the grocery store but you can use any bag you have laying around.
1,"For a sleeker, smaller and more ""average"" MP3 player the Nitrus is great but the iPod blows it out of the water - the interface is great and the design is wonderful."
1, The sounds were as the movie directors intended .
0,"- not playing some dvds and then finally after less than 60 days , it just would not recognize anything i pop in it . "
1,it is crystal clear . 
0,It has the odd side effect of the buttons only partially working? 
1,actually using the nomad jukebox is easy and uncomplicated . 
1,"While I have not had the ""privilege"", as many call it, of owning an Ipod, based on the experience of friends who have had some misfortune with their Ipod (and subsequently purchased the Zen Touch or Zen Micro), I can pretty much rest assured that my decision to purchase the Zen Micro was one of the more informed ones."
1,"compared to other leading hdd mp3 players , the value per gb is the tops . "
0," The replacement unit had a problem too : the little switch on the bottom was n't working properly , making it impossible to select among city forecasts in my area ."
0,Diapers can get stuck when turned around if you don't tightly wrap them first. 
1,"Other than the fact that one can't delete a file directly from the iPod, the interface is excellent and mind-numbingly simple to use.  "
0,same story as everybody else when trying to get service from apex - nothing . 
0,"i purchased two of these players for christmas gifts , and both were bad . "
1,"I also like the lock feature, so it makes the touch pad inactive.   "
0,"but after 10 days , the sound worked , but the video quit working . "
1,"i have to say i 'm also pretty impressed by the user interface for playing jpeg , mp3 and mpeg files stored on cd-rs / dvds . "
0,You'll do that because the keys are tightly packed in and your fingers will likely press two keys at once.
1, Fits perfectly in the corner of my small desk !!
1,Your choice of ten colors in a beatiful package.  
1," Affordable price , reliable item and excellent customer service ."
0," Their products are super expensive , especially to get them fixed ."
1," This is a great 3-piece speaker system for a computer , and it 's worth every penny ."
1,"it takes excellent pics and is very easy to use , if you read the manual . "
0," Meanwhile , the instructions for Apple users indicated I should load the CD-ROM , but it turns out it only contained a PDF of instructions and offered nothing by way of explanation on installing for Apple computers ."
1,I still can't believe how fast it starts up. 
1,"I've only had this camera for a few days, but it's been great. "
1,This wonderfully small digital camera produces fantastically good pictures printed on any decent photo-quality printer (with photo quality paper).
0,It would not hang up on calls.
1,I have to say that I am very happy with it so far.
1,the light auto-correction is awesome . 
1,The bass treble the sound detail is awsome. 
1, The sound is clear and clean but if your not on top of it you ca n't hear a thing .
1,"i have n't messed with the firmware at all , the player worked perfect for me right out of the box . "
1," Great color display , sharp picture , and just the right size for my desk ."
0,the volume . 
1, Has the click wheel and the ability to scan through thousnds of songs and organizes them great.
1,"Friends told me that the Diaper Genie did not work very well, so bought the Diaper Champ based on on-line reviews and I have been happy with it."
1,overall an excellent phone . 
1,"The installation, set-up, and operating interfaces are well organized and intuitive and the email spam component works well."
0,The only problem is that occasionally the joystick does start to dig into your thumb while gaming.
1,you could take a picture of a stone glinting in the sun and still avoid the shining glaze and get the contours right . 
0,So far I haven't had so much complaints except that I still haven't mastered how to scandisk when using Internet Security.
1,for the most part this is a good dvd player . 
1,Setup in XP was instant and intuitive. 
0,"The ""movies"" last about 5 seconds."
0, I tried these speakers and found them to preform well below expectations for this price .
1,"Slow-syncro flash, macro/infinity mode, etc."
1,"I can keep one hand on my baby and dump the diaper at the same time, it is that simple."
1,The heavy motor and continuously variable speed control let this router churn through everything I threw at it.
1,It has great upgradibility.
1,I purchased two of these beauties.
1,"with eax on , you can modify your sound , with 4 different presets , which is pretty good , you can get different variations with it . "
0,"I'm giving it 1 star because as compared to other Nokia phones , its a 1 , compared to other blunders by other companies (such a samsung and motorrola) it might be good .... but if you're getting a Nokia , don't get this one ."
1,No one has ever come to my house and noticed 'diaper odor.'
1,"It's overkill for simple snapshots, unless you've got way too much money to blow."
0,"third , the poor design continues with the case . "
1,"It powers up quickly, so you won't miss that quick shot. "
1, I was surprised how good the sound was and I especially like to use it when I am listening to audio books .
1,"t-mobile is trying very hard , and again -- they do have pretty good csr 's . "
1,"this is by far the nicest one , in so many ways . "
1, am so glad I bought this camera. 
0,the unit itself did lock up a few times and i had to hit the reset button but that was a fairly painless process as well . 
1, The second set is working just fine .
1,"all and all , i am extremely pleased with this camera . "
1,"the eax features are pretty cool , as well , as creative has included a number of eq adjustments that , for example , compensate for the extraneous noise encountered in a car or on a train . "
0,"A lot of ""fragments"" were left in the Registry, and it the Norton system folders."
0,"  And if you're a Mac user like me, they've naturally made sure you have no viable alternative.  "
0,"Now in October,2004, the firewall said I couldn't OK anymore software to use the internet because its full."
1,the storage capacity is great . 
0,Such a small zoom length that you would think that the zoom would be silent since it hardly zooms in...wrong!
1,"at double-speed ( 2x forward speed ) , it still plays mp3s with sound -- they are pitch-corrected and smooth , but twice as fast ! "
0,"their network coverage is very sporadic , and the network always seems overloaded , resulting in very unpleasant calling experience . "
0,only con i can think of is no camera ... . 
1,INCREDIBLE MEMORY!
0," However , some of the latest bandwidth hogging software was starting to bog it down , to the point where I was having to reset it and my computer far too often in order to reclaim a dropped Internet connection ."
0,"in addition , it only seems to work if you 're about five feet away from the player , although that may have been just the batteries that came with it . "
1,but this camera is great ! 
0,"i have had this player for 3 months and have been able to see a total of 6 dvd 's , after the frustration and aggrivation of getting the player to do it 's job . "
0,"when i hooked it up it only produced sound - a cd played fine , but with a dvd i only got the audio - no picture ! "
1,"I can't smell anything (and believe me, this is quite something with my baby)."
0,"well just one con - its not really plug and play at first i mean its very confusing to start the program but one you do it , it will be a breeze . "
0,My son tried it and he too couldn't change the speed without an assist.
0,"-- > will not automatically transfer songs with identical titles ( if you have live albums or greatest hits albums , this will cause you inordinate frustration ). "
0,"Buttons size is OK for me, my wife, but not my grany."
1, Vocals have greater clarity with the iHome as well .
0,"i tried to play the song three times , with no success . "
1,i am really impressed by this dvd player . 
0,"ring tones only come with crazy songs and annoying rings , there is only one ring that sounds close to a regular ring . "
0,3 . mediasource is an application with serious user interface flaws . 
1,"the display is awesome , you can see everything you want and read it clearly "
1,"Getting the router setup in a ""vanilla"" configuration that works for 99% of users was very easy, and I was able to do this no problem."
1,"Overall, if you know what basic steps to take, it was not difficult to connect, and the s/w worked well to connect.  "
1,I actually took a friends word on it and went with this Champ when registering and I am glad I did.
1,"Initially, I was very impressed, after loading 180 songs it seemed to function very well but then it would lock up on me and a battery removal remedied this, I then downloaded the upgrades and everything seemed to be alright. "
1,"it's fast, feels great in your hand and looks great too. "
1, I have no problem at all recommending these stands .
1,I'd be happy to talk to anyone about this camera. 
1,it is amazing that the battery lasts so long when the phone is so small and light . 
0,"This camera uses a lithium battery, I find lithium batteries to be highly inconvenient; because what if you are on vacation, where the nearest place to buy batteries is just a gas station--there is no way that you are going to find lithium batteries there."
0,this unit was working fine for the 1st month and a half and then the color signal disappeared . 
1,"- the unit itself its well structured , with just the buttons you need and none you do n't . "
1,"after using it for about a month , i can state unequivocably that this nikon definitely delivers a huge bang for the buck . "
1,It has a cardboard slip cover with a nice layered box casing inside.  
0,1 ) fragile ( i broke the 1st one within 10 days ) 
1,i selected the 4300 right away and have gotten high quality pictures every time . 
1," Had a JVC system that was 6 years old and I thought it was good , but the Onkyo sound is amazing !"
1,2 ) storage capacity 
0,"The best thing to do with this version, is to leave it on the store shelf. It doesn't work, and will cost you an enormous amount of your time, not to mention your hard earned dollars."
0," Another thing you should know, the metal on the flip side of the iPod is very tacky, and scratches very easily."
0,"it also has a stock tracking app built in ( also useless ) and a somewhat useful application which converts all types of metrics ( currency , length , area , etc ) . "
0,the only problem that i have found with the internet service is that it does not access mls ( real estate broker software ) very well at all . 
1," My fiance ordered this computer , she 's a teacher so she needed a small computer that would keep her from bringing work home with her ."
1,i bought this slick phone and i am very happy with it . 
0, My only grips are the incompatibility with XP and the USB hub in the display .
0,Another problem I had with this camera was the zoom function.
1," Though it does n't have quite the screen real estate , it 's an excellent monitor and crystal clear at a resolution of 1920x1080 ."
1,i highly recommend this camera to anyone looking for a good digital camera that takes great pictures yet does n't take weeks to figure out how to operate . 
1," When I then moved the wire to the desktop and used the laptop wirelessly , the internet connection was just fine ."
1,"it's a great looking, easy-to-use device but it's the sound quality which is truly amazing -- far better than my Sony mini-disc player.  "
