class,text
4,Could integrating antivirus software into Windows be the key to solving Microsoft #39;s security woes or could the technology create more problems than it solves?
2," FILDERSTADT, Germany (Reuters) - American Lindsay Davenport  won the Filderstadt Grand Prix Sunday after world number one  Amelie Mauresmo retired injured after the first set."
3,The Environmental Protection Agency said yesterday it has agreed with 12 US airlines on steps to improve aircraft water quality after the agency #39;s tests discovered coliform bacteria generally found in feces in water on 12 percent of airplanes.
3,Ford Motor Co. said Wednesday that US sales fell 5 percent in October from a year ago as car sales continued to decline and truck sales increased slightly.
2,"Phillies Manager Larry Bowa will be fired at the end of the season and pitching coach Joe Kerrigan will resign, two newspapers reported Saturday."
4,"MAJOR LCD panel maker AU Optronics may can plans to build a seventh generation TFT-LCD fab, the Taipei Times said. That follows a slump in sales in July, after prices for large size LCD panels started to topple."
3,VODAFONE shares fell nearly 3 per cent yesterday on fears that the mobile phone group could come under pressure from its US partner to provide \$25 billion (13 billion) to help to finance a bid for Sprint.
3,"AP - Office products retailer Office Depot Inc. on Wednesday reported a decline in third-quarter profit due to softening in its European business, disruptions associated with the hurricanes in the southeastern United States, and lower-than-expected back-to-school sales."
4,"After being dropped for release outside of Japan by Microsoft Game Studios, publisher Majesco has picked up Phantom Dust for a release in North America, expected to be early 2005."
2,"The pitches for the first two Tests of the India-Australia series have been accurately described as sheep in wolf #39;s clothing. Now, with the caravan moving to Nagpur in central India, there is talk of a green top."
1,"AFP - Sudan's government defiantly dismissed a UN deadline for it to disarm its proxy militia in the Darfur region, insisting it would resolve the conflict there through ongoing African Union peace talks."
4,"They used to fill entire floors of buildings and were so costly only governments or large companies could afford them. Yesterday, Apple Computer showed just how far technology "
1,VIENNA -- The UN nuclear agency agreed yesterday on a plan for policing Iran's nuclear programs designed to avoid a showdown at the United Nations.
3,Warburg Pincus Equity Partners and Providence Equity Partners are reportedly in negotiations to buy Telecordia Technologies for \$1.
1,"JACOBABAD: I was under no pressure to sign the presidents dual office bill, said Mohammadmian Soomro, the acting president. Mr Soomro told Online on Sunday that he gave assent to the bill on his own since he was constitutionally authorised to do so."
3,"State securities regulators have moved to suspend or revoke the licenses of nine former brokers for Metropolitan Mortgage  amp; Securities, the bankrupt financial conglomerate that has left thousands of people across the Northwest holding hundreds of millions "
2,"Through three games in 2004, Brian Holloway has recorded 19 tackles, third-best on the team and with injuries in the linebacking corps, his ascension has been vital for the Terps."
3,JJB SPORTS saw its shares collapse nearly 20 per cent yesterday after it broke off talks with the private equity giant Cinven and posted dismal first-half sales.
4,Shakespeare may have written his plays with a quill pen but now the Bard #39;s works are taking a leap into the digital age as the British Library publishes some of the earliest editions of his plays on a new Web site.
2,The king of Breeders #39; Cup trainers is pursuing his record 18th victory on horse racing #39;s biggest stage in a surprising way.
3,"Deutsche Bank AG and Thomas Weisel Partners LLC will pay a total of \$100 million to settle allegations they published misleading stock research to win investment-banking business, becoming "
4,Big game hunters may be off the hook in the latest twist of a prehistoric whodunit that tries to explain why bison populations sharply crashed thousands of years ago.
2," MONTREAL (Sports Network) - The Chicago Cubs acquired  catcher Mike DiFelice from the Detroit Tigers and outfielder  Ben Grieve from Milwaukee, both for a player to be named later,  Tuesday."
1,"A crane smashed into a wall during construction of an unfinished terminal at Dubai #39;s airport Monday, and witnesses reported at least eight workers were killed."
3,"For months, homeland security officials have privately debated how to blunt criticism of their planned aviation screening system that passengers and airlines complained was overly intrusive."
4,The first computer worm to eavesdrop on network traffic after it infects a computer has been discovered by security experts. The SDBot.
3,"No. 1 chipmaker Intel (INTC) on Thursday dramatically lowered its revenue estimates for the current quarter, a sign that the tech industry #39;s rebound may be slowing."
3,The software monolith extends an intellectual property plan to all.   Also: U.S. opposes the WTO's online gambling plan   hellip;.  Microsoft will offer a long awaited preview of its search-engine technology   hellip;. and more.
1,"BEIT LAHIYA, Gaza Strip Israeli tanks, armored vehicles and troops have pushed into northern Gaza in a raid aimed at militants who have fired rockets at Israeli towns."
2,"Redskins receivers coach Stan Hixon said Thursday that he is optimistic his son Drew, a receiver at Tennessee Tech who remains in a coma, will recover."
1,"MOSCOWA terrorist attack brought down at least one of the two planes in this week #39;s near-simultaneous crashes in Russia, authorities said yesterday after investigators sifting through the wreckage found traces of an explosive at one of the crash sites."
2,"Anna Smashnova-Pistolesi and Harel Levy each recorded upset wins and the star of the next generation of Israeli tennis stars, Shahar Pe er, qualified for her second WTA Tour event in as many weeks on an action-packed Monday."
3,"How long can the wireless networking boom last? Not much longer, according to major competitors of Nortel Networks. Ericsson, the giant of the wireless industry, put a damper on stock markets yesterday when "
3,"Royal Ahold NV, the food retailer that owns the US Giant chain, agreed to sell its Spanish business to Permira funds for 685 million euros (\$851 million)."
2, ATHENS (Reuters) - Five weightlifters tested positive for  drugs before the Athens Olympics and were banned from the  Games.
2,The Columbus Crew extended their unbeaten streak to an MLS record 14 games in a season with a 1-0 win over visiting DC United last night.
1,"Reuters - Peru should call in the\International Court of Justice to rule on its request for the\extradition of former President Alberto Fujimori from Japan,\state attorney Nelly Calderon said on Sunday, expressing\frustration at Japan's failure to act so far."
3,"Wal-Mart Stores Inc. (WMT.N: Quote, Profile, Research) shares fell 3 percent early Monday after the world #39;s biggest retailer cut its November sales forecast, casting a shadow over hopes for a bumper holiday shopping season."
2,"Four hundred fifty miles of Midwestern highway separate Iowa City from Ann Arbor, but the football programs at the University of Michigan and Iowa are much closer than that."
1,"Israeli Prime Minister Ariel Sharon has reaffirmed his commitment to a Middle East peace initiative, despite comments from one of his senior advisers who effectively dismissed the plan."
1,"Dutch police were laying siege to a house in The Hague today where an unknown number of terrorism suspects were holed up. Three policemen were injured by a hand grenade thrown when a raid was launched on the house, officials said."
4, quot;Application and subscriber-aware technology solutions like P-Cube #39;s provide the ability to differentiate and control new content-based data services.
2,"Dambulla, Sri Lanka - South Africa captain Graeme Smith won the toss and decided to bat in the third one-dayer against Sri Lanka here on Wednesday."
4,"Ziff Davis - RFID deals are really flying at the Frontline show. In one agreement, Linux handheld terminals will come together with wireless emulation for the enterprise. Through another, three IT firms will support Beaver Street Fisheries' bid to move RFID a step beyond mere compliance."
1, quot;They know they cannot defeat us militarily. But they are hoping they can win the test of wills. It #39;s a battle of morale.
3,It #39;s not just voters who are ready for the presidential campaign to end. Investors are anxious to put Tuesday #39;s election behind them.
2,New York Giants Coach Tom Coughlin isn #39;t coddling his prized rookie quarterback. After Eli Manning completed only six of 21 passes and threw two interceptions in Sunday #39;s 
2,AP - Lions coach Steve Mariucci said Saturday he was contacted by Notre Dame about its coaching vacancy but decided to stay with Detroit.
1,"BERLIN Hungary announced Wednesday that it would withdraw its 300 troops from Iraq, becoming the latest country in the 32-member US-led coalition to bow to public pressure and prepare to bring its soldiers home."
2,"Top-seeded Amelie Mauresmo shook off a slow start and beat Vera Zvonareva 3-6, 6-2, 6-2 to successfully defend her Advanta Championships title for her fifth tournament victory of 2004. Mauresmo seems poised to make a splash in next week's season-ending WTA Tour Championships in Los Angeles. The Frenchwoman has won two straight tournaments, including in Austria last week."
1,French Foreign Minister Michel Barnier said on Monday his ministry takes the overseas French citizens #39; security as its first priority following the killing of a Frenchman in Saudi Arabia on Sunday.
3,"The cost of term life insurance has never been cheaper. On that, industry experts agree. Over the past decade the price of term life insurance, the plain vanilla type that offers coverage only for a set number "
4,"Microsoft is warning Windows XP users to check for and remove any spyware that may be installed on computer systems before installing the Windows XP service pack 2 (SP2), security update."
4,Thumb through the book - then buy a clean copy from Amazon
3,"NEW YORK : New York crude oil smashed past 48 dollars a barrel for the first time, menacing the 50-dollar mark, as heavy fighting gripped the Iraqi city of Najaf. "
2,"The Revolution will expose some of their most experienced and respected players to the Major League Soccer expansion draft, scheduled for Friday to stock new teams in Los Angeles and Salt Lake City."
2,The Renault F1 Team Roadshow will touch down in Lyon on Sunday 5 September 2004 for a festival celebration of Renaults rich motorsport heritage.
3,"Cairn Energy, the UK-based oil  amp; gas major said on Tuesday that it plans to produce up to 5mn tons of crude oil from its recent discoveries in Rajasthan by the end of 2007."
2,"The Columbus Crew, the professional soccer team that represents Columbus, Ohio, didnt make it to the Major League Soccer championship game to be played on Sunday, but the Crew did compile an 18-game unbeaten streak during the regular season, best in "
1,"Description: Days of political unrest in Haiti #39;s capital leave at least 14 people dead. In Port-au-Prince, at least 10 civilians and four police officers have been killed since Thursday, in confrontations "
3,"US blue chips ended slightly lower on Wednesday after crude oil climbed above \$44 a barrel, renewing fears that high energy costs would cut into corporate profits."
4,"Chipmaker teams up with cell phone pioneer Craig McCaw. Also, PalmOne's latest Treo, and TV for the mobile set."
1,"TEHRAN (AFP) - Iran #39;s parliament passed a bill backing the resumption of uranium enrichment, as the government left the door open for further negotiations with Europe over the controversial practice."
1,"AP - Buoyed by President Bush's re-election and a political map with coast-to-coast Republican leaders, GOP governors gathered Thursday to cheer their electoral fortunes and discuss solving familiar fiscal problems at home."
1,"WASHINGTON -- The US general who predicted Osama bin Laden would be captured or killed this year struck a decidedly cautionary note yesterday, saying he doesn't know when or if the mastermind of the Sept. 11, 2001 terrorist attacks will be brought to justice."
3,Three British bankers indicted in Texas on fraud charges involving Enron Corp. appeared in a London court Tuesday for an extradition hearing.
4,"People soon will be able to carry guns and other dangerous weapons onto the grounds and parking lots of Reagan National and Dulles International airports, after officials "
3," WASHINGTON (Reuters) - U.S. durable goods orders rose, with  key components gaining strongly, and single-family homes sales  soared in September, reinforcing views the Federal Reserve will  raise interest rates further this year."
1," BELFAST (Reuters) - A former Protestant guerrilla was  sentenced to life imprisonment on Thursday for the murder of  Catholic lawyer Pat Finucane, one of the most controversial  killings in 30 years of sectarian conflict in Northern Ireland."
1,"When President Bush walked into Halifax #39;s Pier 21 on Wednesday, the stage was literally set for him to usher in a new era of partnership "
3,"By Francesco Guerrera in Hong Kong and Ian Bickerton in Amsterdam. Philips, the Dutch electronics company, on Thursday said it had sold its personal computer screens business to the Taiwanese group TPV Technology "
4,"The Solutions Sharing Network allows government entities to post their own tips, procedures and even in-house software."
4,"AP - More than 1,600 wriggling blue crabs, so young that their shells are still soft and see-through, are taken from gurgling tanks and dropped one at a time into coolers filled with nets. Minutes later, they are loaded onto trucks, driven to two tributaries of the Chesapeake Bay and dropped into the water."
2,CHICAGO - The Cubs and shortstop Nomar Garciaparra have agreed to terms on a one-year deal worth \$8 million. No option years were added to the contract.
1,"Syria will withdraw fully from Lebanon only after Israel ends its occupation of all Arab lands, Lebanese Defense Minister Mahmoud Hammoud declared yesterday."
3,"From one billionaire to the next: Two members of the Forbes list of the world #39;s richest people are players in deal surrounding Russian Aluminum, the world #39;s third largest producer of what #39;s known on the periodic table as  quot;Al quot;."
3,An international banking consortium has decided to suspend approval for the 10 billion (6.9bn) loan to Gazprom that would have financed the state-controlled company #39;s acquisition of Yukos #39;s most important oil production plant.
1,"Pakistani jet fighters and helicopter gunships launched air strikes on the South Waziristan tribal area bordering Afghanistan, killing dozens of people on Thursday, a witness said."
4,"AP - With oil reaching a record-high  #36;54 a barrel and natural gas doubling in price in the last two years, renewable energy is looking a lot better  #151; not just on environmental merits but on price."
3,"The US Supreme Court opted Monday not to hear a case involving the national  quot;do-not-call quot; list, effectively ending a bid by telemarketers to have the popular registry deemed unconstitutional."
4,"OCTOBER 12, 2004 (MACCENTRAL) - Hopinkton, Mass.-based EMC Corp. announced today that it has acquired Retrospect backup software maker Dantz Development Corp."
3,"Wednesday #39;s disclosure that government regulators have raised safety and soundness questions about mortgage-finance giant Fannie Mae has given new ammunition to critics of the company and its sister firm, Freddie Mac."
1,"Iran said on Sunday that the nuclear negotiations with the European Union (EU) in Paris were complicated but progressing, the official IRNA news agency reported."
2,"Top-seeded Lindsay Davenport won her fourth consecutive championship on Sunday, defeating second-seeded Vera Zvonareva 6-3, 6-4 in the Western and Southern Women #39;s Open finals."
2,"QUEBEC (CP) - Slovakia #39;s Martina Sucha captured the \$170,000 US Bell Challenge women #39;s tennis tournament Sunday, defeating American Abigail Spears 7-5, 3-6, 6-2 in the final."
2,"AP - Torry Holt of the St. Louis Rams became the first player in NFL history with five straight 1,300-yard seasons when he caught a 44-yard touchdown pass near the end of the first half against the New York Jets on Sunday."
3,"October 17, 2004 --  quot;The impact of the current surge in oil prices, though noticeable, is likely to prove less consequential to economic growth and inflation than in the 1970s."
1,"PARIS : The captors of two French journalists allegedly put forward new demands for their release, but French officials cast doubt on the authenticity of the demands and remained cautiously optimistic about securing their release."
4,"An exploit attacking the most recent Windows bug is circulating on Usenet, security experts said Tuesday, that crashes machines, yet another indicator that attackers will chase the vulnerability until they #39;ve launched mass mailing-style worm-based attacks "
1, ABIDJAN (Reuters) - French troops in Ivory Coast's main  city of Abidjan fired into the air on Monday to disperse  thousands of demonstrators massing to support the West African  country's President Laurent Gbagbo.
4,The Mac maker a likely winner in the digital living room
1,"AFP - US President George W. Bush will defeat his Democratic rival, John Kerry, in the November 2 election because he is leading in the polls in the key US swing states, the president's top political adviser said in an interview."
4,Parents who lost a son to cancer have built a website using their own funds to help other patients make sense of complicated treatment information. By Kristen Philipkoski.
1,"About 29 people, thought to be North Koreans seeking asylum, broke into a Japanese school in Beijing on Wednesday apparently by cutting through the wire perimeter fence."
2,"Once Mississippi State started rolling, New Orleans was no match for the 20th-ranked Bulldogs. Shane Power scored 17 points and Mississippi State extended its road winning streak to 13 games "
1,Groups fear that a vote amid persistent violence and a boycott by Sunnis would deprive the results of legitimacy.
1,"KAIPING, China -- In this city and many others in China, senior officials are embezzling tens of millions of dollars and fleeing overseas with their families."
1,Hong Kong is celebrating better than expected economic figures while China has started its first financial bailout of a private company.
3,"Reuters - Rising oil prices will weigh on U.S.\economic growth, but the increases seen so far will not derail\the expansion and need not fuel a troubling inflation, Federal\Reserve Board Governor Ben Bernanke said on Monday."
2,"The offseason didn #39;t just start, even if you #39;re beginning to detect the first signs of life from Toronto. The Blue Jays have been lying low until this point, waiting "
1,"AP - Howard Dean, with an eye on leading the Democratic Party in the wake of widespread election losses, said Wednesday that Democrats must campaign on their convictions and not give into the temptation to behave like Republicans."
1,"AFP - United Nations inspectors left after a week-long investigation into South Korea's past secret experiments with potential ingredients for nuclear bombs, officials said."
4,Semiconductor Manufacturing International Corp. (SMIC) said Wednesday it will defend itself against the latest allegations of patent infringement and trade secret misappropriation 
4,"VeriSign (Quote, Chart) has come out on the losing end in its breach of contract and antitrust lawsuit against the Internet Corporation for Assigned Names and Numbers (ICANN)."
4,"Microsoft (MSFT) and watch maker Swatch are offering a new line of wireless data watches, the companies said Wednesday, bringing the era of Dick Tracy wristwatch radios one step closer."
1,"If there are any democratic  quot;T #39;s quot; to be crossed and  quot;I #39;s quot; to be dotted, Palestinian President Yasser Arafat did not leave one undone during his keynote speech to MPs at his West Bank headquarters in Ramallah. Arafat looked rejuvenated and emphatic as he ..."
4,"VoIP company suffers ""delays,"" the second glitch in two weeks. Those affected are told to reboot their adaptors."
2,The United States Soccer Federation has struck a profitable vein since it began sending its national teams to the Boston area in 1991. The US men's team has an 11-1-3 record in Norfolk County and even the defeat -- 2-0 to the Netherlands -- prepared the Americans for their greatest series of conquests several days later in the 2002 World ...
1," KABUL, Afghanistan (Reuters) - The toll from Sunday's car  bomb blast in Kabul rose Monday with different accounts from  Western security forces and Afghan officials suggesting as many  as a dozen people may have been killed."
2,Ryan Clark may start in place of injured safety Matt Bowen when the Redskins play the Bears on Sunday.
2,"AP - In the tumult of the visitors' clubhouse at Yankee Stadium, champagne pouring all around him, Theo Epstein held a beer."
4,"CAPE CANAVERAL, Fla. - NASA #39;s departing boss, Sean O #39;Keefe, said Friday he does not regret canceling the last shuttle mission to the Hubble Space Telescope - or anything else during his three years on the job."
1,"TYPHOON Chaba is expected to bring heavy rain and high winds to large areas in south-western Japan over the weekend. At noon (1pm AEST), the typhoon was located at 290km west of Minami-Daitojima island, with "
2,"BASEBALL Anaheim (AL): Signed bench coach Joe Maddon, third base coach Ron Roenicke, first base coach Alfredo Griffin, hitting coach Mickey Hatcher, bullpen coach Orlando Mercado, pitching coach Bud Black, and bullpen catcher Steve Soliz. Colorado (NL): Removed vice chairman Jerry McMorris from board of directors. Florida (NL): Named Mark Wiley pitching coach and Harry Dunlop bullpen coach. Los Angeles ..."
1,"AP - A French soldier who locked himself in an explosives depot and threatened to blow it up surrendered Monday, ending a three-day standoff, the Interior Ministry said."
4,"Last week, I received an e-mail that read Steve Jobs, Bono and The Edge invite you to attend a special event. (Larry Mullen and Adam Clayton were indifferent about my attendance, I guess "
2,"LONDON : England international defender Jonathan Woodgate, Real Madrid #39;s new recruit from Newcastle, will be out of action for a month but that did not deter the Spanish giants from signing him."
3,"Wednesday's disclosure that government regulators have raised safety and soundness questions about mortgage finance giant Fannie Mae has given new ammunition to critics of the company and its sister firm, Freddie Mac."
2,"On a day when the French Open men's and women's champions lose and blame their defeats on fatigue, a bouncy, energetic Andre Agassi advances to the weekend for the 14th time in 19 U.S. Open appearances."
2,AP - Damon Stoudamire scored 33 points and Zach Randolph added 22 points and 18 rebounds to lead the Portland Trail Blazers to a 110-98 victory Friday night over the Milwaukee Bucks.
1,"NAJAF, Iraq (Reuters) - Iraq #39;s interim government said it had defused a Shi #39;ite rebellion in Najaf on Friday without a shot being fired, but rebel militiamen denied police had seized the city #39;s sacred Imam Ali Mosque from their control. "
1,AFP - Pakistan and India held talks to hammer out an agreement on giving advance warning of ballistic missile tests and other steps to avert any accidental launch of nuclear weapons.
1,She argued the hard-liners' case on Iraq. But the next Secretary of State remains an ideological puzzle
4,"A total lunar eclipse expected to create views of a blood-red moon will be visible tonight throughout most of North America, weather permitting."
3,"It #39;s the real thing: \$500,000 for William T. Dwyer High School during the next seven years. Administrators just finished negotiating a new contract with Coca-Cola, which will have exclusive "
2,"Sports fan Jarno Trulli got a rare privilege this week as he visited the Olympics in Athens, as a guest of PUMA."
4,"PC World - A high-capacity cigar, keys to the Internet, disc repair tools, Bluetooth add-on kit, and more."
4,"The mobile service tower (MST) was retracted from around the Boeing Delta 2 rocket at launch pad 17B at Cape Canaveral, Fla., Thursday, Nov. 4, 2004, exposing the vehicle as the countdown entered its final hours before liftoff."
4,"US researchers recently discovered specific doorways in mice brain cells, called receptors, which could hold the key to nicotine addiction."
2,"Florida coach Ron Zook was fired yesterday after two-plus years and a stack of embarrassments on and off the field, satisfying a growing groundswell for his ouster that began the day he replaced Steve Spurrier . Zook will finish out the season while athletic director Jeremy Foley and school president Bernie Machen search for another coach."
3,Brokerage LaBranche  amp; Co. on Monday said it swung to a loss in the third quarter on lower equity volumes and volatility at its specialist unit.
2,Lee Hendrie has insisted it is  quot;vital quot; for Aston Villa that David O #39;Leary remains as manager on a long-term basis. And the free-scoring midfielder admitted he would have quit the club 18 months ago if O #39;Leary had not replaced Graham Taylor at the helm.
2,"Yankees righthander Kevin Brown had the pins removed from his broken left hand, and will throw a bullpen session today."
