class,text
4,"Atomic clocks may be headed into cell phones, thanks to a breakthrough by federal researchers. Scientists at the National Institute of Standards and Technology have demonstrated the heart of an atomic clock "
4,Flawed software code used by numerous Microsoft applications to render images mean that a specially constructed image file could hijack a computer or spread a virus.
4,"Even before Burt Rutans SpaceShipOne soared on her second flight in six days to win the Ansari X Prize, the flamboyant British entrepreneur Sir Richard Branson, owner of Virgin Atlantic Airline, decided that he had seen an opportunity to make even more "
3,"China will strengthen ties with foreign partners to revitalize the economy in Northeast China and to further co-operation in Northeast Asia, a senior official said."
1,"The European Union welcomes Iran #39;s new offer to suspend sensitive nuclear activities, saying Tehran should be given a few more months to comply before any tougher action, the Netherlands said on Thursday."
2,"Baseball isn #39;t only coming to Washington, it #39;s also coming to a Washington-based company. XM Satellite Radio Holdings will pay \$59 million a year to broadcast most regular and post-season "
4,"November 29, 2004 - Being part of the PSP launch doesn #39;t just mean being the first to play PlayStation Portable games. Sure, that part #39;s cool -- as is lording over your friends and family as one of the only "
4,Technology brings a whole new light to history.Technology brings a whole new light to history.Technology brings a whole new light to history.
1,"At least two of the crew members of a cargo plane that crashed in Canada were South Africans, Ronnie Mamoepa, foreign affairs department spokesperson, confirmed today."
3," Republican gains in the Senate from last month's elections have pumped new life into the administration-backed move to open the Arctic National Wildlife Refuge to oil and gas drilling, prompting environmentalists to mount what one of them called ""the fight of our lives"" to defeat the proposal."
4,The GC89 PC Card combines global EDGE coverage with the WiFi technology in a single card which is compatible with both Windows and Macintosh computers.
4,"Four hundred years ago, sky watchers, including the famous astronomer Johannes Kepler, best known as the discoverer of the laws of planetary motion, were startled by the sudden appearance of a ""new star"" in the western sky, rivaling the brilliance of the nearby planets."
2,TWO Boudewijn Zenden goals put Middlesbrough firmly on the UEFA Cup map at the Riverside today. The victory was richly deserved and means Middlesbrough are likely to qualify from Group E into the latter knockout stages.
2,"ATHENS -- Through five games, the US women are outscoring opponents by 29 points a game. They've been dominant to the point of ennui. They crush their opponents on the glass, hand out twice as many assists per game, and, generally, have it their way, every game. They lead the Olympics in nine statistical categories."
4,"In a long awaited move, Dell has finally re-entered the blade server market with the release of the Dell PowerEdge 1855 server system."
3,SYDNEY: Australian milk producer National Foods Ltd said today its board has unanimously rejected as too low a \$A1.62 billion (\$NZ1.
2,"ORCHARD Park, NY The New England Patriots posted their record-tying 18th consecutive victory by scoring two touchdowns in the fourth quarter of a 31-to-17 win at Buffalo."
4,"This image taken by cameras on the US-European spacecraft Cassini on Sunday Oct. 24, 2004, reveals Saturn #39;s moon Titan #39;s bright  quot;continent-sized quot; terrain known as Xanadu."
4,"MacCentral - Some may have thought Apple's iPod Socks, first show at Apple's special event in San Jose, Calif. in October, were an elaborate joke. If so, the joke's on them, because iPod Socks are now available for pre-order from the Apple Store for US #36;29. Apple plans to ship the iPod holders in early December. iPod Socks ship six to a box, and come in hues including green, purple, grey, blue, orange and pink. The knit holders fit all iPod models, according to Apple."
4,\\Great writeup from Tim Bray WRT Dynamic Java  ...\\Here's the funny part.  Whats up with all the damn coffee in these pictures?\\One can only come to the conclusion that caffeine makes you smart as hell!\\caption: Coffee\\caption: Coffee and Java\\caption: Java and Coffee\\
2,"The last time Adam Vinatieri faced the Miami Dolphins, in a 24-10 victory Oct. 10 at Gillette Stadium, the Patriots kicker missed a 47-yard attempt wide right to end a string of seven consecutive successful field goal tries."
3," ALEXANDRIA, Va. (Reuters) - The U.S. Air Force's former No.  2 weapons buyer was sentenced to nine months in prison on  Friday after telling the court she had given Boeing Co. a  rival's secret data and inflated weapons deals to ingratiate  herself with the company, her future employer."
2,"The Northeast-10 Conference race is entering the final third of the season, and the four teams atop the standings are separated by just a half-game."
2,Colin Montgomerie drew first blood for holders Europe with a birdie-three at the first hole as the 35th Ryder Cup began at Oakland Hills under cloudy skies on Friday.
3,"France #39;s public deficit will drop by about euro10 billion (US\$12 billion) in 2005 to conform with European Union rules, the French prime minister said in an interview."
2,"Houston, TX (Sports Network) - Morgan Ensberg went 2-for-4 and drove in three runs to lead Houston over Atlanta 8-5 in Game 3 of their National League Division Series at Minute Maid Park."
2,"MOTEGI, Japan: Local hope Makoto Tamada of Japan has taken pole position with a record lap time for the weekend Japan Grand Prix as world champion Valentino Rossi, seeking his fourth straight title, secured third place."
1,The United States is seeking a full investigation into the death of 78 Thai Muslims in military custody after violent protests in the south of the country.
4,"Hurricanes Charley, Frances and Ivan have cost NASA a least a week's worth of work and upset its tight schedule for resuming shuttle flights, throwing into doubt the space agency's plans to launch Discovery in early spring."
2,"El Paso #39;s Jennifer Han won her fourth national championship at the National Golden Gloves boxing tournament Saturday in Chicago, earning a decision against Jennifer Barber of California in their 125-pound title bout."
2," NEW YORK (Reuters) - Carlos Silva tossed a one-hitter  before leaving the game with a bruised ankle as the Minnesota  Twins won their eighth straight game, downing the Chicago White  Sox 6-1 on Wednesday."
2,"Ricky Williams has stuck it to the Dolphins one more time. By deciding once again he wants no part of playing football, he ruins any chance Miami had of trading him in the offseason for a No."
3,"When corporate America came looking for raises last year, Boston's largest mutual funds routinely turned them down, voting in hundreds of cases against lucrative stock and options packages for senior executives, according to proxy-vote data released last week for the first time."
4,"AP - The Henry Ford  #151; a venue that includes the Henry Ford Museum, Greenfield Village, an IMAX Theatre and the Ford Rouge Factory Tours  #151; is teaming up with one of the country's largest Internet providers."
4,"November 04, 2004 - We sometimes hear of big-name games being released simultaneously across the globe. Typically this means the game will be released on the same day in each supported territory, although "
4,"AFP - IBM's deal to sell its personal computer business to China's Lenovo, a move likely to reshape the industry, signals the PC has evolved into a mass consumer item with little profit, analysts say."
4,"Macromedia on Monday is announcing Captivate, formerly known as RoboDemo, for recording onscreen activity and building software demonstrations and interactive simulations."
4,"AP - Sony Corp.'s music unit is abandoning its CDs that use built-in technology that limits copying them, after pushing the program for two years."
2,"If Michael Owen had any regrets after scoring his first Real Madrid goal it was just that the timing might have been better. After all, he said,  quot;it could have come sooner quot;."
4,"Avnish Bhatnagar has always lusted after fast cars like racy BMWs. But when the California computer programmer and his wife had their first baby this year, they needed something more practical."
4,"If you're under 40 and smoke, your risk of having a heart attack is significantly greater than someone your age who doesn't, a new study finds. According to the report, male smokers between the ages of 35 and 39 were almost five times as likely to have a nonfatal heart attack as were nonsmokers."
3, SINGAPORE (Reuters) - Oil prices held steady on Thursday as  data showing stubbornly low U.S. heating fuel supplies ahead of  winter stemmed a rout of nearly \$10 since late October.
1,"Amid repeated cautions that no breakthrough was expected, the prime ministers of India and Pakistan came together Wednesday for a rare meeting, despite tough positions stated "
2,Gil Meche pitches a five-hitter for his second career shutout and Raul Ibanez hits a two-run shot to lead Seattle over Boston 2-0 Sunday.
4,"In the latest of a flurry of deals among net providers, Claranet buys the UK wing of US business Via.Net Works."
2,"AP - Florida State and Miami were originally scheduled to play Monday. Instead, they spent the day trying to recover from Hurricane Frances."
1,President Pervez Musharraf #39;s loyalist Shaukat Aziz was elected as Pakistan #39;s Prime Minister in a National Assembly vote boycotted by the opposition in protest of the speaker #39; decision not to permit their jailed candidate Javed Hashmi to take part in the 
3,"Northern Nevada customers of Cingular Wireless and AT amp;T Wireless will see no changes in existing rates after Tuesdays approval of their \$41 billion merger, officials said."
3,"The yen advanced against the dollar on Friday, shrugging off weak third-quarter growth figures for Japan as market worries persisted about the huge US deficits."
3,"Regulators Monday fined a unit of Citigroup Inc., the nation #39;s largest financial institution, \$250,000 for using what they said was  quot;inappropriate quot; sales material for hedge funds."
1,"SPRINGFIELD, Mass. - A district attorney said Monday that he would not prosecute Roman Catholic Bishop Thomas Dupre on child rape charges because the statute of limitations has expired in the case..."
2,"AP - The Georgia Bulldogs hardly were used to this sort of treatment. They limped off the field at the Georgia Dome, unable to rely on any what-ifs or might-have-beens. For the first time in coach Mark Richt's tenure, the Bulldogs knew what it felt like to be dominated by a better team."
4,Two prominent open-source software groups have rejected a proposed technology standard backed by Microsoft Corp. that would close a loophole used to send unsolicited commercial 
4,"AP - A troubled, 20-year journey to create the world's most powerful optical telescope is nearing an end, with astronomers hoping to begin using the instrument to look for heavenly breakthroughs early next year."
3,Skeptics wonder how the 10 newest members of the European Union will ever meet the economic conditions for adopting the euro.
4,"Storage vendors Hewlett-Packard, Cisco, EMC, and Microsoft are trumpeting new products this week that foreshadow the near future of storage."
1,AP - David Graham says he was surprised by the reception he got back at his Food and Drug Administration office after telling Congress the government had allowed unsafe drugs to remain on the market.
2,"If it came as a surprise that Kelly Holmes should win two gold medals at the Athens Olympics, her victory in White City last night, where she became the BBC Sports Personality of the Year, was a racing certainty."
3,"BP Plc, Europe #39;s largest oil company, and its partners in an Indonesian liquefied natural gas venture agreed to sell about \$2 billion of the fuel over 20 years to a unit of South Korea #39;s largest oil refiner."
4,Swatch has introduced the Paparazzi watch. The Paparazzi is a watch capable of displaying information it receives wirelessly through FM radio transmissions.
2,NHL star Todd Bertuzzi pleaded not guilty on Thursday to an assault charge for an on-ice attack that left a player with a fractured neck and shocked the sporting community.
2,International Boxing Federation super lightweight champion Kostya Tszyu says he only wants  #39;big fights #39; in the future. Speaking after he had claimed a third-round TKO of American Sharmba Mitchell in Phoenix 
3,"It took three 1,000-pound satellites to launch Sirius Satellite Radio Inc. #39;s subscription radio service two years ago. Now the company is betting that one man - shock jock Howard Stern "
2,"College hockey: MEN -- Wentworth at Suffolk, 6 p.m.; Boston College at Harvard, 7 p.m.; New Hampshire at Merrimack, 7 p.m.; AIC at Holy Cross, 7:30 p.m.; WOMEN -- Harvard at Brown, 7 p.m."
4,"Analyzing the success of the iPod mini in Japan, JapanConsuming writes,  #147;The iPod mini is in fact one of those all too rare examples of an ideal product for the Japanese market. It is a product that does something useful, does it really well, and looks terrific too. None of these factors on their own is enough to make the iPod mini a success; their combination, through deft and creative implementation of function, is what makes the difference. Add in some tried and tested limited supply marketing, a store that looks as good as Louis Vuitton and a high impact award winning advertising campaign that has covered Tokyo in pink, green and yellow for weeks, and some of the reasons for the iPod mini phenomenon can be understood. #148; Aug 10"
1,Iran on Sunday rejected European demands it halt its pursuit of nuclear technology but reiterated its readiness to provide assurances it would not use that technology to build atomic weapons.
1,BOTH Prime Minister John Howard and Opposition Leader Mark Latham today played down new poll results which showed the Government clawing back some of Labor #39;s lead.
3,"HBOS has yet to enter the bidding for Abbey National, yet it is already fighting its corner as if in the full intensity of battle."
4,"Siemens AG has acquired Chantry Networks, a step that will extend its enterprise offerings and Voice over Internet Protocol into the wireless local area network space."
2,"The Miami Dolphins plan to play the Pittsburgh Steelers on Sunday despite the threat of Hurricane Jeanne. The hurricane is expected to hit Florida #39;s east coast this weekend, most likely Sunday morning."
1,ISLAMABAD: Prime Minister Chaudhry Shujaat has resigned from his office and the federal cabinet has also been dissolved. The national assembly will elect the leader of the house on Friday while the new prime minister will take oath on Saturday.
2,"and admitted it felt like  quot;blasphemy quot;. Just like Tiger Woods at the 2000 Open, the Ulsterman kept out of every "
2,Andrew Symonds #39; unbeaten 104 anchored Australia to a challenging total of 269 for six off 50 overs on Saturday in the NatWest one-day cricket international against Pakistan at Lord #39;s.
3, LOS ANGELES (Reuters) - A federal appeals court on Thursday  delivered a stinging blow to the anti-piracy efforts of major  movie studios and music companies by ruling several Internet  file-sharing software companies are not liable for copyright  infringement.
3,The US Food and Drug Administration has granted fast-trackapproval to Tarceva (erlotinib) to treat advanced non-small cell lungcancer that has failed to respond to other therapy.
2,"Despite a striker crisis, Juventus inflicted a first defeat of the campaign on impressive risers Messina by a 2-1 tally. Marcelo Zalayeta and Pavel Nedved grabbed goals on either side of the break to lead Il Bianconeri."
2,"Kobe Bryant would love to have Karl Malone back with the Los Angeles Lakers, and believes comments he made in a recent radio interview were misunderstood."
3,SAN FRANCISCOOracle Corp. reported a 16 per cent rise in quarterly net income yesterday as the world #39;s second-largest software company benefited from steady demand for its flagship database software.
4,AFP - Internet networking giant Cisco Systems agreed to acquire closely held Internet protocol service provider P-Cube for 200 million dollars in cash and options.
3,"Continental Airlines Inc. said yesterday it would cut about 425 jobs, or 1 percent of its work force, through staff reductions, attrition, and elimination of unfilled vacancies as part of an effort to trim expenses by another \$200 million."
2,AP - Joe Paterno ended his 39th season at Penn State as a winner.
3,Episode two of The Apprentice heats up with a cool treat and a surprise ego boot.
3,"Business India: Hyderabad, Nov. 15 : Microsoft Corp. will hire several hundred new staff at its new Indian campus in the next year, its chief executive said today-- a move aimed at strengthening its presence in Asia #39;s fourth-biggest economy."
3, LONDON (Reuters) - Oil prices surged to new record highs on  Monday near \$50 for U.S. crude as Nigeria emerged as the latest  focus for worries about supply security on world energy  markets.
4,"By MARCIA DUNN    CAPE CANAVERAL, Fla. (AP) -- Oxygen and food will be worrisomely low on the international space station by Christmas, and it's crucial that a Russian supply ship get there by then, a top NASA official said Friday..."
2,Hopkinton senior Jon Curran shot an even-par 71 to win the MIAA Division 2 state golf individual title yesterday and propel the Hillers to their second straight state championship.
3,"The hometown favorite, Hoffman Estates-based Lakewood Homes, can put its fourth consecutive consumer satisfaction trophy on the shelf, besting national home builders with major presence in the Chicago area market."
4,"Tokyo, Aug. 23 (Jiji Press)--NTT DoCoMo firmed on the Tokyo Stock Exchange Monday morning following a media report that it will start procuring mobile phone handsets made by Motorola Inc."
2,"PHOENIX -- Wally Backman was hired Monday as manager of the Arizona Diamondbacks, taking over a team coming off one of the worst seasons in major league history."
4,"The Pentagon's last hope of flight-testing critical new elements of an antimissile system, before activating the system this autumn, appeared to vanish with the disclosure that the next flight test has been postponed."
2,"At times during Sunday #39;s 13-10 victory over the Buffalo Bills, some of the Raiders were Xs when they should have been Os and still turned the outcome into a plus."
3,"Customers of the Times Square Toys  #39;R #39; Us yesterday said the flagship store lacked its normal Christmas bustle, one day after pepper spray forced the evacuation of some 3,000 customers."
4,"Apple Computer today sent out an invitation to press outlets to attend a special event next week. Steve Jobs, Bono and The Edge invite you to a special event."
2,"Jiri Novak of the Czech Republic rallied to beat the American Taylor Dent, 5-7, 6-1, 6-3, on Sunday to win the Japan Open men #39;s final in Tokyo."
1,Reuters - President Bush Wednesday warned Iran\and Syria not to meddle in Iraq ahead of elections scheduled\for January 30 and voiced new hopes of forging peace between\Israel and the Palestinians.
4,Cell phone executives say new data-oriented services such as TV will help bolster an industry in a precarious state.
4,"SANTA CLARA, CALIFORNIA - Chip designer Arm Ltd.'s new Cortex family of processor cores will help designers of mobile and embedded devices build powerful systems that use less memory, the company said Tuesday at its developer conference."
3,"In Sept. 10 LOS ANGELES story headlined  quot;Interstate Bakeries says banks boost credit, quot; please read in the headline ...  quot;Interstate Bakeries says banks allow more credit."
1,"Two Buddhist men have been shot dead by unidentified assailants in Thailand #39; s south, hours before a trip by Prime Minister Thaksin Shinawatra to the region, police said."
3,"Shares of PortalPlayer Inc. (PLAY.O: Quote, Profile, Research) jumped as much as 62.4 percent in their first day of trading on Friday after the company #39;s initial public "
4,"By JOSEPH B. VERRENGIA    (AP) -- With 6,000 characters to memorize, Westerners shudder at the idea reading even the most basic street signs and instructions in Chinese..."
3," DETROIT (Reuters) - General Motors Corp. &lt;A HREF=""http://www.investor.reuters.com/FullQuote.aspx?ticker=GM.N target=/stocks/quickinfo/fullquote""&gt;GM.N&lt;/A&gt; will offer  cash rebates as high as \$7,500 on some 2004 models in its new  ""Red Tag"" incentive program to be launched on Dec. 10 in an  effort to boost sales after two disappointing months, dealers  said on Wednesday."
4,"Scientists discover a new group of giant apes in central Africa, which could be a new species of primate."
4,"com September 27, 2004, 2:20 PM PT. Toshiba on Monday announced in Japan that it #39;s upping the song capacity of its Gigabeat line of hard drive-based digital audio players."
1,Fischer has been in custody since he was detained by Japanese airport authorities on July 13 with an invalid American passport. He is wanted in the US for violating international sanctions against the former Yugoslavia in 1992.
1,"On Thursday, Sen. John Ensign of Nevada joined Sen. Norm Coleman of Minnesota in calling for the immediate resignation of UN Secretary-General Kofi Annan."
2,LOS ANGELES: Teenager Maria Sharapova capped her stunning tennis year by overcoming an injured Serena Williams 4-6 6-2 6-4 in the final of the season-ending WTA Tour Championships yesterday.
1,The United States lobbied its allies Monday to have Iran hauled before the UN Security Council over its nuclear program as the world body #39;s atomic watchdog agency considered 
4,SEATTLE Amazon-dot-com says things are running normally again on its Web site after a sometimes sluggish Monday. A spokeswoman says the world #39;s largest Internet retailer began experiencing  quot;a slowness quot; Monday morning.
4,"Thermal printer produces great-looking snapshots, but they don't come cheap."
3,Cazenove is planning to end 181 years of independence by announcing today it is creating a joint venture with the Wall Street investment bank JP Morgan Chase.
3," NEW YORK (Reuters) - Procter   Gamble Co. &lt;A HREF=""http://www.investor.reuters.com/FullQuote.aspx?ticker=PG.N target=/stocks/quickinfo/fullquote""&gt;PG.N&lt;/A&gt; on  Wednesday said quarterly profit jumped 14 percent, boosted by  strong sales and a gain from the recent divestiture of its  juice business."
4,AP - The White House on Wednesday told 15 federal agencies to better share scientific data about the Earth among themselves and with other nations.
3,"A group of industry, farm and labor groups, seeking to put pressure on the Bush administration before the presidential election, petitioned the government on Thursday to file an unfair trade practices case against China."
1," WANA, Pakistan (Reuters) - Pakistani jet fighters and  helicopter gunships pounded a suspected terrorist training camp  near the Afghan border on Thursday, killing at least 50 mostly  foreign militants."
4,Friday product launch will count on music player to deliver cool factor to once-stodgy printer maker.
2,"The new young guy for the Knicks, this season #39;s new young guy, fast and hungry and talented, is Jamal Crawford. He knows all about bad teams, because he has played his whole NBA career with the Bulls."
1,"RAMALLAH, West Bank Yasser Arafat can be buried at his battered headquarters here as the Palestinians requested, the Israeli government decided Wednesday in a gesture to his likely successor, Mahmoud Abbas."
1,A woman is allowed to bring Kenya's first lawsuit for alleged discrimination for being HIV positive.
3,"TOKYO, Japan -- Tokyo stocks slipped for a second straight day Friday as tech issues such as Fujitsu, NEC and Kyocera lost ground."
1,Israel raises Palestinian hackles by planning a Gaza burial for Yasser Arafat as he lies ill in a Paris hospital.
3,"Howard Stern, one of the most popular but polarizing personalities in radio, has proclaimed his emancipation from the decency czars of the Federal Communications Commission."
2," VIERA, Florida (Sports Network) - On the day Major League  Baseball owners delayed the vote to finalize the move of the  Expos to Washington, DC, the club on Thursday signed manager  Frank Robinson to a one-year contract."
2,"As Papa Griffith used to say every Jan. 1, ""Well, it looks like we made it through another year."""
1,President Bush tried to mend relations in Latin America with fresh promises of immigration reform Sunday while a new security spat surfaced with Chile after an embarrassing fracas in which Bush intervened.
1,"As Russians bury their dead, officials look at terrorist links to Chechen rebels."
1,MANAMA: Bahrain last night joined international efforts to secure the release of a British engineer held hostage in Iraq. Minister of State for Foreign Affairs Dr Mohammed Abdul Ghaffar urged the kidnappers to free Ken Bigley and other hostages soon.
1," MOSCOW (Reuters) - Bribery and negligence by officials  helped Chechen suicide bombers get on board two passenger  planes last month and blow them up, Russia's chief prosecutor  said in an interview published on Wednesday."
3,"PC shipments grew between nearly 10 and 12 percent in the third quarter, paced by shipments to enterprise organizations, according to announcements from two market-research firms on Tuesday."
2," NEW YORK (Reuters) - Defending U.S. Open champion Andy  Roddick has qualified for the end-of-season Tennis Masters Cup,  tournament organizers announced on Tuesday."
