class,text
4,The man behind Space Ship 1 brought his love of adventure to the University of Texas on Friday. Burt Rutan spoke to students about space tourism.
2,"Jimmy Jerkens didn't learn how to be a trainer from a racing giant. He was taught by  quot;The Giant Killer, quot; the nickname given to his father, Allen."
4,"MOSCOW - Russias military has postponed the launch of a new-generation space booster rocket scheduled for this week, the defence ministry said on Thursday."
1,Prime Minister Junichiro Koizumi headed to northern Japan to survey the damage wrought by the deadliest earthquakes to hit the country in nearly a decade as the death toll jumped to 31.
4,"In an advance that could lead to lighter spacecraft and smarter cars, researchers have developed a new technique for producing a high-quality computer chip that is much more resistant to extreme conditions than the silicon found in most of today #39;s "
4,PEC Solutions Inc. said yesterday it had acquired AC Technologies Inc. for \$46.7 million in cash plus \$3 million in employee bonuses and payouts. Both companies are government contractors based in Fairfax.
4,"HP and Cisco spooked investors with recent comments about sales, but analysts say the overall tech market is still inching along."
2,The New England Patriots extended their remarkable winning streak to 20 games on Sunday and tied another NFL record in the process in their 30-20 win over the Seattle Seahawks at Gillette Stadium.
1,Dozens of people were killed in floods throughout Haiti after tropical storm Jeanne lashed the Caribbean nation during the weekend.
4,"Sony Corp. said on Monday retailers had almost completely sold out of the Play Station Portable on its first day in Japanese stores, marking a strong start for the company #39;s first handheld game machine."
1,"Among over 20 killed separatists in combat in Chechen on Monday morning, one was identified as one of the organizers of the May 9 terrorism act in Grozny, in which Chechen President "
3,"Kmart Holding Corp. (KMRT.O: Quote, Profile, Research) said on Thursday it would sell 45 stores for \$524 million to Sears, Roebuck and Co."
3,"After a preliminary analysis of a late-stage drug trial, Gilead Sciences of Foster City said its two drugs Viread and Emtriva are better able to control levels of HIV than Combivir, a treatment made by competitor GlaxoSmithKline Plc."
3," NEW YORK (Reuters) - Footwear chain Payless ShoeSource Inc.  &lt;A HREF=""http://www.investor.reuters.com/FullQuote.aspx?ticker=PSS.N target=/stocks/quickinfo/fullquote""&gt;PSS.N&lt;/A&gt; on Thursday posted worse-than-expected sales at stores  open at least a year in August and said its president, Duane  Cantrell, will step down effective immediately, sending its  shares down 8 percent."
2,"Calgary, AB (Sports Network) - Calgary Flames head coach Darryl Sutter underwent an emergency appendectomy and is expected to make a full recovery."
3,"SAN JOSE, Calif. (CP) - Google Inc. says its initial public shares are priced at \$85 each, at the low end of the Internet search giant #39;s downgraded estimates. "
1,The second hearing in the trial of three Americans accused of torture and running a jail begins in Kabul.
2,"Stephen Gallacher, at the age of 29 an unconsidered and probably under-rated Scot, leaped from relative obscurity to overnight fame yesterday when he won the Dunhill Links Championship, not just in his native Scotland but here at the home of golf."
3,"Moody #39;s Investors Service on Friday said it may raise its ratings on global energy company AES Corp.(AES.N: Quote, Profile, Research) , citing lower debt and improved cash flow."
1,"JEDDAH, 17 December 2004 - A call by London-based dissident, Saad Al-Faqih, to his followers to stage anti-government demonstrations across the Kingdom fell on deaf ears yesterday."
1,"ADDIS ABABA, 8 December (IRIN) - With the threat of renewed regional conflict in the Democratic Republic of the Congo (DRC), the African Union #39;s (AU #39;s) Peace and Security Council announced on Tuesday that it would seek a greater role in helping to disarm "
1,Iraq #39;s interim government has resumed talks to pacify the western town of Falluja and avert a military assault on the rebel stronghold that has faced heavy US bombardment in recent days.
1,"Security was tightened around Paris today after a bomb exploded outside the Indonesian Embassy, slightly injuring nine people. French Interior Minister Dominique de Villepin said a rigged package exploded "
1,Egypt's president makes a hurriedly arranged visit to Syria a day after a divisive debate in the Arab League.
1,Hong Kong - A Hong Kong bank that trashed 83 safety deposit boxes and their valuable contents apologised on Wednesday for the blunder and offered customers a compensation package worth up to 12.
4,"Open source application servers vendor JBoss Inc will today release version 4.0 of its core JBoss AS product, which is claimed to be the first open source application server to support AOP (aspect oriented programming) for Java."
2,"HOUSTON -- The attitude of every team in the postseason is: concentrate on today and let tomorrow take care of itself. That would be a good strategy for baseball-watchers, too, especially when they watch Carlos Beltran."
4,"The conservation agency World Wildlife Fund, or WWF, has warned that man-made chemicals pose a serious threat to polar bears. The WWF says three new scientific studies show "
4,"AP - Mount St. Helens vented more steam Monday as new thermal images revealed that parts of the lava dome in its crater are piping hot, a sign that magma continues to rise within the volcano."
1,"AP - Insurgents battling U.S. and Iraqi forces in the northern city of Mosul have been trying to drag the Kurdish minority into their fight and set off a sectarian war, Kurdish and Arab officials say."
4,LG Electronics revealed Monday that is has set a new technological benchmark by producing the world #39;s first terrestrial digital-media-broadcasting (DMB) cell phone that allows consumers to watch programs and use normal dialing functions simultaneously.
3,Tokyo stocks fell Friday morning as investors avoided significant moves ahead of a long weekend. The dollar was down against the Japanese yen.
2,"EAST ST. LOUIS, Ill. - Former NHL tough guy Mike Danton was sentenced Monday to 7 1/2 years in prison for trying to have his agent killed."
4,"SAN FRANCISCO - Computer Associates International Inc. has revoked perks, including office space and home security services, that it handed out to former Chairman and Chief Executive Officer (CEO) Sanjay Kumar after he left the company last month."
4,"com October 1, 2004, 11:46 AM PT. There #39;s no doubt the Internet will continue to make its mark in the world of business and technology."
2,"(Sports Network) - The San Antonio Spurs begin a stretch of five road contests in six games this evening, when they tangle with the Atlanta Hawks at Philips Arena."
4,"Former executives from companies such as Sun Microsystems, BEA Systems, and Oracle this week are formally launching a venture called Cassatt, which is endeavoring to automate IT operations, leverage commodity hardware and software, and govern network compute cycles in a grid-like manner."
1,"Reuters - Senate Republicans and Democrats on\Tuesday battled over blame for a record increase in Medicare\health premiums, which Democratic presidential candidate John\Kerry has criticized in his campaign to unseat President Bush."
1,"The Woody, a modest gaff-rigged Hudson River ferry sloop, sets sail every weeknight from early spring to late fall, taking visitors for free on a two-hour sail along the Hudson."
4,"Chicago, August 28: Options on Google Inc, one of the year #39;s hottest new stocks, ended their first day of dealings among Friday #39;s most actively traded issues."
3,"Airtel has signed an agreement with six cellular operators to form Bridge Mobile Alliance, which will invest \$30-40 million over three years to build a shared infrastructure in Asia Pacific for mobile phone technology, report newswires."
1,"AP - War crimes trials against Iraq's former Baath Party leaders will begin next week, interim Prime Minister Ayad Allawi said Tuesday. He didn't say whether Saddam Hussein would be among them."
3," SAN FRANCISCO (Reuters) - Texas Instruments Inc. &lt;A HREF=""http://www.investor.reuters.com/FullQuote.aspx?ticker=TXN.N target=/stocks/quickinfo/fullquote""&gt;TXN.N&lt;/A&gt;,  the largest maker of chips for cellular phones, on Monday said  record demand for its handset and television chips boosted  quarterly profit by 26 percent, even as it struggles with a  nagging inventory problem."
1,"Germany faced a surge of far-right parties in eastern state elections, worrying about their rise and the ensuing damage to the country #39;s image."
1,"Television stations in two Arab states have abandoned plans to broadcast a soap opera set in Taliban-ruled Afghanistan, after an internet threat to  quot;strike quot; against the actors and executives involved."
4,"As part of its much-touted new MSN Music offering, Microsoft Corp. (MSFT) is testing a Web-based radio service that mimics nearly 1,000 local radio stations, allowing users to hear a version of their favorite radio station with far fewer interruptions."
4,"\\In light of the new Treo release  from yesterday I've been thinking a lot\about wireless, bluetooth, and mobile devices.\\Its obvious to many that the future involves persistent connection.  Why would\you ever want to be off the Internet?  I want my cell phone to support IP and\the ability to connect to my laptop.\\Bluetooth gives me this now but VOIP will give it to me in the future.  Why do I\need cell phone with service from Sprint when I can use Skype or SIP?\\Thers no reason I couldn't have both my laptop and cell permanently connected to\the Net.  When my laptop isn't within range of a decent WiFi signal it can\revert to using my cell phone.\\You could then IM me or VOIP me at any time ...\\"
4,"Court Rules File Sharing Legal\\A federal appeals court has upheld a controversial decision which ruled that file sharing software such as Kazaa, Morpheus or Grokster are indeed legal. The 9th U.S. Circuit Court of Appeals in Los Angeles ruled on Thursday that peer-to-peer software developers were not liable for any ..."
3,"Iraq illicitly earned an estimated \$21.3 billion by circumventing United Nations sanctions between 1991 and 2003, according to estimates released Monday by a U.S. Senate panel."
4,"While a rapidly changing climate may alter the composition of northern Wisconsin's forests, disturbances such as logging also will play a critical role in how these sylvan ecosystems change over time. (University of Wisconsin-Madison press release)"
4,AP - The world's chief climate scientist on Tuesday disputed the U.S. government contention that cutbacks in carbon dioxide emissions are not yet warranted to check global warming.
1,"JEBALIYA REFUGEE CAMP, Gaza Strip Oct. 7, 2004 - Two Palestinian boys, ages 14 and 15, were killed in an Israeli missile strike on Thursday, their relatives said."
1,"France has said it is confident that two journalists held hostage in Iraq will be released, despite continuing uncertainty about their fate."
2,"New York -- The quarterfinals #39; forgotten men Thursday were Lleyton Hewitt and Tim Henman, but they will toil in relative obscurity no longer."
1,"&lt;p&gt;&lt;/p&gt;&lt;p&gt; By Patrick Markey&lt;/p&gt;&lt;p&gt; CARACAS, Venezuela (Reuters) - A Venezuelan prosecutorprobing a 2002 coup against President Hugo Chavez was killed bya car bomb that the government blamed on Friday on radicalopponents it said were training in the United States.&lt;/p&gt;"
1,"AP - Rwanda has sent thousands of troops into Congo in recent days, a Western diplomat in Congo's capital said Monday, but U.N. officials said they had no evidence of such an incursion."
4,AP - Microsoft Corp. is expanding a program to give government organizations access to some of its tightly guarded software blueprints amid growing competition from rivals who make such source code freely available.
4,"Last week, Google, a company renowned for its search service, released the Google Desktop, a software program that lets users search through materials stored on their "
2,"If the San Diego Chargers are able to contain Jake Plummer, they can take a huge step towards winning the AFC West title. The Chargers look to clinch their first winning season in nine years on Sunday when they host the Denver Broncos at Qualcomm Stadium."
2,"But the match has another compelling storyline: the Magpies #39; little-known UEFA Cup opponent is an Israeli club, Hapoel Bnei Sakhnin, with a rare mixture of Jews and Arabs."
4,AP - Scientists who have peered through space to a time when light first filled the universe urged NASA on Thursday to ensure a Hubble Space Telescope servicing mission includes a next generation infrared camera.
3,"Forbes.com - Mickey Mouse may be 75, but age hasn't put a damper on his earning power. Last year Mickey and Disney pals Minnie, Donald, Daisy, Pluto and Goofy grossed  #36;5.8 billion from toys, movies and the like. That's 23 more than the year before, when Disney's Winnie the Pooh topped the list. Why the mouse's rebound? Credit hoopla and new products--including adult apparel--tied to Mickey's milestone birthday last year. For more details, stories and methodology, go to forbes.com/extra."
2,Norwich City climbed out of the bottom three and Tottenham maintained their unbeaten start to the start to the season in a 0-0 draw notable for some fine goalkeeping and defending.
3," PHILADELPHIA/SAN FRANCISCO (Reuters) - Two top stakeholders  in takeover target PeopleSoft Inc., tipped their hands on  Tuesday, with one investment fund saying it will tender its  shares for Oracle Corp.'s \$8.8 billion hostile bid while  another pledged against it."
2,"JOHNNY KELLEY, who died yesterday at age 97, had a modest way of living that belied his extraordinary athletic feats. His participation in 61 Boston Marathons, despite the demands of a regular job and without "
1,"BAGHDAD, Iraq - Insurgents abducted the local director of CARE International from her car in Baghdad on Tuesday, targeting a charity worker who has championed ordinary Iraqis for decades. In new violence, mortar attacks killed an American contractor and at least four Iraqi National Guard members and wounded 80 Iraqis, the U.S..."
2,"AP - Jordan Leopold of the Calgary Flames pulled out of the World Cup on Wednesday because of a concussion, the third key defenseman lost by the defending champion United States."
4,"With its service, the company says, spam is quarantined before it enters the customer's network."
3,"AP - Smuggling of goods ranging from oil to frozen food is costing China's treasury billions of dollars each year, threatening the national economy and possibly even communist rule despite a marathon crackdown, officials said Tuesday."
2,"USATODAY.com presents the second installment of a new feature called Open Letter. Periodically we will identify a sports personality in the news and ask for your comments, written in an  quot;Open Letter quot; form "
4,"BT is launching a digital music service designed to  quot;revolutionise quot; the industry and give power back to artists, labels and traditional retailers at the expense of new entrants into the market such as Apple #39;s iTunes."
3,"Peter Mandelson, the incoming EU trade commissioner, yesterday found himself at the centre of a transatlantic trade war over multi-billion dollar subsidies to Airbus and Boeing, the civil aircraft manufacturers."
2,"From the book,  quot;The Rivals quot; by the baseball writers of the Boston Globe and New York Times, published by St. Martin's Press."
1,The United States is fighting a war in Iraq and Americans are divided over whether it #39;s right. The war is a huge issue in the 2004 presidential election.
2,"LAKE PLACID, N.Y. -- After Team USA racked up six goals in a 6-3 victory over the Swedes Saturday, coach Ben Smith said he hoped his players saved a few because goals were going to be hard to get yesterday against Canada."
3,"SAN JOSE, Calif. -- Repairs were underway Monday at PayPal as the widely used online payment service struggled to get customers back on track after several days of  quot;intermittent quot; outages."
1,At least seven people are confirmed dead as Typhoon Aere pounded northern Taiwan with high winds and heavy rain. The storm hit the area with maximum sustained winds of 130 kilometers-an-hour.
3,WASHINGTON Federal regulators have cleared the way for Cleveland-based Sherwin-Williams Company to buy paint brush and roller-maker Paint Sundry Brands Corporation.
4,"While Intel Corp. and Advanced Micro Devices Inc. continue bringing low-power mobile chips to market, Transmeta Corp. is faced with the possibility of shifting its focus from operations and toward licensing its technologies."
1,Lithuanian Prime Minister Algirdas Brazauskas said Friday that a pro-Chechen Web site likely would be shut down after it posted a purported message 
2,"Somewhere in Jeff Ulbrich #39;s house lies a Kodak moment worth savoring. The 49ers #39; linebacker is shown bringing down Emmitt Smith in a manner so forceful, it bore reenactment Thursday."
1,"Agreements concerning significant issues, which were reached as a consensus between Ankara and Moscow during the historical visit of Russian President Vladimir Putin last week, will be left until after the December 17 Summit in order to avoid reactions."
1,"Reuters - Sudan's government and southern rebels\resumed talks on a final peace deal on Thursday amid fears that\tensions in the oil-producing south and the newer Darfur crisis\could plunge Africa's biggest country into chaos. Underscoring\the external pressures on Khartoum to end its 21-year-old\southern civil war, U.N. Secretary-General Kofi Annan's special\representative to Sudan, Jan Pronk, warned both sides not to\re-open previous agreements signed in May."
2,"They have been criticized roundly, at home and here in Europe, sometimes by their own coach. What the team lacks is to some observers more obvious than its attributes."
3,The United States bristled on Friday at an Airbus plan to ask for up to 1 billion euros in European government loans to develop a new plane despite US complaints that the  quot;launch aid quot; violates world trade rules.
4,"AP - On the face of things, Microsoft Corp.'s online music service looks a lot like the market leader, Apple Computer Inc.'s iTunes."
3," NEW YORK (Reuters) - The British government has suspended  the manufacturing license of Chiron Corp. &lt;A HREF=""http://www.investor.reuters.com/FullQuote.aspx?ticker=CHIR.O target=/stocks/quickinfo/fullquote""&gt;CHIR.O&lt;/A&gt;, which makes  nearly half the U.S. supply of flu vaccine, cable television  station CNBC said on Tuesday."
1,"Reuters - The home minister has ruled out lifting an unpopular law giving the army widespread powers of arrest in the country's remote northeast, despite two months of bitter protests in Manipur."
1,Former army general Susilo Bambang Yudhoyono is due to be sworn in as Indonesia's president on Wednesday.
2,(Sports Network) - The Dodgers will try to win their three-game series against arch-rival San Francisco and increase their narrow 1 1/2-contest lead in the standings today at SBC Park.
1,"Sudanese authorities have moved hundreds of pro-government fighters from the crisis-torn Darfur region to other parts of the country to keep them out of sight of foreign military observers demanding the militia #39;s disarmament, a rebel leader charged "
4,"In the latest alliance between a cable and telephone company, cable operator Mediacom Communications Corp. on Wednesday said it would use Sprint Corp."
1,"American tanks have reportedly encircled the Imam Ali shrine in the Iraqi city of Najaf, after intensively bombarding rebel positions overnight. "
4,"REYKJAVIK, ICELAND - Arctic nations said changes in the world #39;s polar regions are a concern but they fell short of committing to specific actions to slow down or adapt to warming."
2,Jason Campbell hit Courtney Taylor for a 16-yard touchdown pass with 1 minute 14 seconds to play and No. 14 Auburn got two chances to kick the winning extra point.
1,"Australia #39;s ruling conservative coalition has promised to maintain its commitment to the war on terror. At the party #39;s official campaign launch in Brisbane, the Prime Minister, John Howard, said "
4,"IceRocket Adds Blog Search to New Features\\IceRocket, the search engine that has been hailed by many for their approach to ""pioneering commercial search by putting the interests of wants and consumers before advertisers"" has recently added some new features which are sure to increase their buzz - but not as ..."
1,Voters and analysts fear that ballot-box clash of Karzai and rival candidate from different ethnic group could bring disaster.
1,"A 40-year-old soldier from Groton died yesterday in an explosion in Iraq, apparently while delivering candy to Iraqi children during a government-sponsored celebration to inaugurate a sewage plant in Baghdad, according to family and news reports. The apparent car bombs reportedly left about 35 children dead. Army Staff Sergeant Darren Cunningham, a father of two, had been serving in Iraq ..."
4,Reuters - Oracle Corp.  on Friday\won the backing of two more key public pension funds in its\ #36;8.8-billion hostile bid for PeopleSoft Inc.  as the\17-month takeover battle between the two California-based\business software makers neared a key deadline.
3,"DreamWorks Animation SKG Inc., the creator of the Shrek #39; #39; and Shark Tale #39; #39; animated films, raised \$812 million in an initial public offering to pay debt and to fund more movie making."
2,"American Robby Ginepri advanced to the quarterfinals of the CA Trophy with a 6-2, 6-1 win Thursday over fifth-seeded Paradorn Srichaphan of Thailand."
3,"SACRAMENTO, Calif. - The nation #39;s biggest public pension fund, with a stock portfolio of \$167 billion, voted Monday to toughen its policies against multimillion-dollar  quot;golden parachutes quot; for executives who engineer corporate mergers."
3,"The close race for the presidency is depressing the stock market, which is flat to down for the year despite a recovering economy, solid profits and major new tax breaks for investors."
1,AP - Suspected arsonists set an Islamic elementary school on fire Tuesday amid a string of attacks following the killing of a Dutch filmmaker by an alleged Islamic extremist.
4,"By DIEDTRA HENDERSON    WASHINGTON (AP) -- The Food and Drug Administration on Wednesday approved an implantable computer chip that can pass a patient's medical details to doctors, speeding care.    VeriChips, radio frequency microchips the size of a grain of rice, have already been used to identify wayward pets and livestock..."
1,"The World Health Organization on Tuesday downplayed concerns over human-to-human transmission of bird flu, after authorities in Thailand confirmed that a woman who died of the virus probably contracted it from her daughter."
1,"The World Health Organization, UNICEF and other partners are launching a large-scale polio immunization campaign in 23 African countries."
1,"AP - An exit poll and initial early returns from abroad Sunday showed opposition challenger Viktor Yushchenko heading to a commanding victory in Ukraine's presidential run-off, which pitted the Western-leaning reformer against the Kremlin-praised prime minister in a vote many feared would turn violent."
2,"Five National Football League teams haven #39;t lost this season. One of them, the New England Patriots, haven #39;t lost in more than a year."
4,"UK supermarket chain Tesco says it will launch an online music service that it hopes will rival Apple #39;s iTunes service. The retailer is already a major player in the UK e-commerce market, with "
3,"Reuters - AstraZeneca Plc suffered its third\setback in two months on Friday as lung cancer drug Iressa\failed to help patients live longer in a major clinical trial,\sending its shares down as much as 9.2 percent."
1,"An Italian aid organisation said on Monday that two Italian women were kidnapped from its office in Baghdad. The women, Simona Pari and Simona Torretta, both 29, worked for an NGO called  quot;Un Ponte Per... quot; (A "
4,"When you #39;re a company under the watchful eye of governments around the globe for being the 800-pound gorilla of the computer industry, it helps to play nice."
4,"By LAURA MECKLER    WASHINGTON (AP) -- It's not just a cliche: Sex and drugs often do go together, says a survey of U.S. teenagers..."
1,German newspapers on Thursday commented on Turkey coming a step closer to fulfilling a 40 year old dream after the European Commission recommended that the EU begin membership talks with Ankara.
2,"At 12:01 am ET, the Boston (Bleepin #39;) Red Sox erupted in celebration in full view of Yankee Stadium #39;s stone-cold and stone-silent grandstands."
4,"By Martyn Williams, IDG News Service and Paul Kallender, IDG News Service. The group supporting the HD-DVD optical disc format for high-definition video has received a boost in its battle against the rival "
1,Israel #39;s top military officials spoke out Tuesday against calls for disobedience after rabbis urged religiously devout soldiers to refuse to take part in the removal of Jewish 
3," SAN FRANCISCO (Reuters) - PeopleSoft Inc. on Monday agreed  to a sweetened \$10.3 billion buyout by rival software maker  Oracle Corp., relenting after a 18-month takeover saga that  included the ouster of PeopleSoft's chief executive."
3, NEW YORK (Reuters) - The dollar extended its losses on  Tuesday after the Federal Reserve raised interest rates as  expected but signaled that both inflation and inflation  expectations were easing.
