class,text
2,Curt Schilling won his major league leading 18th game and David Ortiz hit his 35th home run as the Boston Red Sox edged the Texas Rangers 6-5 in American League at Fenway Park Sunday.
1,Three California supermarket chains have settled a suit filed by immigrant janitors who said they often earned below minimum wage and were never paid overtime.
3,"The US economy is expanding but the performance appears patchy as soaring energy prices stifle spending in many regions, the Federal Reserve #39;s Beige Book survey showed tonight."
4,"Virgin Music Download Service Aims to Bite Apple, MSN, Yahoo\\On Monday Virgin launched a digital music download service which is expected to challenge Napster, iTunes, MSN Music Store, and Yahoo as the first digital music download service with two big brother backing it up, the Virgin Music Store Chain and ..."
3,"The CBI accused Gordon Brown of being  quot;too optimistic quot; over the health of the economy yesterday, as the employer #39;s organisation downgraded its own forecast for GDP growth next year."
1,"AP - Pipes and pencils will be replaced by cameras and games when a 90-year-old royal tradition of sending gifts to British troops abroad is revived this Christmas, a defense spokesman said Thursday."
1,"Britains Prince Charles has always prided himself on being a man of the people. But with one gruff memo about not all men being equal, the heir to the throne has tarnished his populist credentials."
3,Mid-priced clothing retailer and maker Jones Apparel Group Inc. said on Thursday it was buying Barneys New York Inc. in a \$400 million deal to boost its retail business and move into luxury apparel.
3,Shares of China Automotive Systems Inc. more than doubled in value Monday after the company said it was chosen as the exclusive steering pump supplier for a vehicle made by SAIC GM Wuling Automobile Co.
1,"Reuters - The design chief of home\furnishing giant IKEA was recently asked in China, now home to\two of the blue and yellow warehouses selling the Scandinavian\lifestyle, if he was worried about being a ""design\imperialist."""
4,"AP - Prison officials are no longer allowing Missouri's most violent criminals to have access to video games with titles like ""Hitman: Contracts."""
1,"AP - The top U.S. commander in Iraq on Monday predicted a ""major confrontation"" on the streets of Fallujah as a U.S.-led force of as many as 15,000 troops pressed to retake control of the Sunni Muslim city."
2,Australian leg-spinner Shane Warne said Thursday a new proposal on bowling deliveries in cricket - brought about by the  quot;chucking quot; controversy involving Sri Lanka #39;s Muttiah Muralitharan - could cause confusion for umpires.
3,Business intelligence software vendor Actuate Corp. is hitching its wagon to the open-source movement in the hope of seeing its applications get even broader acceptance in the marketplace.
3,"ON a hill a few miles outside this historic city, the Ettersburg Palace sits in ramshackle splendor, thickly enshrouded by the German past."
3, NEW YORK (Reuters) - U.S. stocks shot higher on Wednesday  as oil prices had their biggest one-day drop in three years and  economic data showed strength in the U.S. manufacturing sector  and personal spending.
2,"Nuggets guard Voshon Lenard left the game in the third quarter with a left Achilles strain...Also in the offseason, the Lakers also traded guard Gary Payton, forward Rick Fox, who has retired, a future first-round draft pick, and cash to the Boston "
2, PHILADELPHIA (Sports Network) - Houston starting pitcher  Roger Clemens left Wednesday's 9-8 win over Philadelphia with a  strained right calf.
1,A vigil in Nottingham for murdered teenager Danielle Beccan will call for an end to the city's gun culture.
2,"Reuters - David Ortiz slugged a three-run\homer during a four-run first inning, and the Boston Red Sox\held a 7-2 lead over the St. Louis Cardinals after three\innings of Game One of the 2004 World Series."
3,Astrazeneca Admitted yesterday to an over-optimistic culture within its drug development division as it revealed its recently launched lung cancer pill did not improve patients #39; life expectancy.
2,India have made a disastrous start to their reply to Australia #39;s first innings total of 474 runs on day two of the first Test against India in Bangalore.
1,"Israeli troops have shot dead a mentally-ill Palestinian in the West Bank town of Jenin, Palestinian security sources say. The sources say Saleh Ilalou, 47, was hit in the stomach by troops who saw him outside "
2,"Jason Giambi took a curtain call and Esteban Loaiza got the souvenir ball. For a pair of guys struggling since playing in the all-star game, it was a nice time to break out."
4,Hewlett-Packard Co. reported Tuesday a 26.5 percent rise in fourth-quarter profit on the strength of record revenue growth across all of the computer manufacturing giant's businesses.
1,"Britain and Ireland resume their joint efforts this week to revive deadlocked peace talks in Northern Ireland, aiming to forge common ground between deeply opposed sectarian groups."
2,"San Francisco's Barry Bonds eclipsed the 40-homer mark for the fifth straight season. Rick Ankiel , whose career was derailed by wild pitches and elbow surgery, made his first appearance for St. Louis in more than three years. He allowed one hit in a scoreless inning in relief."
2,LOS ANGELES - Dodgers manager Jim Tracy agreed Wednesday to a two-year contract after leading Los Angeles to its first postseason appearance in eight years.
2,"David Richards has stood down as boss of Formul One team BAR after a change of ownership. Honda and founders British American Tobacco plan to form a joint venture company, replacing "
4,"THE parties to the Convention on International Trade in Endangered Species (Cites) have granted Namibia, Swaziland and South Africa permission to hunt five of the once highly endangered black rhino population annually for sustainable utilisation of the "
4,"Reuters - A computer program known as\""Skulls"" with potentially destructive capability aimed at\advanced mobile devices was seen as a low threat because it had\not targeted consumers, security software maker McAfee Inc.\said on Monday."
3,No more math required to figure out how many calories are in that 20-ounce bottle of soda. Revised labels will calculate it for you starting next year.
2,"Ten years after the World Series was canceled and fans left in droves, Major League Baseball will tell you it has never been healthier."
4,"The longest serving astronaut in history, who flew twice to the moon and commanded the first space shuttle mission, has announced his retirement after 42 years at NASA."
4,RealNetworks says it sold more than three million tracks thanks to an aggressive three-week price promotion in the US. The company halved the cost of tracks to 49 cents in mid-August to try to tempt consumers away from Apple #39;s iTunes music store.
1,"GAZA CITY, Gaza Strip Sept. 7, 2004 - Israeli helicopters fired missiles at a Hamas training field in Gaza City early Tuesday, killing at least 13 militants and wounding 25 other Palestinians, witnesses "
1," ASTANA (Reuters) - Russian President Vladimir Putin on  Thursday ruled out any negotiations with Chechen rebel leaders  following the Beslan school hostage-seizure in which more than  320 people were killed, half of them children."
3," NEW YORK (Reuters) - Google Inc., the world's most popular  Web search engine, on Wednesday slashed the price range on its  eagerly awaited initial public offering (IPO) to between \$85  and \$95 per share from between \$108 and \$135 per share."
4,A panel of senior biologists has told the US Fish and Wildlife Service not to list sage grouse as an endangered species. If Fish and Wildlife Director Steve Williams follows the panel #39;s 
1,Private insurers have told the Bush administration that they will not expand their role in Medicare if they have to serve large multistate regions.
3,": Consumer goods maker Colgate-Palmolive Co said on Tuesday it would cut about 12 per cent of its 37,000-person work force and close one-third of its factories worldwide as part of a four-year restructuring."
1,Israel says it #39;s considering releasing some Palestinian prisoners -- as part of a deal in which Egypt has freed an Israeli Arab man convicted of spying.
4,"High Street electrical retailer Dixons has pulled the plug on the VCR, and announced today video recorders will disappear from its shelves before Christmas."
2,"England striker Michael Owen didn #39;t have a nickname in Spain until Sunday, but he may have now, with sports daily Marca dubbing him  #39;killer #39; after he got the only goal of Real Madrid #39;s 1-0 win over Valencia."
3,"Reuters - Apple Computer Inc.  on\Wednesday reported its quarterly profit more than doubled, on\strong sales of its iPod digital music player and notebook\computers and said revenue and earnings for the current quarter\would top Wall Street estimates."
1,"An Olympic Airlines flight from Athens to New York was diverted Sunday to London  quot;on a full emergency, quot; a spokeswoman for London #39;s Stansted Airport said."
1,"Iran said yesterday it is ready to provide  quot;guarantees quot; it won #39;t seek nuclear weapons, and warned the United States that success in stabilizing Iraq and Afghanistan was impossible without Iranian support."
4,"AP - Russia's Cabinet approved the Kyoto Protocol on global warming Thursday, clearing the way for the worldwide adoption of the pact  #151; despite U.S. opposition  #151; once the Russian parliament ratifies it as expected."
1,"JERUSALEM - The real objective of Ariel Sharon's offer to withdraw from the Gaza Strip and parts of the West Bank is to freeze Palestinian statehood indefinitely, with U.S. blessing, the prime minister's point man with the Bush administration acknowledged in an interview published Wednesday..."
2,WORLD champion pairs skater Tatiana Totmianina said today she still doesn #39;t know what caused her to fall during a weekend program.
1,"MOSCOW -- Russia trained Shamil Basayev to fight fires, but he has made a career igniting them."
1,"Chinese officials Monday rebuffed Secretary of State Colin L. Powell's suggestion they use a possibly conciliatory speech by Taiwanese president Chen Shui-bian to restart cross-straits discussions, telling him in strong terms that they are not impressed by Chen's words and are worried about his actions."
1,"AFP - A US Army deserter said the one thing he did right during his 40 years in North Korea was to leave the country, which was training his daughters as spies, in an interview published."
4,TechWeb - Brady Corp. turns to product-information-management software from FullTilt Solutions so it can more easily handle information on thousands of products. The software also helps Brady manage its online catalog.
3,"General Motors doesn #39;t believe \$50 barrels of oil are having any effect on sales of big trucks and SUVs, and it has new sales numbers to back it up: GM #39;s light truck sales were up 33 in September, to record levels of 287,000."
2,"The Herminator is selling well, just not as well as The Terminator. An Austrian postage stamp depicting Herman Maier, the country #39;s first skiing star to adorn a stamp, sold out in just six weeks after it went on sale Sept."
3," NEW YORK (Reuters) - The Big Four accounting firms wrongly  let some corporate clients understate liabilities and distort  their financial health in their 2003 accounts, the regulatory  body for auditors said in a report on Thursday."
4,"The wait for millions of Sims fans is over. Electronic Arts announced that The Sims 2, has shipped to retailers under the EA GAMES brand and is now available on store shelves."
2,"You did it again, didn't you? You fell into the trap that these fun-loving, baseball-bashing Red Sox set for you. You became so enamored with their irreverence and their pizazz and their long hair and their long-ball capabilities, you actually convinced yourself they were better than the New York Yankees."
1,&lt;p&gt;&lt;/p&gt;&lt;p&gt; By Daniel Flynn&lt;/p&gt;&lt;p&gt; MADRID (Reuters) - Venezuelan President Hugo Chavez'sfence-mending visit to Spain sparked political uproar onTuesday when Madrid for the first time backed his allegationsthat the former Spanish government backed a coup against him.&lt;/p&gt;
3,"Office Depot Inc. lowered its earnings expectations for the third quarter and for the year, citing lower sales because of hurricane disruptions and soft European business. The price of its stock fell more than 7 percent on the news."
4,"Reuters - Apple Computer Corp. is charging its\British iTunes customers 17 percent more per download than its\European customers, a consumer watchdog group said on\Wednesday."
4,"InfoWorld - Capitalizing on the current trend within the enterprise to reduce the number of applications to support, Siebel Systems on Monday unveiled a package of business analytics solutions that can be deployed by IT as both extensions to current CRM applications or as stand-alone programs."
4,"BT may be fined if found to have broken competition rules, Ofcom says, but BT says it has been cleared."
2,"Athens, Greece (Sports Network) - Hicham El Guerrouj of Morocco came into these Olympics without a gold medal, but now he has two after winning the men #39;s 5000 meters Saturday night."
4,"Reuters - You change the oil in your car\every 5,000 miles or so. You clean your house every week or\two. Your PC needs regular maintenance as well -- especially if\you're using Windows and you spend a lot of time on the\Internet."
2,"INDIANAPOLIS - Another improbable win has the Pacers brimming with confidence. And Indiana has Jamaal Tinsley to thank for that. The guard scored 20 points, recorded 14 assists and grabbed seven rebounds to "
2," COMMACK, New York (Reuters) - Defending champion Paradorn  Srichaphan withstood a barrage of huge hitting to beat Swede  Joachim Johansson 3-6, 7-6, 6-3 and reach the semifinals of the  Long Island Cup Friday."
4,NewsFactor - The Federal Trade Committee has filed a complaint in federal court asking that two Internet advertising and software firms be shut down. The FTC made the filing last Thursday and will hold a press conference on the matter tomorrow.
2,"BOSTON - The World Series logo was back on the field at Fenway Park, just like last year. That #39;s right, the 100th World Series opens tonight in the city where the Fall Classic began in 1903 with Cy Young "
1, SEOUL (Reuters) - Secretary of State Colin Powell is to  seek South Korean support Tuesday for a U.S. hard line on North  Korea after China said Washington must be more flexible to  entice the reclusive state back to nuclear arms talks.
1,Guwahati: The toll in the current wave of flash floods and landslides in Assam has increased to 111. The toll might go up as the rescue operation was continuing in the area.
2,"AP - Jose Guillen and Jeff DaVanon homer off Esteban Loaiza, who failed to make it out of the fourth inning Saturday, as the Anaheim Angels defeated the New York Yankees 6-1 in a storm-interrupted game."
3," CHICAGO (Reuters) - Gap Inc. &lt;A HREF=""http://www.investor.reuters.com/FullQuote.aspx?ticker=GPS.N target=/stocks/quickinfo/fullquote""&gt;GPS.N&lt;/A&gt;, the largest U.S.  specialty apparel retailer, on Thursday reported a slight  decline in quarterly profit, meeting lowered forecasts, after  summer clearance sales drew surprisingly small crowds."
2,"Gyms worldwide were dark in anticipation of the Olympic gymnastics competition, NBC's Al Trautwig said this week in a dramatic introduction -- and then the cameras pulled back to reveal row after row of empty seats in Athens."
1,"BERLIN: German Chancellor Gerhard Schroeder and his wife have adopted a daughter, an official with Schroeder #39;s party said Tuesday. Schroeder and his wife, Doris Schroeder-Koepf, picked up the 3-year-old Russian girl named Victoria several weeks ago from a ..."
4,SEATTLE - Seismologists believe there #39;s an increased likelihood of a  quot;hazardous event quot; at Mount St. Helens due to recent changes in the mountain #39;s seismic activity.
1,"The alliance between Britain and America is stronger than ever, President George W Bush has said following two days of talks with Tony Blair."
3,"October 20, 2004 - Yesterday, World Wrestling Entertainment announced it has filed suit against a number of parties regarding alleged bribery in the attainment of WWE license rights."
2,"DAYTONA BEACH, FLA. -- Caryn Wilson of Rancho Mirage shot a 4-over par 76 on Friday and is tied for 51st place after three rounds of the LPGA Tour Qualifying School."
2,"England surely confirmed they #39;re well on the way to booking their place to the World Cup in Germany in 2006, after easily outclassing Wales 2-0 overnight in the European "
4,"Facing shareholder anger, top executives of Computer Associates International (CA) this week pledged to add 150 new employees to aid its channel efforts and to overcome distractions created "
3,"An executive of Bermuda-based insurer ACE Ltd. (ACE.N: Quote, Profile, Research) on Friday pleaded guilty to a felony charge connected to New York Attorney General Eliot Spitzer #39;s investigation of insurance companies."
2,"It did not take long for Brewers general manager Doug Melvin to pique the interest of the club #39;s presumptive new owner.  quot;On my way down here, Doug said he wanted to talk "
1,An Argentine student opened fire on his classmates Tuesday killing four of them in the southern Argentina city of Carmen de Patagones.
1,The United Nations has called Darfur the home of the worst humanitarian disaster in the world and the publicized statistics regarding events within the past 18 months in this western region of the Sudan are horrific.
1,Residents boarded up windows and stocked food as deadly Hurricane Ivan appeared to be heading in their direction.
4,especially to the electronics industry. This is the time of year when companies begin releasing their shiniest/newest/greatest products to compete for your holiday shopping dollar.
4,"Those wireless LAN cards that insert into a laptop, Tablet PC or PDA have just gone on the endangered species list, according to a new report published this week."
3,"The New York Mercantile Exchange is in talks with UK regulators about starting open outcry oil trade in London but will let market demand decide whether it moves from Dublin, President James Newsome said on Monday."
2,AP - Don't tell Mike McMahon the NFL's final exhibitions are meaningless.
3,"Shares of Air New Zealand Ltd., the country #39;s largest airline, were halted pending a High Court ruling on plans for an alliance with Australia #39;s Qantas Airways Ltd."
4,"AP - A suburban Philadelphia company is hoping that a vaccine for anthrax could be lurking in spinach, petunias or Swiss chard."
2,"CHAPEL HILL, NC - North Carolina will likely have the services of four-year starting quarterback Darian Durant when it meets fourth-ranked Miami on Saturday."
2,It looks like the Ghost of the Babe can now sleep forever. Last night the Boston Red Sox fully exorcized The Curse of the Bambino.
2,"Michael Schumacher returned to top spot in today #39;s first practice for the Italian Grand Prix at Monza. The Ferrari driver suffered a rare defeat two weeks ago in Belgium, although second place was enough to clinch a seventh world championship."
4,"Reuters - What are the words used by\indigenous peoples in the Arctic for ""hornet,"" ""robin,"" ""elk,""\""barn owl"" or ""salmon?"" If you don't know, you're not alone."
4,Images posted in news groups may install remote control software on vulnerable PCs.
3," WASHINGTON (Reuters) - Sprint Corp. &lt;A HREF=""http://www.investor.reuters.com/FullQuote.aspx?ticker=FON.N target=/stocks/quickinfo/fullquote""&gt;FON.N&lt;/A&gt; on Tuesday  reported a wider third-quarter loss due to a writedown in the  value of its long-distance business."
3,"The unraveling of the ailing airline industry picked up speed Friday as a bankruptcy judge granted US Airways authority to temporarily cut the pay of its union workers by 21 percent, comparing the airline #39;s financial outlook to  quot;a ticking fiscal time bomb "
2,"AP - It took Joey Harrington about one second to choose between red, white and blue  #151; and blood."
4,"A division of Primus Telecommunications Group Inc. agreed Tuesday to pay \$400,000 to the federal government to settle allegations that the McLean phone provider made telemarketing calls in violation of the national do-not-call registry. &lt;FONT face=""verdana,MS Sans Serif,arial,helvetica"" size=""-2"" color=""#666666""&gt;&lt;B&gt;-The Washington Post&lt;/b&gt;&lt;/font&gt;"
1,"Canadian Press - FORT QU'APPELLE, Sask. (CP) - Police investigating the disappearance of a young Regina girl called on the RCMP and civilian searchers Tuesday to look for clues on a reserve northeast of the city."
1,"Japan issued a deportation order on Tuesday against former world chess champion Bobby Fischer, who is wanted in the United States for defying sanctions, but his lawyer immediately filed an appeal, blocking the move."
4,"LOS ANGELES - Sony BMG Music Entertainment and online peer-to-peer software distributor Grokster are working on a new venture that is expected to offer paid and free song downloads over the Internet, sources say."
1,"Two car bombs shook the capital in quick succession yesterday, killing at least 11 people, including a US soldier, and wounding 16, US and Iraqi officials said."
1,US Army Sgt. Charles Robert Jenkins -- accused of defecting to North Korea 39 years ago -- is back on active duty Saturday after voluntarily turning himself at a military base in Japan.
4,The software maker offers a new service to add digital signatures to PDF documents.
4,"The ability to get SAT scores on the Web has been celebrated by many teenagers and their parents; but when the site crashes, as it did Thursday, modern life suddenly seems maddeningly inconvenient."
3,Vodafone is to cut costs by 2.5bn per year by March 2008. It will do this a combination of 1.4bn through cost-saving measures and 1.
2,"When hunter Jim Mick went into the forest to bag himself a deer, he never expected to come out empty-handed -- and badly bruised. The 69-year-old bowhunter was treated for injuries "
1,"Militia fighters in the Baghdad slum of Sadr City are to begin surrendering their mortars, grenades, machine guns and other weapons Monday under an accord with the interim Iraqi government, both sides announced Saturday."
2,"AP - Alfonso Soriano had three hits and two RBIs as the Rangers responded with their bats to beat the Oakland Athletics 12-9 Tuesday, a night after Texas reliever Frank Francisco threw a plastic chair into the stands and broke a woman's nose."
2,AP - Almost the only thing Chase Lyman has kept healthy while playing football is his head.
2,"Dale Earnhardt Jr. was docked 25 points and fined \$10,000 for cursing during a postrace TV interview, NASCAR announced Tuesday. The loss of points drops Earnhardt out of first place in the Nextel Cup standings."
4,Last Wednesday BBC2 aired part one of a three part series called The Power of Nightmares: The Rise of the Politics of Fear.
2,"THESSALONIKI, Greece - With Abby Wambach out with a suspension after receiving two yellow cards Sunday against Brazil, the US soccer team came together and grabbed the lead early in their game against Australia on Tuesday afternoon. "
2,India won the toss and elected to bat first in the third one-day international against England in the NatWest Trophy at Lord #39;s today.
2,"ST. LOUIS (2-2) vs. SEATTLE (3-0) When, where: Sunday, 4 p.m., at Seattle. TV: Ch. 25. Last season: Seattle won, 24-23, and St. Louis won, 27-22. Comments: The Seahawks are going for the first 4-0 start in franchise history. They lead the league in defense (242.3 ypg), having yielded only 13 points so far this season. They also lead in ..."
4,"com October 14, 2004, 8:58 AM PT. Cyber threats, chiefly viruses like NetSky and Sasser, make security an ongoing concern as it holds steady over software infrastructure as the third top priority."
3,EasyJet #39;s bumpy ride continued yesterday as shares in the no-frills airline hit an all-time low after it warned that fares will remain under pressure next year.
4,"When it comes to Microsoft, IT pros still want to hear more about security, Linux and product futures. CEO Steve Ballmer did his best to accommodate them Wednesday morning in a keynote speech at the Gartner Symposium ITXpo in Orlando, Fla."
2,AP - Jordi Arrese will bet almost anything that his Spanish team will beat the Americans in the Davis Cup final.
4,"Nokia researchers have developed a new peer-to-peer (P2P) scheme tailored specifically for mobile phones. Still in a development and testing phase, the network "
2,"AP - Adam Dunn hit a grand slam in a seven-run third inning, leading the Cincinnati Reds over the Milwaukee Brewers 9-0 Saturday night."
2,"The Angels have reached agreement on a two-year contract with former Dodger Steve Finley, who provides a more cost-efficient, shorter-term solution to their gap in center field than top free agent Carlos Beltran."
1,"MANILA - Movie star Fernando Poe, Jr, President Gloria Macapagal-Arroyo #39;s main challenger in the May presidential election, is in a coma after suffering a stroke, an opposition congressman said Sunday."
4,Video-on-demand specials have so far appeared without advertisements. But Fox Cable Networks and Visa plan to try including ads in a show in January.
4,"TORONTO (CP) - ITunes finally launched in Canada on Thursday, bringing with it over 700,000 songs, exclusive tracks, celebrity playlists and multiple CD burning rights."
