class,text
0,"batteries drain quickly with LCD use, only equivalent to ISO 100 film.."
0,Can not get to many pictures on one floppy.
1,"6-in-1 card reader, copy or print photos without computer, overall good quality"
1,A great phone.Easy to use and has a lot of options. Very clear.
0,Initial Cost
1,Bad battery life and freezes up.
0,None so far.
0,"Uses batteries very quickly, no manual focus, no zoom, delay after snapping."
0,Pricey. No optical zoom. Need docking station to upload or charge battery. 
0,Not very many options
1,"price, speed, quality"
1,Great for  and pics of intricate items as well as photos
0,"Hard to get accessories for, could be smaller"
1,"Quick, easy, durable"
0,Potential problems when downloading pics directly from camera to Mac (OS X).
0,"Spites out extra sheet every now and then, cartridges around 30 beans."
1,"Lightweight, 2Mpixel, rotating head"
1,"Takes very good pictures, probably the most well-rounded 2 megapixel camera out there"
1,easy to operate
1,"small, 5 pixels"
1,great price and free accessories w/high resolution
0,"No keypad cover, battery life shorter than advertised."
0,Incompatible with Windows 98!  Poor service
0,You need more than 8mb of ram
0,"a little bulky, pricy memory sticks to replace floppys, only 90min charge time."
0,No zoom.  Screen is hard to clean.  
0,Decent print quality
1,"excellent design, lots of features"
1,"compact, feels like a real phone in open position"
0,Paper Jams
0,None
0,"camera,video display,"
0,Even Best Buy says -DUMP IT!
0,"only one seat adjustment, limited sun-screening"
0,"No Wireless Web, huge antenna"
1,"stylish, strong marketing"
0,Read on.....
1,"Very Durable, Long Life Battery, Great Signal, Camera, Color Screen, Speakerphone, Good Design"
1,"Many features, but easy to use"
0,"Cheezy door that opens to the media card compartment, and you cannot add threaded lenses to this lens for added protection."
0,Only single band. Washed out screen. Reflective chrome around screen. Screen on while charging.
1,free
1,Great phone when it works. Durable Good Battery life
0,Battery Life
1,"Convenient,affordable,"
1,"Good clarity, easy to operate, lots of different options."
1,"-cheap, -the best in 2 mega, -multiple options!, -great for starters"
0,Sound Quality (voice). Small Buttons. Proprietary Headphones. Bluetooth Transfers. Can that Hinge Survive Two Years?
1,"T9 predictive text, blue LED backlighting, cheap"
0,Bundled software (i.e. image editor) is pretty basic and geared toward novices
1,"Quick, quiet, good price"
1,Price
0,ABOVE
0,"learning curve, battery eater"
1,"Fast, Optional Networking, USB 2.0 compatible"
1,"small, but hard to lose, good interface, excellent reception"
1,Inexpensive ink. Fast with text.
1,"nice pictures,small,convenient"
0,"Requires heavyweight paper for best results, small ink tanks"
1,"size, weight, signal strength, clarity, durability, outside caller ID"
1,Great Image Quality; Excellent Features
1,"Great quality, borderless printing and a great price."
1,"Ease of use, works with many prepaid services, low price."
0,no lense cover
0,Reviewing photos is cumbersome.  No USB connection.
1,"Print quality, quiet operation, low price"
0,No optical zoom
0,color reproduction
0,"Too simple, kinda slow focusing, NO Advanced functions."
0,usb connection needed
0,Serious accessory issues
1,"size, durability, features, and very user friendly"
1,"compact size, all metal case, fast focus"
0,No zoom.
0,The flash card supplied is virtually useless.
0,"Might be a little complicated for the beginner, can eat batteries."
0,Short Battery Life; Slow Download
0,"bad zoom, no case"
1,"Lightweight, easy to steer, and sturdy. Inexpensive while big on style!"
0,"No AC adapter, LCD and USB Kills battery's "
0,Have to have computer on to copy. 
0,You lose units if someone calls you.
0,flimsiness
0,"buggy, feeding problems, and many more."
1,It talks; the printing quality is good; very inexpensive
1,"DOES IT ALL: PRINTS, COPIES &amp;amp; FAX"
0,none to speak of
1,Nice picture quality
1,"slim, cool, high tech, easy to use, pink!"
0,"no 8x10's, somewhat long term expensive"
1,"easy to install, simple to configure, joy to use "
0,Color Cartridge drains quickly
0,none
1,good look great photos good reception
0,Shoddy business practices by Epson
1,"Excellent print quality, adjustable settings to photo quality for people, nature, etc."
0,"Slow and light-sensitive autofocus, no easy way to add filters"
0,A secondary photo program(such as photoshop elements 2.0) is necessary to get great pics.
1,High quality output.  Relatively fast.
1,Good value for cost
1,It is both a 2-way radio and a phone.
0,Slower than more expensive printers
1,Cheap price and refills
1,"Easy to read, and more lines of text"
1,Very Very Lightweight
1,Excellent color reproduction.  The ink stays brilliant.  No fading.
1,the communication works
0,"Could provide better/easier software, have to buy a/c adapter separately."
1,"Easy to use, inexpensive, viewfinder (with option to turn off), great customer service"
0,Can Streak/ Fair Quality Print
0,Will not work with Windows XP
1,Ummm...
0,"Pricey for 1.3 megapixels and 8 MB card, slow serial transfer"
0,"Plain, may have problem with slanted text"
0,can be noisy
0,Not Great Quality Even on &amp;#147;fine&amp;#148;
0,"Slow menus, poor placement of mico SD slot, hard to dial by touch."
0,Slow when printing color.
1,"Great Pictures, Small"
0,Slow
1,Shreds paper quickly and efficiently
1,"Convenience, ease of use, zoom lens"
1,"Great features, good price.  10X zoom - more than any camera even after three years."
1,Great general print quality.  Photo prints great on standard sized paper. 
0,"No IR port, low quality ring tone, lag time on menu access"
0,"Bundled software, cost of cartridges"
0,"As loud as my paper shredder, Dimmed the lights in my room, Slow to print"
1,Fairly small.  Good battery life.  Fair features.
1,"Features, display, tuner option, form vs function, EVERYTHING"
0,No adjustable recline position
1,Fast printing and scanning. Both are good quality. Sheet feeder is great.
1,Great tool for beginners
1,Ease of use.
1,"standard, good battery, good sound quality, custom ringtones, optional covers"
0,I Hear people before I answer
0,The camera body a  bit too smooth and no lens threads for filters
0,Ringtone Volume
0,Heavier in weight and may not fold as flat as some strollers.
0,buttons too small
1,"A dream to drive, light, compact, quality all the way"
0,Fairly expensive; slightly heavier and bulkier than some compact digital cameras.
0,Larger than expected
0,"no durability, poor battery life, takes a long tome to save pics, only 2x zoom"
1,"Excellent picture quality, good battery life, easy to use"
1,"Price, features, Great for quick shots, Optical and digital zooms"
1,clear printing and great colors!
1,"Picture quality, durability, design, ease of use."
0,Expensive Cartridge
0,"*Although not really, **Ratings aren't always real life, ***Although slightly overkill"
1,EVERYTHING
0,"A little on the large side, but no real problems."
1,"Easily navigable menus, Metal case, Stylish, Reception improving features"
1,"Feature-packed, easy to use, nice software suite"
1,great quality for the price
1,Cheapest on the market. Does work for small needs.
1,"Small size, great picture quality"
1,"Varied ring selections, interchangeable face plates."
1,"Good battery life, excellent picture quality. Zoom looking to be reliable."
0,none
1,"small size, memory capabilities, features"
0,Mechanical Issues - Color Photos;Poor Customer Service; Spyware; Broken Already
1,"The Cadillac of strollers, can change which way baby faces, great wheels for comfortable ride"
1,"1.8"" LCD; inexpensive; video output to TV"
0,"Wifi, seamless wifi to GSM transition. Can use instant messaging on wifi. Bluetooth, VGA camera."
0,May take a few seconds to start up
0,"The price:  $999,  Also, it comes with PhotoDeluxe, not PhotoShop."
1,"Speakerphone, ease of use, small size, camera, durable"
1,"Compact, easy to use, and takes great snapshots"
1,"Print quality, speed, fax speed &amp; functions, Reliability"
0,eats AA batteries like crazy
1,nice photo prints; print from flash card
1,"Features, voice clarity, reception, camera, durability"
1,A stylish and affordable phone that is finally available on Sprint.
1,voice dialing.
1,"Light, Small, Inexpensive"
0,"fragile battery charger, poor reception, dropped calls, bad warranty"
1,works quickly and quietly
0,Battery life and Reception is terrible;Phone overheats like crazy;Lousy ring-tones
0,"Slightly heavy, needs lighting"
0,Expensive
0,no usb 
0,a little expensive
1,A phone you can trust for its functionality and construction
1,Almost everything.
0,Not quite as fast as I'd like but what I want isn't reasonable either!
1,Quality text and photo images
0,Price of Cartridges Somewhat High (Can use refill kits to offset)
0,I have several
0,"Price was a bit steep, and only comes with a 16mb card."
1,Easy to use. Fast. Beautiful
0,"My carrier disabled the full feature set (OBEX).  ""LOCATION"" field is missing in the calendar."
0,A bit expensive
1,"Many features, nice design, easy to use, good sound quality"
1,"Ease of use, Great, inexpensive storage media, EXCELLENT fit for serious amateur "
1,2 important modes- manual &amp; automatic
1,"Tri mode capbilty so coverage is great, good quality phone"
1,"Nice Size, finish and features...  Best looking phone out"
1,"excellent speaker phone, durability, easy to use"
1,Excellent print quality especially for the price.
0,Tricky to learn how to fold. Small adult cup holder. Flimsy basket.
1,Reception is amazing. Stylish. Color screen.
1,Incredibly fast black &amp; white printing.  VERY cheap for what you get.
1,"simple and extremely effective, great price!"
0,"Menu operation, Software, Flash design"
0,"Limited features, mediocre picture quality, low memory."
0,use's a lot of ink for black and white
1,Looks nice.
0,Error Messages Stink
1,instant gratification/excellent quality
0,Must get used to not handling paper photos
0,umption
0,"drivers may cause problems, RAM upgrades can be expensive"
1,everything about it after you upgrade
1,"You can put a baby seat on the back seat, It is easy to push, it is very light weight"
1,none
0,"Unfriendly user interface, not alot of features, Qwest's service`"
0,You don't get to see the printing quality
0,Cheap
0,none
0,"Jams once in a while ripping the paper, lines when printing color from PC."
1,allows photo printout from the MFC
1,"Simplicity, Resolution, Color"
1,"Has all the features, small sleek design, reliable."
0,Some serious driver issues (hopefully&amp;#13;&amp;#10;in the past)
0,"spotty quality on some photos, prints not great"
0,"No lens cover, no optical zoom, thin and fragile battery and CF doors"
1,"FAST, sharp text, Great color"
1,"Brilliant color and b/w printing, prints on photo size paper"
1,"Incredible range of features, high quality pics, over 2megapixels"
1,UNBREAKABLE!!!; Plenty of function; Good reception; Compact Size;
1,"It is easy, lightweight, and what a great price!"
1,"The standing/sitting feature in the back, low price"
1,"Nice features set, support microdrive, user friendly"
0,"price, want to use it all the time!"
0,"Non-intuitive menus, lackluster standby time"
1,Great features for the money.
0,Palm OS and phone do not integrate well. Difficult to navigate.
1,"easy to use,small,excellent pictures"
1,ease of use; good pix
1,easy
0,Slow high colored pages
1,Print the pictures you want.&amp;#13;&amp;#10;Choose the size.&amp;#13;&amp;#10;Save pictures to pc from printer.&amp;#13;&amp;#10;
0,"the price is at the higher end, but a good product is worth it in the long run"
1,"Cheap, easy to use, easy to set up"
1,"Separate ink cartridges, fast"
0,"No camera, internet service is slow"
1,"Cheap, Fast"
0,Button traces on the screen. Service plans cost too much. 200 bucks.
0,Digital zoom isn't great
0,"noisy, 1 yr. limited warranty"
0,Ink is expensive
1,"Fast, reliable, the best SLR Digital Camera made."
1,"Battery life, usability, sound"
1,"Small size, decent output"
0,"Blurry pictures if you aren't very still, no flash, lose power and pics are gone"
1,"Smallest available, great function"
1,"Reliable, quality printing"
0,Selection is sometimes a bit tricky
1,"Very well designed, floppy disk compatibility, ease of use, zoom, macro."
0,"Headset jack, inputting phone numbers, 'goodbye' message when shutting off phone."
0,battery life
0,Cheaply made; rather fragile; could break easily if dropped often or stepped on;
0,Menu's and ring tones.
0,"external antena can break, black/white screen, lousy games"
0,no optical zoom
1,Easy Operation
0,"Software booklet unavailable and help is very limited, not a good choice for professionals, photo graininess enhancement limited."
1,"Easy for beginners, floppy disk storage"
1,Very easy to use -- you an figure it out without the manual.
1,Fantastic reception; very long battery life; feature packed; speakerphone; easy to use intuitive menu.
0,expensive memory
0,Rebate ending soon!
1,"Fast, Impecable Quality"
1,"Small, light, compact"
0,"Heavy price tag, No Bluetooth, Screen not ""that"" bright"
0,Toner cartridges are expensive
0,"Can&#146;t send text messages,  battery life"
1,"Easy to use, small, good quality"
0,"Not always user-friendly, some problems with buttons not working. Lousy reception!!"
1,"Screen, ringer volume, clarity, coverage, ringer tones, antenna"
1,reliable and economical in the long run
0,Fast Drying Ink Cartridge
0,Eats batteries - though this largely depends on battery. buy rechargeable with recharger
0,Aftermarket charger voided warranty
1,"Very, very solid.  Quite light and small.  Looks sort of funky."
0,"AA batteries run out too quickly, HP doesn't provide everything"
1,I liked the fact that it was a camera phone...
0,Small
1,"Good print quality, relatively fast, very inexpensive"
0,"Green light in viewfinder, eats AA batteries"
1,"great photo quality, fast, crisp b&amp;amp;w"
1,"Compact, zoom lens, quality pictures"
0,none
0,"Small battery, red-eye"
0,"Poor support, drivers and software don't work with XP"
1,"Feature rich, ease of use, length of battery"
0,Phone book organization (though it might be just me)
0,"Slow color printing, low quality"
0,Long shutter lag if you don't prefocus.
1,Excellent resolution and prints
1,"super easy to use, very good quality photos"
1,"Compact, lightweight, decent battery life, uses CF cards, good macro, easy to use."
0,"Not so convenient for keeping in hand, low vibrate, short accumulator"
0,"Short battery life, no extra features"
1,Excellent camera.  Great Price
1,"HP quality, fast and excellent printouts, and easy to use."
1,"Styling, performance and features, external Caller ID"
1,None to speak of.
1,"Great picture quality, rechargeable batteries last quite a while"
0,"Flip cover broke easily, ringer volume rocker switch does not work at times, echoing."
1,"price, weight, battery life"
0,"Horrable Battery Life, Sucky Service, Sucky Customer Support!"
1,"tri-band, good speaker phone, great battery life, nice keys, pleasing sound, bright color screen"
0,various
1,Amazing versatility and feature set for the price ($470 7/03)
1,"Good talktime, Lotta features."
0,Lame ringtones. Don't like button arrangement.
1,Great for baby and toddler
0,"Irritating ringers, menu system a little wierd"
0,big wheels take up room
0,"Pricey, no hot shoe connection for flash"
1,"Great features, easy to navagate, many options"
0,"Can't always retrieve missed calls, it's plain ugly, plus there's no games"
1,2 For 1
0,"Junky, plastic, falls apart, BREAKS REALLY EASILY!"
0,Somewhat Expensive but worth every penny!
1,Easy to use.
0,None that I know
0,"The system has limitations locally, for now."
1,"Thin profile, lightweight, and large, vivid color display. Clear audio and easy to use."
1,Great Output
1,"looks nice, easy to maneuver, different seating positions"
0,None Found
0,none really
0,"A little slow on the color, vibrates a bit"
0,"Can only use one cartridge at a time,does not last very long, "
0,Accessories are a little pricey.
1,"affordable,easy to use,fast,reliable"
1,"clear sound, easy to use menus, compact"
1,"QUALITY construction, COMPACT, OUTSTANDING PHONEBOOK..  User Friendly PERIOD"
1,Very pretty phone that makes an excellent paper-weight.
1,Very smooth ride
0,too many options/features for the average non-tech person
1,"Great pictures, intuitive interface, easy downloads."
0,Slower Shutter response that any Film Camera.
0,NONE
1,"Prints accurate pictures (in color and black/white), easy to use, efficient."
0,"Nikon tech support not useful, tech forums useful only because of other camera uses..."
1,none
0,Uses batteries quickly
0,Does not come with a cable to connect to your computer
1,"Battery life, trendy design, easy to use, excellent after sales"
0,Low Resolution
1,"Price, Print Speed, Size, Look, Sound"
1,"Clear and loud ringtones, bright colorful screen, long battery life"
1,"faster, accufeed paper handling, USB support "
0,none
0,Unreliable.  This camera has broken twice in less than two years.
0,"Slow, Loud, not that much better in quality that other similarly priced printers"
0,not appropriate for action or macro photography
0,Somewhat expensive.
1,"mail, paging, voice mail, phone, walkie-talkie in one"
1,"easy to change ink, prints clear, fast (after it's warmed up)"
1,"Long talk time, cheap price"
0,Sucks ink like Dracula sucks blood.
0,I keep dialing numbers by accident from my purse.
1,"mp3 ringtones, camera, WAP access, good reception"
1,Easy Disk Capability
1,Ummm none?
1,"Small, Looks cool"
1,"Easy to use, great pictures"
0,Speed
1,Great Quality &amp;amp; Awesome Price
1,Small and Looks cool
1,Advanced device with camera and Tri-band phone.
0,Modest to short battery life.
1,Fundamentally usable. Well spaced buttons.
1,"It is phone, if you can get it to work."
0,high cost
0,The price is high as compared to other mobiles.
1,Colorful Screen
0,"Horrible service in the CNY area, poor video quality, snapshot noise when photo is taken"
1,"once warmed up, relatively quick for home use"
0,Several design flaws; horrible product support
0,Noisy and shaky
1,"nice selection of ringtones, speakerphone!, hold feature"
0,Expensive ($700)&amp;#13;&amp;#10;Not as useful if you don't own a home PC&amp;#13;&amp;#10;
0,no ac adapter
0,"flimsy, mine broke"
0,weird sounds when printing
0,Batteries?????
1,"quality printing, fast, cheap cartridges"
0,Not as flashy as some other phones
0,sssslllllloooooowwwwwww
0,"uses much ink, may be cloggy"
1,"Rugged, good looks, good battery, excellent reception."
1,The SUV of strollers.  It will go through anything. 
0,nothing
1,amazing picture quality at good value
0,sound quality
1,"Fast, cheap and doesn't drink ink by the gallon."
1,"so many features, works well for me"
1,"Email, caller ID, voice mail, and aol instant messenger."
1,"Durable, Does all the basics well, decent service"
1,"Size, Battery Life, Picture Quality"
0,Takes time to install the software.
1,"Excellent Ease of Use, Compact Flash, Great Picture Quality"
0,"Battery consumption, inability for macro close-ups, tiny feature buttons"
1,"Quality, ease of use, zoom"
1,"small, light"
1,"attractive phone,nice camera"
1,Inexpensive
1,"Great image quality, high-resolution color LCD screen, menu-driven selection system, multitude of flash and exposure settings"
1,"Great shots, compact size, easy to manipulate"
1,"Small Size, GSM World Phone, Sleek Design"
0,Have to use Hewlett Packard supplies
0,cannot control f-stop or shutter speed
1,"tiny,lovely,functional, easy use....."
0,drains batteries
1,"Sturdy, Remote Control, Large LCD Display, Digital Zoom, 3.34 Mega Pixel"
1,dont like it 
1,"Great coverage, excellent clarity &amp; reasonable rates."
1,"Very big, great seating, large storage on bottom, reasonably priced."
0,"single tricolor tank, colorfastness, waterfastness"
0,"Somewhat bulky when open, display, somewhat confusing navigation circle"
0,"Battery life, styling, 5-way select button that is difficult to push straight down"
1,"size, weight"
1,2400 x 1200 dpi for photo's/graphics; 600 x 600 dpi for text; 4MB built-in RAM
0,None
1,"Feels good, solid, nice screen and easy to use"
1,everything
0,"not too many options, very little zoom"
0,"Little bulky, not much memory."
1,Quality pictures for a reasonable price.
0,"A bit bulky, Lens cap has no logical place to go, camera strap, no camera bag"
0,kind of bulky
0,Terrible picture quality&amp;#13;&amp;#10;easy to heated body&amp;#13;&amp;#10;
0,"Holding was awkward at first, not anymore"
1,"Photo Quality, Easy to Use, Lightweight"
0,battery life
0,"Drains batteries fast, no lense cover, no case."
1,"Good picture quality, excellent computer software, a lot of options"
0,"keypad is well-designed but small, needs standard ringer"
1,works well
0,Color cartridges are high cost
1,BEST PHONE IN THE ENTIRE WORLD
0,"Sensitive to paper used, large footprint"
0,Not the smallest camera on the market
0,"Battery, Data transfer"
1,"Light, Feature Packed, Customizable, Easily fits in pocket"
1,cute
0,"Runs out of ink fast, poor color quality, scanner only scans papers"
0,"Not compact size, attaching add-on lenses is a hassle"
0,Won't feed; keeps jamming; eventually dies like other HP products
1,None
0,"power on/off button, very soft ringtone, takes few seconds before phone shuts off"
0,Price of Ink
1,"Light, cool looking, nice phonebook features"
0,The battery wears after 3 - 4 months
1,Loads and distributes Quickly
1,"Excellent Print time for both color and B&amp;W's,Great photos too! Two sided printing feature"
0,Ink Cartridges Costly (but they all are)
1,you can always make it look different
1,"small, light, great reception, lots of features"
0,costly (initial and maintenance)
1,Easy to use and inexpensive
0,none
1,"price, easy installation"
1,"discounted price. fantastic print quality, quiet, quick, EXCELLENT "
1,"Simple design, easy to learn, simple to use, easy-read manuals and in depth CD information."
0,GSM coverage in the USA is not complete.&#13;&#10;Only 8 entries can have voice tags.
1,great pictures
0,"No Remote Control, Not as durable as the 3000 Zoom"
1,"SLR feel, long zoom, macro, user-friendly"
0,A little bit pricey.
1,Versatility
0,"poor ergonomics, poor flash integration, poor viewfinder, autofocus almost useless"
0,"Everything is controlled through the computer, no frills, PC ONLY"
1,"Small, Flip design, Net capable, Voicemail, 2 way radio, caller ID"
1,"Small &amp; Light, Straight-forward operation"
1,"Inexpensive, fairly good quality, works as digicam and web cam"
1,The fax works
1,"Price, text quality"
0,"unsupported, MP3 software"
0,Battery life
1,"great fast color inkjet, network capabilities"
1,"Great pictures , lots of options, 10x optical zoom!"
0,a flip phone that has no protection for the main screen.
0,prone to crashing
1,"Great price. Easy to use, and pictures are great for a camera for its class."
1,"Sleek, Durable, Megapixel, easy to use good quality photos."
1,"Fast, easy to install, cheap"
1,"Excellent print quality, fast"
1,"Low price, flexible connectivity, good paper handling options, high DPI"
1,"Joy stick control, voice dailing, good customer service"
0,"Slow, poor print quality, voracious ink usage"
1,beautiful pictures
1,"Standard JPEG format, 10x optical zoom, sturdy"
0,Need at  least $5500 to get started
0,um..none
0,none that i noticed
0,could be too narrow for chunky babies
0,"cannot download rings or logos, no vibrate, no clock, inaccurate gauges, convuluted menus."
1,"Small, long battery life, changable faceplates, GSM features"
0,"Poor optical viewfinder, price, Step rather than smooth zoom."
1,pretty packaging
0,"printing photos, customer service"
1,Quality
1,"Great battery life, awesome games, compact, and durable.&#9;&#9;&#9;&#9;&#9;&#9;&#9;&#9;"
0,problems with paper jams and paper feeding
1,Several features
0,A bit noisy...
0,LOUSY battery life.
1,Great Pictures! Easy to use! 
1,Easy to carry and protective from scratches
1,Will fit in your purse
0,uses up ink pretty fast
0,Very expensive w/hardly any storage space.
1,"Lightweight, easy to use, plenty of flexability in software (organize menu...etc)"
1,Small camera; intuitive menus; great pictures
1,"Reversible handle, canopy, boot feature"
1,Ease of use. Quality pictures. Long battery life.
1,"Battery life, camera, clarity, memory slot"
1,"Tiny, powerful features"
0,"only a 2x lens, Eats alkalines for lunch"
1,"Good printing speed, excellent quality, reasonable price"
1,"inexpensive, acceptable quality of printing, reliable machine"
1,It's a phone
1,A Starter Camera with a Great Finish! 
0,Pricy and over-powered signal strength
1,"5 MegaPixel, 8x Zoom, lots of features, accessories, and more pros than I can list"
1,Good Price! Great Picture quality! Easy to learn! Unbeatable value!
0,FAILED AS A MODEM
1,"Very light, easy to use, state-of-the-art battery life"
0,doesn't print in color but I don't use color
0,"small memory card comes with it, sucks batteries"
1,"Sleek and Stylish, Well Constructed, Ergonomically Correct, Good Clarity, Nice Bells and Whistles"
0,A little bit expensive for those new mothers.
1,"High quality, easy to use, reliable"
0,"A little big, comes only with NiMH Battery, Not Lithium Ion"
1,"Functionality, Reliability, Reception"
0,None
1,This is a fun phone until it breaks.
1,"Text Quality, Print output very good"
1,"A decent preview screen, changeable storage media, multimedia capabilities, short video recording"
1,"small, compact, pretty, durable, soft buttons"
1,"great images, price"
1,"Easy, lightweight, durable, good pics"
1,"Ease of use, IR capability"
1,"easy to use, hangs on belt clip nicely"
1,"Lightweight, compact, easy to use, nice color screen"
0,Battery needs to be replaced quickly
0,"Fairly large, canon paper is expensive"
1,"laser quality prints, low supply cost per page"
1,"cheap, Adobe PhotoDeluxe included"
1,"Great image quality,  small lightweight design,  "
