class,text
1,"Absolutely gorgeous, decent audio quality"
1,"Clear reception, light weight, and you're able to change the banner."
0,Pricey
0,Batteries dont last long
0,"Uses many batteries if you utilize the display option, has no zoom capabilities."
1,"Small footprint, laser quality text, inexpensive"
0,"Weird form, Pricey, Camera needs work"
1,"Easy to lear, good resolution, inexpensive"
0,no optical viewfinder
0,"Sometimes sluggish to respond to keypresses, can't make shortcuts to every item."
1,"price effective,very inexpensive"
0,"small memory card comes with it, sucks batteries"
1,"Excellent photos, ease of use, durable."
1,Compact size and very good video for a still camera
1,"Polaroid reputation, price"
0,"Eats batteries, no zoom, poor resolution, slow uploads"
0,Bad quality finish. Poor connector to the charger. Drops calls after 15 minutes.
0,None
1,ready to use right out of the box
1,"As small as a large magic marker, good, simple e-camera to carry all the time."
0,Wish it was a little smaller
0,"Two SMS is horribly integrated, service, expensive"
1,This phone is small sleek and just plain looks nice.
0,Reception SOMETIMES choppy.
0,none really
1,"High quality, easy loading, takes all kinds of paper, AMAZING value, good control program."
0,battery life seems short
1,"The clock is always right. When the display isn't showing ""LOOKING FOR SERVICE"""
0,"Loud, picky"
0,Reliability?
1,"Kodak name, Price, easey to use"
0,bad resolution
1,"quality, versatility."
1,"Nice Size, Easy to Use"
0,Ink cartridges are not at special prices as often as other brands.
1,"Price, size, quality"
0,not the most attractive model
1,"Price, lightweight"
0,The quality of the phone is bad and the quality of the service is worse
1,"Affordable, Reliable"
1,"photo quality, compact, durable"
0,not too fast
0,could us more storage.
1,"Battery Life, Backlight Display, Memory"
1,"small, light, flip-phone, neat features"
1,reasonable price
1,"Size, Durable, Ease of use"
0,lacks optical zoom
0,"Poor quality pics, nearly no print capabilites, cheap look, I can go on and on."
1,"The buttons are not confusing, and you can point and shoot with the camera"
1,"Good interface, is cute and has lots of features."
0,none
0,It runs out of ink and I have to wait!!!!
1,"Cheap ink replacement, small compact size, very very good photo pictures (using photo quality paper)"
0,Only 1216X932
1,Small package delivers great performance
0,"if using for several hours in a row, it tends to get a bit hot."
1,Nice picture quality. Decent price ($260)
1,Direct Connect
0,Flash can tend to drown out picture subjects (very strong!)
0,"Weak red-eye protection, no power adapter."
0,Bulky
1,"Small, nice pictures."
1,"Small,Slim,Light,Cute"
1,Size
1,"Lots of features and control over calling functions, lightweight"
1,Great output even on plain paper
0,batteries are expensive; user-interface could be better
1,Cheap and Small
1,"inexpensive, high quality color and b&amp;w print-out; nice little features "
0,"Banding on the bottom of 81/2X11 photos, B&amp;W photos have a greenish cast"
0,"confusing buttons, terrible menu style, terrible ringers, TERRIBLE SCREENSAVERS."
1,"attractive detatchable face plates, clear calls, compact size, nice price"
0,"Somewhat heavy, lots of unwanted features"
1,Great reception and wonderful display
1,"Durable, good battery life, large screen size"
1,"Small, voice activation features, active infra-red port"
1,"excellent reception, sturdy, and light weight"
0,none
1,"Software, usb &amp;amp; serial cables"
1,Excellent Photos!
0,Somewhat pricey refills still
1,"Good prints, works with XP"
1,The phone is comfortable and easy to use long battery life
1,"Lightweight, High Resolution &amp;amp; Short Movies"
1,"Super Stylish, Cool metallic finish, Great features"
0,Weak flash
0,Blurry outdoor images
1,Superior Camera
0,none
0,"No flash, marginal lens."
0,Its all a sad charade
1,"Lightweight, very compact, has most of the features of a full size stroller"
0,Pricey.  Cannot associate sound per contact - only groups.  Cannot add groups.
1,"Roomy, nice high handles, 5 point harness, BIG canopy"
0,"LCD screen scratches very easily, 0.8 megapixels"
1,"Small, light, navigable menu system, good battery life"
0,I cant think of one.
1,"Ease of use, Quality of images and videos"
1,low priced
0,Too much money
0,Semi-intuitive user interface; Okay battery life; Poor user manual
1,Relatively cheap
1,"Fast, Individually Ink Cartridges,, Durabrite Long Life Inks."
1,"can take some abuse, loaded with features"
1,"$275, Compact, Fun"
0,Doesn't come with the extras that you'll really want to have.
0,no optical zoom
0,Cost of print cartridges.
0,Maybe the price could be 400 dollars.
0,Battery life
0,"kind of expensive, eats batteries like there is no tomorrow"
1,"small size, light weight, easy to use, shoots short movie clips, lcd screen, rechargeable battery"
0,Too fragile for everyday use
0,"poor picture quality, questionable quality control"
1,"Small, light, handsome, good reception and battery life."
1,all in one device
1,"Totally customizable, huge display for a flip, easy usage, features galore"
1,great life for the starter cartridges..how about the full ones?? Just getting ready to find out!
1,easy to configure
0,"Everything from its hard instillation, too is unacceptable performance"
0,Inadequate software
0,"weight is a problem,heavier than others"
0,Shorter seat &amp;amp; canopy than regular umbrella strollers
1,EasyShare system makes fast picture transfer; easy e-mailing and printing; battery recharging
0,No stopwatch.  No bluetooth.
1,Many features for the price and easy to use. 
1,"User friendly, even my 6 year old can use it."
0,not for high volume copiers
1,Color screen and graphics; flip phone; small and sleek; changeable outer body.
0,None!
0,It's not the top-of-the-line printer.
0,Optical view finder does not cover digital zoom. You either guess at the framing or use the LCD which is tough to see in bright daylight.
0,"slightly bulky, immature wireless sync features, poor calendar integration, mediocre ergonomics"
1,Pictures do print out very nice
0,Not the latest phone or technology.
0,Limited under low-light conditions.
1,"easy to set up, operate, all paper formats, superb quality"
0,"Doesn't save settings in auto mode, eats alkalines, camera strap anchor in bad location."
0,"design of phone, gets lots or scratches quickly!"
0,"An ink hog, noisy, unreliable print quality"
1,Its small and compact with great features.
0,"settings, no case"
1,"easy to install and use, multifunction: scan, copy, fax and color/black white printer. Print quality good. Plain paper"
1,"small, clam shell, call clarity, 1xRTT capable, midi sound (polyphonic), web-enabled"
1,"Steady, Reliable, Efficient and Versatile Printer"
1,"Good speakerphone, sound is clear in digital land almost all of the time, tri-mode"
1,Quality
0,"Relatively weak built-in flash, carrying case not included"
0,I have not found any yet.  Costly Ink Cartridges
1,"Sturdy, good-looking, easy to use, helpful features"
1,Impressive features that are much needed for the advanced amateur.
0,None
0,none
0,None.
1,I have never had a paper jam or any problems with it.
0,too big and heavy
0,problems with paper jams and paper feeding
1,Lightweight
1,"Fast, High Quality, Maintenance Free"
0,Use Epson paper for best results
0,"Gulps ink (pricey cartridges), somewhat sloppy ink distribution in color print function"
0,"Too long to turn ON/OFF, only 20 voice-dialing numbers, battery life a bit short"
1,Laser-quality inkjet text and the whitest inkjet papers.
1,"Excellent Pictures, Easy to Use"
1,It prints.
0,"small driver bug, comes with 1/2 full ink cartridges!"
1,Form factor's stunning. Long lasting battery. Voice commands super. Bluetooth gives it a boost.
0,"LCD Screen is placed oddly, stupid prong connection, over time prongs will bend."
0,"limited storage on floppy, hard to use in full sun"
1,"Easy to setup, beautiful color printouts, good compatibility with XP"
1,"Compact size, easy to work around, alarm feature. NO CAMERA! Very durable...just ask the concrete!"
0,No USB cable included at time of purchase. Expensive.
1,"Easy to steer, easy to fold &amp; unfold lots of storage."
0,not very cool-looking
0,Doesn't come with a carrying case
1,"ease of use,picture quality,privacy,features"
0,"camera,video display,"
0,No video outlets. No A/C adaptor.
0,Some features can't be accessed by software if Windows XP. No paper manual.
1,"Inexpensive, Good print quality, Fast"
1,"Sweet Camera, Nice Features"
0,"battery life, lack of memory"
0,None
0,Cartridges are slightly expensive (probably due to printer head built onto them).
1,"Excellent Print Quality,Faster then most printers in this price range"
1,"Outstanding Photo's, Inexpensive"
0,"Poor signal performance, scratches easily."
0,"Poor sound quality,cheap,not all of features"
0,ink cartridges on the expensive side
1,"Fast, Sleek, Compact, Top Quality"
1,can pull in a signal where others can't.
1,"Great Pics!, up 128MB storage, excellent optical zoom, MANY extra features.  Easy USB connection"
1,Incredible images. Numerous features. Good optics. Nikon name.
1,"prints fairly fast, cartridges easily changed"
0,big footprint. won't fit on a desktop
0,microprocessor unreliable
1,Cheap.  Speaker phone that works good.  GPS for 911 to locate you if needed.
1,"Has held up well, very roomy, great ride, and doesn't squeak!"
0,"No lens cover, battery life is horrid."
0,nothing
0,Wish controls were in front
1,Great Feel.  You actually forget you are using a digital camera&amp;#13;&amp;#10;Terrific pictures
1,"Inexpensive Media, Optical View Finder, Switchable LCD, LCD Cover"
0,Expensive and short battery life
0,Small Buttons
1,6x Optical zoom; Great quality; Movie mode; Lightweight 
1,"Compact, stylish, lightweight, and reasonably sturdy"
0,"Small, too close together buttons on keypad.  Slippery plastic finish, hold on tight."
0,not happy with battery use and zoom
1,very sturdy
1,"Sleek and Stylish, Well Constructed, Ergonomically Correct, Good Clarity, Nice Bells and Whistles"
0,Lens cap
0,"Sticks in pockets, hard to open, VGA camera."
0,"Heavy on right side because of the batteries, have to look for off/on button"
1,"easy to use, sensitive, full keyboard"
1,"ease of use, quality, price"
1,"Lightweight and compact, excellent battery life"
0,The toner cartridge is difficult to find.
0,A little larger than some non-flip phones; a little longer start-up time.
1,A very complete quality electronic photo system
0,None that I could think of
1,"simple, takes clear pictures while moving"
0,"keys ""sweat"" on the screen, talk time is 'eh', no full mp3's"
1,"A speedy printer, basic and economical. "
1,infant car seat attaches easily
1,Good close up photography
0,"No web support, short battery life"
1,"Great interface, lots of useful features"
1,"size, weight, price"
1,A lot of memory
1,Great up close pictures
0,"no lens cover, have to buy lots of accessories to get up to speed"
1,CHEAP
0,"Price, size, no case included"
0,Menu not very user friendly
1,"Voice dial, high number holding capacity"
1,"EASY to use, lightweight"
1,"Fast, crisp output, accurate colors, 2-sided printing, envelope feeder"
1,"chic construction, mp3 ringtones, great screen, beautiful earpiece sound"
0,a few details that could be improved on
1,"Astounding design allows for flip to a full ""qwerty"" keyboard. This enables easy text messaging."
1,"Image-quality, Ease-of-use, Build-quality, Ergonomics"
1,"great pictures, no connection needed to download, saves to disk"
0,Slower than photo printers and cannot do edge to edge printing.
1,"crisp, clear photo realistic prints"
0,Hard to break down and somewhat heavy.
0,Guaranteed to fail
0,screen hard to read in sunlight
1,"Sleek body, compact size, Improves on the original!!"
1,"Image Quality, Compact Size, Easy-to-Use Menu"
1,Solid Motorola Design. Great Features. Excellent Reception with a reliable provider.
0,Indifferent image quality; very poor low light images.
1,"Size, size, size! Performance."
0,none
0,Very messy; Ink depleets even when cartridge isn't used; never found compatible generic cartridge.
0,poor quality control &amp;amp; poor attitude 
0,none
1,Palm PDA and cellphone in one
0,service
0,"Relative bulk, doesn't come in yellow"
1,"Small, lightweight, reputable company, decent battery life, loaded w/features"
0,"price, uses new xD picture card"
1,"Easy to use, Un-cluttered by ""extras"", Good value."
1,Great Pictures
0,High price
1,"useful, several machines in one, no problems"
0,buttons are too small to press easily--have to use a fingernail.
0,"Yellow Tint Indoors, Few Physical Design Flaws"
0,I have nothing but problems with this phone
0,Poor software
1,"Fast printing, reasonable quality, moderate ink costs"
1,not many pros here
0,"signal strength, i think this has to do with providers"
1,I wanted a basic clamshell design and liked the feel and ease of use.
0,hard to push in the grass
1,"Small, convenient clarity"
0,I wish it had a telescopic handle and a larger basket.
1,"camera phone & it was free,"
0,Software drivers are a nightmare.
