class,text
0,-lrb- tries -rrb- to parody a genre that 's already a joke in the united states .
0,... stale and uninspired .
0,no. .
0,kirshner and monroe seem to be in a contest to see who can out-bad-act the other .
1,overall very good for what it 's trying to do .
0,i have n't seen such self-amused trash since freddy got fingered .
0,it 's just that it 's so not-at-all-good .
1,"more mature than fatal attraction , more complete than indecent proposal and more relevant than 9 1\/2 weeks , unfaithful is at once intimate and universal cinema ."
0,"when not wallowing in its characters ' frustrations , the movie is busy contriving false , sitcom-worthy solutions to their problems ."
1,"it 's not particularly well made , but since i found myself howling more than cringing , i 'd say the film works ."
0,"it 's possible that something hip and transgressive was being attempted here that stubbornly refused to gel , but the result is more puzzling than unsettling ."
1,a movie that reminds us of just how exciting and satisfying the fantasy cinema can be when it 's approached with imagination and flair .
1,it 's rare for any movie to be as subtle and touching as the son 's room .
0,more tiring than anything .
1,"a real winner -- smart , funny , subtle , and resonant ."
0,... one resurrection too many .
1,"lathan and diggs carry the film with their charisma , and both exhibit sharp comic timing that makes the more hackneyed elements of the film easier to digest ."
1,"lead actress gaï , she of the impossibly long limbs and sweetly conspiratorial smile , is a towering siren ."
0,it merely indulges in the worst elements of all of them .
1,"-lrb- t -rrb- his beguiling belgian fable , very much its own droll and delicate little film , has some touching things to say about what is important in life and why ."
0,"he 's just a sad aristocrat in tattered finery , and the film seems as deflated as he does ."
0,a documentary to make the stones weep -- as shameful as it is scary .
1,it 's a funny little movie with clever dialogue and likeable characters .
1,the film is saved from are n't - kids-cute sentimentality by a warmth that is n't faked and a stately sense of composition .
1,"for those of an indulgent , slightly sunbaked and summery mind , sex and lucia may well prove diverting enough ."
1,"whether writer-director anne fontaine 's film is a ghost story , an account of a nervous breakdown , a trip down memory lane , all three or none of the above , it is as seductive as it is haunting ."
0,pretend like your sat scores are below 120 and you might not notice the flaws .
1,it 's probably worth catching solely on its visual merits .
1,"may not be a breakthrough in filmmaking , but it is unwavering and arresting ."
1,baby-faced renner is eerily convincing as this bland blank of a man with unimaginable demons within .
1,huppert and girardot give performances of exceptional honesty .
0,thumbs down .
0,has all the complexity and realistic human behavior of an episode of general hospital .
0,"such a wildly uneven hit-and-miss enterprise , you ca n't help suspecting that it was improvised on a day-to-day basis during production ."
1,"drawing on an irresistible , languid romanticism , byler reveals the ways in which a sultry evening or a beer-fueled afternoon in the sun can inspire even the most retiring heart to venture forth ."
1,enticing and often funny documentary .
1,it 's a masterpeice .
1,manages to delight without much of a story .
0,it 's pauly shore awful .
1,a forceful drama of an alienated executive who re-invents himself .
1,"the four feathers has rewards , from the exoticism of its seas of sand to the fierce grandeur of its sweeping battle scenes ."
1,"for his first attempt at film noir , spielberg presents a fascinating but flawed look at the near future ."
0,what starts off as a possible argentine american beauty reeks like a room stacked with pungent flowers .
0,predecessors the mummy and the mummy returns stand as intellectual masterpieces next to the scorpion king .
0,brosnan 's finest non-bondish performance yet fails to overcome the film 's manipulative sentimentality and annoying stereotypes .
0,is it really an advantage to invest such subtlety and warmth in an animatronic bear when the humans are acting like puppets ?
1,slick piece of cross-promotion .
0,"it ca n't decide if it wants to be a mystery\/thriller , a romance or a comedy ."
0,"anyone who suffers through this film deserves , at the very least , a big box of consolation candy ."
1,"a poignant and compelling story about relationships , food of love takes us on a bumpy but satisfying journey of the heart ."
0,abysmally pathetic
1,"with ` bowling for columbine , ' michael moore gives us the perfect starting point for a national conversation about guns , violence , and fear ."
1,"... a gleefully grungy , hilariously wicked black comedy ..."
0,a rambling ensemble piece with loosely connected characters and plots that never quite gel .
0,a battle between bug-eye theatre and dead-eye matinee .
1,this bracingly truthful antidote to hollywood teenage movies that slather clearasil over the blemishes of youth captures the combustible mixture of a chafing inner loneliness and desperate grandiosity that tend to characterize puberty .
0,the drama discloses almost nothing .
1,"like a precious and finely cut diamond , magnificent to behold in its sparkling beauty yet in reality it 's one tough rock ."
0,-lrb- t -rrb- oo many of these gross out scenes ...
1,"shot in rich , shadowy black-and-white , devils chronicles , with increasingly amused irony , the relationship between reluctant captors and befuddled captives ."
0,utter mush ... conceited pap .
0,"like a three-ring circus , there are side stories aplenty -- none of them memorable ."
1,"the overall effect is awe and affection -- and a strange urge to get on a board and , uh , shred , dude ."
0,wait to see it then .
0,degenerates into hogwash .
0,too bland and fustily tasteful to be truly prurient .
0,it appears as if even the filmmakers did n't know what kind of movie they were making .
0,completely creatively stillborn and executed in a manner that i 'm not sure could be a single iota worse ... a soulless hunk of exploitative garbage .
0,you try to guess the order in which the kids in the house will be gored .
1,the early and middle passages are surprising in how much they engage and even touch us .
1,"quiet , adult and just about more stately than any contemporary movie this year ... a true study , a film with a questioning heart and mind that is n't afraid to admit it does n't have all the answers ."
1,"feature debuter d.j. caruso directs a crack ensemble cast , bringing screenwriter tony gayton 's narcotics noir to life ."
0,"the story passes time until it 's time for an absurd finale of twisted metal , fireballs and revenge ."
1,"reassuring , retro uplifter ."
1,"the first tunisian film i have ever seen , and it 's also probably the most good-hearted yet sensual entertainment i 'm likely to see all year ."
0,bad .
1,"the hours , a delicately crafted film , is an impressive achievement in spite of a river of sadness that pours into every frame ."
0,do n't be fooled by the impressive cast list - eye see you is pure junk .
1,"a completely spooky piece of business that gets under your skin and , some plot blips aside , stays there for the duration ."
1,"engages us in constant fits of laughter , until we find ourselves surprised at how much we care about the story , and end up walking out not only satisfied but also somewhat touched ."
1,rarely have i seen a film so willing to champion the fallibility of the human heart .
0,one suspects that craven endorses they simply because this movie makes his own look much better by comparison .
0,"to me , it sounds like a cruel deception carried out by men of marginal intelligence , with reactionary ideas about women and a total lack of empathy ."
1,a small gem from belgium .
0,you 'd be hard put to find a movie character more unattractive or odorous -lrb- than leon -rrb- .
0,"a thoroughly awful movie -- dumb , narratively chaotic , visually sloppy ... a weird amalgam of ` the thing ' and a geriatric ` scream . '"
1,"as a girl-meets-girl romantic comedy , kissing jessica steinis quirky , charming and often hilarious ."
1,"despite an overwrought ending , the film works as well as it does because of the performances ."
1,"could have been crisper and punchier , but it 's likely to please audiences who like movies that demand four hankies ."
0,romething 's really wrong with this ricture !
0,"the overall vibe is druggy and self-indulgent , like a spring-break orgy for pretentious arts majors ."
1,"highbrow self-appointed guardians of culture need not apply , but those who loved cool as ice have at last found a worthy follow-up ."
1,"unfolds in a low-key , organic way that encourages you to accept it as life and go with its flow ."
1,it was only a matter of time before some savvy producer saw the potential success inherent in the mixture of bullock bubble and hugh goo .
0,"such a fine idea for a film , and such a stultifying , lifeless execution ."
0,"lyne 's latest , the erotic thriller unfaithful , further demonstrates just how far his storytelling skills have eroded ."
0,"after seeing the film , i can tell you that there 's no other reason why anyone should bother remembering it ."
0,"this rather unfocused , all-over-the-map movie would be a lot better if it pared down its plots and characters to a few rather than dozens ... or if it were subtler ... or if it had a sense of humor ."
0,"never having seen the first two films in the series , i ca n't compare friday after next to them , but nothing would change the fact that what we have here is a load of clams left in the broiling sun for a good three days ."
0,a cautionary tale about the folly of superficiality that is itself endlessly superficial .
0,"a dull , somnambulant exercise in pretension whose pervasive quiet is broken by frequent outbursts of violence and noise ."
0,"while it 's all quite tasteful to look at , the attention process tends to do a little fleeing of its own ."
0,"a baffling subplot involving smuggling drugs inside danish cows falls flat , and if you 're going to alter the bard 's ending , you 'd better have a good alternative ."
1,-lrb- allen -rrb- manages to breathe life into this somewhat tired premise .
0,a story which fails to rise above its disgusting source material .
1,bravado kathy !
1,a compelling coming-of-age drama about the arduous journey of a sensitive young girl through a series of foster homes and a fierce struggle to pull free from her dangerous and domineering mother 's hold over her .
0,"despite slick production values and director roger michell 's tick-tock pacing , the final effect is like having two guys yelling in your face for two hours ."
0,"` synthetic ' is the best description of this well-meaning , beautifully produced film that sacrifices its promise for a high-powered star pedigree ."
1,... there 's enough cool fun here to warm the hearts of animation enthusiasts of all ages .
0,mattei 's underdeveloped effort here is nothing but a convenient conveyor belt of brooding personalities that parade about as if they were coming back from stock character camp -- a drowsy drama infatuated by its own pretentious self-examination .
0,"louiso lets the movie dawdle in classic disaffected-indie-film mode , and brother hoffman 's script stumbles over a late-inning twist that just does n't make sense ."
0,but what are adults doing in the theater at all ?
0,the story has little wit and no surprises .
1,"others , more attuned to the anarchist maxim that ` the urge to destroy is also a creative urge ' , or more willing to see with their own eyes , will find morrison 's iconoclastic uses of technology to be liberating ."
1,"executed with such gentle but insistent sincerity , with such good humor and appreciation of the daily grind that only the most hardhearted scrooge could fail to respond ."
1,"while the filmmaking may be a bit disjointed , the subject matter is so fascinating that you wo n't care ."
1,this is a sincerely crafted picture that deserves to emerge from the traffic jam of holiday movies .
1,allen shows he can outgag any of those young whippersnappers making moving pictures today .
1,it is definitely worth seeing .
0,an unsophisticated sci-fi drama that takes itself all too seriously .
1,an intense and effective film about loneliness and the chilly anonymity of the environments where so many of us spend so much of our time .
0,"we can tell what it is supposed to be , but ca n't really call it a work of art ."
1,superb production values & christian bale 's charisma make up for a derivative plot .
1,"evokes a palpable sense of disconnection , made all the more poignant by the incessant use of cell phones ."
0,"journalistically dubious , inept and often lethally dull ."
0,watching a brian depalma movie is like watching an alfred hitchcock movie after drinking twelve beers .
1,"first and foremost ... the reason to go see `` blue crush '' is the phenomenal , water-born cinematography by david hennings ."
1,the closest thing to the experience of space travel
1,"the movie has an infectious exuberance that will engage anyone with a passing interest in the skate\/surf culture , the l.a. beach scene and the imaginative -lrb- and sometimes illegal -rrb- ways kids can make a playground out of the refuse of adults ."
1,leguizamo and jones are both excellent and the rest of the cast is uniformly superb .
1,ramsay and morton fill this character study with poetic force and buoyant feeling .
0,"while some of the camera work is interesting , the film 's mid-to-low budget is betrayed by the surprisingly shoddy makeup work ."
1,scooby dooby doo \/ and shaggy too \/ you both look and sound great .
0,"normally , rohmer 's talky films fascinate me , but when he moves his setting to the past , and relies on a historical text , he loses the richness of characterization that makes his films so memorable ."
0,"features nonsensical and laughable plotting , wooden performances , ineptly directed action sequences and some of the worst dialogue in recent memory ."
1,-lrb- fincher 's -rrb- camera sense and assured pacing make it an above-average thriller .
1,"vera has created a provocative , absorbing drama that reveals the curse of a self-hatred instilled by rigid social mores ."
1,predictable storyline and by-the-book scripting is all but washed away by sumptuous ocean visuals and the cinematic stylings of director john stockwell .
0,"by getting myself wrapped up in the visuals and eccentricities of many of the characters , i found myself confused when it came time to get to the heart of the movie ."
1,"a hypnotic portrait of this sad , compulsive life ."
0,unflinchingly bleak and desperate
0,witless and utterly pointless .
0,"you emerge dazed , confused as to whether you 've seen pornography or documentary ."
0,"sandra bullock , despite downplaying her good looks , carries a little too much ai n't - she-cute baggage into her lead role as a troubled and determined homicide cop to quite pull off the heavy stuff ."
0,this is one baaaaaaaaad movie .
0,it 's the humanizing stuff that will probably sink the film for anyone who does n't think about percentages all day long .
1,a hypnotic cyber hymn and a cruel story of youth culture .
0,"this mild-mannered farce , directed by one of its writers , john c. walsh , is corny in a way that bespeaks an expiration date passed a long time ago ."
1,"a mix of gritty realism , crisp storytelling and radiant compassion that effortlessly draws you in ."
1,"a fine production with splendid singing by angela gheorghiu , ruggero raimondi , and roberto alagna ."
0,"in the end , tuck everlasting falls victim to that everlasting conundrum experienced by every human who ever lived : too much to do , too little time to do it in ."
0,plays like a series of vignettes -- clips of a film that are still looking for a common through-line .
0,"if there 's one thing this world needs less of , it 's movies about college that are written and directed by people who could n't pass an entrance exam ."
1,mr. scorsese 's bravery and integrity in advancing this vision can hardly be underestimated .
0,"outer-space buffs might love this film , but others will find its pleasures intermittent ."
1,"if anything , see it for karen black , who camps up a storm as a fringe feminist conspiracy theorist named dirty dick ."
0,"payami tries to raise some serious issues about iran 's electoral process , but the result is a film that 's about as subtle as a party political broadcast ."
1,"it 's all about anakin ... and the lustrous polished visuals rich in color and creativity and , of course , special effect ."
0,a little weak -- and it is n't that funny .
0,"shreve 's graceful dual narrative gets clunky on the screen , and we keep getting torn away from the compelling historical tale to a less-compelling soap opera ."
1,wise and deadpan humorous .
0,"it 's an odd show , pregnant with moods , stillborn except as a harsh conceptual exercise ."
1,featherweight romantic comedy has a few nice twists in a standard plot and the charisma of hugh grant and sandra bullock .
1,"reign of fire is hardly the most original fantasy film ever made -- beyond road warrior , it owes enormous debts to aliens and every previous dragon drama -- but that barely makes it any less entertaining ."
1,a strangely stirring experience that finds warmth in the coldest environment and makes each crumb of emotional comfort feel like a 10-course banquet .
1,"i am not generally a huge fan of cartoons derived from tv shows , but hey arnold !"
0,"it has the air of a surprisingly juvenile lark , a pop-influenced prank whose charms are immediately apparent and wear thin with repetition ."
0,"throwing in everything except someone pulling the pin from a grenade with his teeth , windtalkers seems to have ransacked every old world war ii movie for overly familiar material ."
0,"mr. deeds is not really a film as much as it is a loose collection of not-so-funny gags , scattered moments of lazy humor ."
1,"mr. polanski is in his element here : alone , abandoned , but still consoled by his art , which is more than he has ever revealed before about the source of his spiritual survival ."
0,is that it 's a crime movie made by someone who obviously knows nothing about crime .
0,"resident evil is n't a product of its cinematic predecessors so much as an mtv , sugar hysteria , and playstation cocktail ."
0,the whole talking-animal thing is grisly .
0,it 's not a great monster movie .
1,"lee 's achievement extends to his supple understanding of the role that brown played in american culture as an athlete , a movie star , and an image of black indomitability ."
1,"though it goes further than both , anyone who has seen the hunger or cat people will find little new here , but a tasty performance from vincent gallo lifts this tale of cannibal lust above the ordinary ."
1,"shiner can certainly go the distance , but is n't world championship material"
1,a quietly moving look back at what it was to be iranian-american in 1979 .
0,it all comes down to whether you can tolerate leon barlow .
1,yakusho and shimizu ... create engaging characterizations in imamura 's lively and enjoyable cultural mix .
0,none of this is half as moving as the filmmakers seem to think .
0,"cold , pretentious , thoroughly dislikable study in sociopathy ."
1,perhaps the best sports movie i 've ever seen .
1,"a heartbreakingly thoughtful minor classic , the work of a genuine and singular artist ."
1,a mesmerizing cinematic poem from the first frame to the last .
1,"there is little question that this is a serious work by an important director who has something new to say about how , in the flip-flop of courtship , we often reel in when we should be playing out ."
1,the immersive powers of the giant screen and its hyper-realistic images are put to perfect use in the breathtakingly beautiful outer-space documentary space station 3d .
1,"a bittersweet contemporary comedy about benevolent deception , which , while it may not rival the filmmaker 's period pieces , is still very much worth seeing ."
1,foster breathes life into a roll that could have otherwise been bland and run of the mill .
0,"distances you by throwing out so many red herrings , so many false scares , that the genuine ones barely register ."
1,"shanghai ghetto , much stranger than any fiction , brings this unknown slice of history affectingly to life ."
0,"the movie 's messages are quite admirable , but the story is just too clichéd and too often strains credulity ."
1,"if you 're not , you 'll still have a good time . ''"
1,"a vibrant whirlwind of love , family and all that goes with it , my big fat greek wedding is a non-stop funny feast of warmth , colour and cringe ."
0,"the movie is the equivalent of french hip-hop , which also seems to play on a 10-year delay ."
1,"grant carries the day with impeccable comic timing , raffish charm and piercing intellect ."
1,"watching war photographer , you come to believe that nachtwey hates the wars he shows and empathizes with the victims he reveals ."
0,"starts out mediocre , spirals downward , and thuds to the bottom of the pool with an utterly incompetent conclusion ."
0,"while it is welcome to see a chinese film depict a homosexual relationship in a mature and frank fashion , lan yu never catches dramatic fire ."
1,"a subtle , humorous , illuminating study of politics , power and social mobility ."
1,"writer\/director david caesar ladles on the local flavour with a hugely enjoyable film about changing times , clashing cultures and the pleasures of a well-made pizza ."
1,"as satisfyingly odd and intriguing a tale as it was a century and a half ago ... has a delightfully dour , deadpan tone and stylistic consistency ."
0,but the film itself is ultimately quite unengaging .
1,"it 's affecting , amusing , sad and reflective ."
1,campbell scott finds the ideal outlet for his flick-knife diction in the role of roger swanson .
0,a potentially good comic premise and excellent cast are terribly wasted .
0,perhaps even the slc high command found writer-director mitch davis 's wall of kitsch hard going .
1,"though overall an overwhelmingly positive portrayal , the film does n't ignore the more problematic aspects of brown 's life ."
0,"although purportedly a study in modern alienation , it 's really little more than a particularly slanted , gay s\/m fantasy , enervating and deadeningly drawn-out ."
1,rare birds has more than enough charm to make it memorable .
1,with the prospect of films like kangaroo jack about to burst across america 's winter movie screens it 's a pleasure to have a film like the hours as an alternative .
0,"... there 's a choppy , surface-effect feeling to the whole enterprise ."
1,"the aaa of action , xxx is a blast of adrenalin , rated eee for excitement ."
0,"when -lrb- reno -rrb- lets her radical flag fly , taking angry potshots at george w. bush , henry kissinger , larry king , et al. , reno devolves into a laugh-free lecture ."
1,"singer\/composer bryan adams contributes a slew of songs -- a few potential hits , a few more simply intrusive to the story -- but the whole package certainly captures the intended , er , spirit of the piece ."
0,vera 's technical prowess ends up selling his film short ; he smoothes over hard truths even as he uncovers them .
0,"with minimal imagination , you could restage the whole thing in your bathtub ."
1,a glib but bouncy bit of sixties-style slickness in which the hero might wind up caught but the audience gets pure escapism .
0,"perhaps a better celebration of these unfairly dismissed heroes would be a film that is n't this painfully forced , false and fabricated ."
1,"... the first 2\/3 of the film are incredibly captivating and insanely funny , thanks in part to interesting cinematic devices -lrb- cool visual backmasking -rrb- , a solid cast , and some wickedly sick and twisted humor ..."
1,a conventional but heartwarming tale .
0,"deuces wild treads heavily into romeo and juliet\/west side story territory , where it plainly has no business going ."
1,you can take the grandkids or the grandparents and never worry about anyone being bored ... audience is a sea of constant smiles and frequent laughter .
0,an incoherent jumble of a film that 's rarely as entertaining as it could have been .
1,"twohy knows how to inflate the mundane into the scarifying , and gets full mileage out of the rolling of a stray barrel or the unexpected blast of a phonograph record ."
0,"... while each moment of this broken character study is rich in emotional texture , the journey does n't really go anywhere ."
1,topics that could make a sailor blush - but lots of laughs .
1,"bogdanovich taps deep into the hearst mystique , entertainingly reenacting a historic scandal ."
0,"well , jason 's gone to manhattan and hell , i guess a space station in the year 2455 can be crossed off the list of ideas for the inevitable future sequels -lrb- hey , do n't shoot the messenger -rrb- ."
1,"the increasingly diverse french director has created a film that one can honestly describe as looking , sounding and simply feeling like no other film in recent history ."
1,"a fresh-faced , big-hearted and frequently funny thrill ride for the kiddies , with enough eye candy and cheeky wit to keep parents away from the concession stand . '"
0,"a better title , for all concerned , might be swept under the rug ."
1,a wild ride with eight boarders from venice beach that was a deserved co-winner of the audience award for documentaries at the sundance film festival .
1,"the movie , despite its rough edges and a tendency to sag in certain places , is wry and engrossing ."
