class,text
1,a journey that is as difficult for the audience to take as it is for the protagonist -- yet it 's potentially just as rewarding .
1,"on its own staggeringly unoriginal terms , this gender-bending comedy is generally quite funny ."
0,"unless you 're a fanatic , the best advice is : ` scooby ' do n't ."
0,"the dialogue is cumbersome , the simpering soundtrack and editing more so ."
1,serious and thoughtful .
0,feels less like a change in -lrb- herzog 's -rrb- personal policy than a half-hearted fluke .
1,"these characters are so well established that the gang feels comfortable with taking insane liberties and doing the goofiest stuff out of left field , and i 'm all for that ."
0,director jay russell weighs down his capricious fairy-tale with heavy sentiment and lightweight meaning .
1,sweet and memorable film .
0,"`` sorority boys '' was funnier , and that movie was pretty bad ."
1,"these three films form a remarkably cohesive whole , both visually and thematically , through their consistently sensitive and often exciting treatment of an ignored people ."
0,"the effort is sincere and the results are honest , but the film is so bleak that it 's hardly watchable ."
0,one of the worst movies of the year .
1,what elevates the movie above the run-of-the-mill singles blender is its surreal sense of humor and technological finish .
1,"like kubrick , soderbergh is n't afraid to try any genre and to do it his own way ."
0,"a depraved , incoherent , instantly disposable piece of hackery ."
0,but they do n't fit well together and neither is well told .
1,read my lips is to be viewed and treasured for its extraordinary intelligence and originality as well as its lyrical variations on the game of love .
1,one of the most important and exhilarating forms of animated filmmaking since old walt doodled steamboat willie .
0,"delivers the same old same old , tarted up with latin flava and turned out by hollywood playas ."
0,"it 's dull , spiritless , silly and monotonous : an ultra-loud blast of pointless mayhem , going nowhere fast ."
0,"aside from the fact that the film idiotically uses the website feardotcom.com or the improperly hammy performance from poor stephen rea , the film gets added disdain for the fact that it is nearly impossible to look at or understand ."
0,"too campy to work as straight drama and too violent and sordid to function as comedy , vulgar is , truly and thankfully , a one-of-a-kind work ."
1,"audrey tatou has a knack for picking roles that magnify her outrageous charm , and in this literate french comedy , she 's as morning-glory exuberant as she was in amélie ."
1,it certainly wo n't win any awards in the plot department but it sets out with no pretensions and delivers big time .
1,"featuring a dangerously seductive performance from the great daniel auteuil , `` sade '' covers the same period as kaufmann 's `` quills '' with more unsettlingly realistic results ."
0,the threat implied in the title pokémon 4ever is terrifying -- like locusts in a horde these things will keep coming .
1,"the performances are immaculate , with roussillon providing comic relief ."
0,i do n't think this movie loves women at all .
0,this riveting world war ii moral suspense story deals with the shadow side of american culture : racial prejudice in its ugly and diverse forms .
0,is it a comedy ?
0,"an ugly , pointless , stupid movie ."
1,an encouraging effort from mccrudden
1,"still , as a visual treat , the film is almost unsurpassed ."
0,well-meant but unoriginal .
0,"as underwater ghost stories go , below casts its spooky net out into the atlantic ocean and spits it back , grizzled and charred , somewhere northwest of the bermuda triangle ."
0,it 's so devoid of joy and energy it makes even jason x ... look positively shakesperean by comparison .
0,"despite engaging offbeat touches , knockaround guys rarely seems interested in kicking around a raison d'etre that 's as fresh-faced as its young-guns cast ."
0,"the movie is so resolutely cobbled together out of older movies that it even uses a totally unnecessary prologue , just because it seems obligatory ."
0,"partway through watching this saccharine , easter-egg-colored concoction , you realize that it is made up of three episodes of a rejected tv show ."
1,hard to resist .
1,much of what we see is horrible but it 's also undeniably exceedingly clever .
1,"even if you 've seen `` stomp '' -lrb- the stage show -rrb- , you still have to see this !"
1,"worth a look by those on both sides of the issues , if only for the perspective it offers , one the public rarely sees ."
1,"an admirable , sometimes exceptional film"
0,collapses after 30 minutes into a slap-happy series of adolescent violence .
1,"this fascinating look at israel in ferment feels as immediate as the latest news footage from gaza and , because of its heightened , well-shaped dramas , twice as powerful ."
1,canadian filmmaker gary burns ' inventive and mordantly humorous take on the soullessness of work in the city .
1,a literary detective story is still a detective story and aficionados of the whodunit wo n't be disappointed .
1,that old adage about women being unknowable gets an exhilarating new interpretation in morvern callar .
1,a lot smarter than your average bond .
1,"we know the plot 's a little crazy , but it held my interest from start to finish ."
1,"good film , but very glum ."
0,"this film seems thirsty for reflection , itself taking on adolescent qualities ."
1,"works , it 's thanks to huston 's revelatory performance ."
1,"all in all , it 's a pretty good execution of a story that 's a lot richer than the ones hollywood action screenwriters usually come up with on their own ."
1,i firmly believe that a good video game movie is going to show up soon .
0,"purposefully shocking in its eroticized gore , if unintentionally dull in its lack of poetic frissons ."
0,it 's just plain lurid when it is n't downright silly .
0,` cq may one day be fondly remembered as roman coppola 's brief pretentious period before going on to other films that actually tell a story worth caring about
1,"beautifully shot , delicately scored and powered by a set of heartfelt performances , it 's a lyrical endeavour ."
0,the fetid underbelly of fame has never looked uglier .
1,"one of those movies that catches you up in something bigger than yourself , namely , an archetypal desire to enjoy good trash every now and then ."
0,suffers from unlikable characters and a self-conscious sense of its own quirky hipness .
0,... nothing scary here except for some awful acting and lame special effects .
0,predictably melodramatic .
1,"yes , soar ."
0,"nemesis suffers from a paunchy midsection , several plodding action sequences and a wickedly undramatic central theme ."
0,all too familiar ... basically the sort of cautionary tale that was old when ` angels with dirty faces ' appeared in 1938 .
1,"amid the new populist comedies that underscore the importance of family tradition and familial community , one would be hard-pressed to find a movie with a bigger , fatter heart than barbershop ."
1,"hatfield and hicks make the oddest of couples , and in this sense the movie becomes a study of the gambles of the publishing world , offering a case study that exists apart from all the movie 's political ramifications ."
0,"not counting a few gross-out comedies i 've been trying to forget , this is the first film in a long time that made me want to bolt the theater in the first 10 minutes ."
1,"neither the funniest film that eddie murphy nor robert de niro has ever made , showtime is nevertheless efficiently amusing for a good while ."
1,a painfully funny ode to bad behavior .
1,uses high comedy to evoke surprising poignance .
1,"it really is a shame that more wo n't get an opportunity to embrace small , sweet ` evelyn . '"
1,a surprisingly charming and even witty match for the best of hollywood 's comic-book adaptations .
1,the kind of primal storytelling that george lucas can only dream of .
1,the film has the uncanny ability to right itself precisely when you think it 's in danger of going wrong .
0,this dreadfully earnest inversion of the concubine love triangle eschews the previous film 's historical panorama and roiling pathos for bug-eyed mugging and gay-niche condescension .
0,"i sympathize with the plight of these families , but the movie does n't do a very good job conveying the issue at hand ."
1,"kids five and up will be delighted with the fast , funny , and even touching story ."
1,"anyone who welcomes a dash of the avant-garde fused with their humor should take pleasure in this crazed , joyous romp of a film ."
1,"terrific performances , great to look at , and funny ."
0,rarely has so much money delivered so little entertainment .
1,will warm your heart without making you feel guilty about it .
1,"take any 12-year-old boy to see this picture , and he 'll be your slave for a year ."
0,"shallow , noisy and pretentious ."
0,"priggish , lethargically paced parable of renewal ."
0,a handsome but unfulfilling suspense drama more suited to a quiet evening on pbs than a night out at an amc .
1,"seen in that light , moonlight mile should strike a nerve in many ."
1,robert harmon 's less-is-more approach delivers real bump-in - the-night chills -- his greatest triumph is keeping the creepy crawlies hidden in the film 's thick shadows .
0,"supposedly , pokemon ca n't be killed , but pokemon 4ever practically assures that the pocket monster movie franchise is nearly ready to keel over ."
0,"this is the kind of movie during which you want to bang your head on the seat in front of you , at its cluelessness , at its idiocy , at its utterly misplaced earnestness ."
1,this is christmas future for a lot of baby boomers .
1,a compelling allegory about the last days of germany 's democratic weimar republic .
0,it squanders chan 's uniqueness ; it could even be said to squander jennifer love hewitt !
0,their contrast is neither dramatic nor comic -- it 's just a weird fizzle .
1,"a lot of fun , with an undeniable energy sparked by two actresses in their 50s working at the peak of their powers ."
1,"when it 's this rich and luscious , who cares ?"
1,combine the paranoid claustrophobia of a submarine movie with the unsettling spookiness of the supernatural -- why did n't hollywood think of this sooner ?
1,that 's why sex and lucia is so alluring .
1,"conceptually brilliant ... plays like a living-room war of the worlds , gaining most of its unsettling force from the suggested and the unknown ."
1,the wild thornberrys movie has all the sibling rivalry and general family chaos to which anyone can relate .
1,this is an interesting movie ! ''
0,serving sara does n't serve up a whole lot of laughs .
1,"an oddity , to be sure , but one that you might wind up remembering with a degree of affection rather than revulsion ."
1,you wo n't have any trouble getting kids to eat up these veggies .
0,there 's a whole heap of nothing at the core of this slight coming-of-age\/coming-out tale .
0,"though there are many tense scenes in trapped , they prove more distressing than suspenseful ."
0,"the movie is concocted and carried out by folks worthy of scorn , and the nicest thing i can say is that i ca n't remember a single name responsible for it ."
0,it 's an 88-minute highlight reel that 's 86 minutes too long .
1,the viewer takes great pleasure in watching the resourceful molly stay a step ahead of her pursuers .
0,a non-mystery mystery .
0,"with zoe clarke-williams 's lackluster thriller `` new best friend '' , who needs enemies ?"
0,"for its 100 minutes running time , you 'll wait in vain for a movie to happen ."
0,do not see this film .
1,"by and large this is mr. kilmer 's movie , and it 's his strongest performance since the doors ."
0,sade achieves the near-impossible : it turns the marquis de sade into a dullard .
1,the concept is a hoot .
0,"dragonfly has no atmosphere , no tension -- nothing but costner , flailing away ."
0,"try this obscenely bad dark comedy , so crass that it makes edward burns ' sidewalks of new york look like oscar wilde ."
1,here is a vh1 behind the music special that has something a little more special behind it : music that did n't sell many records but helped change a nation .
1,"it 's more enjoyable than i expected , though , and that 's because the laughs come from fairly basic comedic constructs ."
1,an old-fashioned but emotionally stirring adventure tale of the kind they rarely make anymore .
0,the plan to make enough into ` an inspiring tale of survival wrapped in the heart-pounding suspense of a stylish psychological thriller ' has flopped as surely as a soufflé gone wrong .
0,the movie weighs no more than a glass of flat champagne .
0,"the audience when i saw this one was chuckling at all the wrong times , and that 's a bad sign when they 're supposed to be having a collective heart attack ."
1,"what lee does so marvelously compelling is present brown as a catalyst for the struggle of black manhood in restrictive and chaotic america ... sketchy but nevertheless gripping portrait of jim brown , a celebrated wonder in the spotlight"
0,everything is off .
1,"it cooks conduct in a low , smoky and inviting sizzle ."
0,plotless collection of moronic stunts is by far the worst movie of the year .
0,"too restrained to be a freak show , too mercenary and obvious to be cerebral , too dull and pretentious to be engaging ... the isle defies an easy categorization ."
0,"a film really has to be exceptional to justify a three hour running time , and this is n't ."
0,"after all , he took three minutes of dialogue , 30 seconds of plot and turned them into a 90-minute movie that feels five hours long ."
1,more sophisticated and literate than such pictures usually are ... an amusing little catch .
0,"simply put , there should have been a more compelling excuse to pair susan sarandon and goldie hawn ."
1,a solid film ... but more conscientious than it is truly stirring .
0,... the film suffers from a lack of humor -lrb- something needed to balance out the violence -rrb- ...
1,"a very well-meaning movie , and it will stand in future years as an eloquent memorial to the world trade center tragedy ."
0,the whole mess boils down to a transparently hypocritical work that feels as though it 's trying to set the women 's liberation movement back 20 years . '
1,"on that score , the film certainly does n't disappoint ."
0,"unfunny and lacking any sense of commitment to or affection for its characters , the reginald hudlin comedy relies on toilet humor , ethnic slurs ."
0,earnest yet curiously tepid and choppy recycling in which predictability is the only winner .
0,just a kiss is a just a waste .
1,"there 's something auspicious , and daring , too , about the artistic instinct that pushes a majority-oriented director like steven spielberg to follow a.i. with this challenging report so liable to unnerve the majority ."
0,"slack and uninspired , and peopled mainly by characters so unsympathetic that you 're left with a sour taste in your mouth ."
0,"in other words , it 's just another sports drama\/character study ."
1,-lrb- ferrera -rrb- has the charisma of a young woman who knows how to hold the screen .
1,the sheer joy and pride they took in their work -- and in each other -- shines through every frame .
0,"even as i valiantly struggled to remain interested , or at least conscious , i could feel my eyelids ... getting ... very ... heavy ..."
1,"this is an exercise in chilling style , and twohy films the sub , inside and out , with an eye on preserving a sense of mystery ."
0,"after sitting through this sloppy , made-for-movie comedy special , it makes me wonder if lawrence hates criticism so much that he refuses to evaluate his own work ."
0,borrows from other movies like it in the most ordinary and obvious fashion .
0,comes ... uncomfortably close to coasting in the treads of the bicycle thief .
0,"such a premise is ripe for all manner of lunacy , but kaufman and gondry rarely seem sure of where it should go ."
0,"britney spears ' phoniness is nothing compared to the movie 's contrived , lame screenplay and listless direction ."
1,"an undeniably gorgeous , terminally smitten document of a troubadour , his acolytes , and the triumph of his band ."
1,"300 years of russian history and culture compressed into an evanescent , seamless and sumptuous stream of consciousness ."
0,the sweetest thing leaves a bitter taste .
1,that the real antwone fisher was able to overcome his personal obstacles and become a good man is a wonderful thing ; that he has been able to share his story so compellingly with us is a minor miracle .
0,"in addition to sporting one of the worst titles in recent cinematic history , ballistic : ecks vs. sever also features terrible , banal dialogue ; convenient , hole-ridden plotting ; superficial characters and a rather dull , unimaginative car chase ."
0,"feels haphazard , as if the writers mistakenly thought they could achieve an air of frantic spontaneity by simply tossing in lots of characters doing silly stuff and stirring the pot ."
0,imperfect ?
0,it 's as if a bored cage spent the duration of the film 's shooting schedule waiting to scream : `` got aids yet ? ''
1,"adams , with four scriptwriters , takes care with the characters , who are so believable that you feel what they feel ."
1,"a riveting profile of law enforcement , and a visceral , nasty journey into an urban hades ."
1,"overall , it 's a very entertaining , thought-provoking film with a simple message : god is love ."
0,"for a guy who has waited three years with breathless anticipation for a new hal hartley movie to pore over , no such thing is a big letdown ."
1,"it 's refreshing that someone understands the need for the bad boy ; diesel , with his brawny frame and cool , composed delivery , fits the bill perfectly ."
0,"despite its hawaiian setting , the science-fiction trimmings and some moments of rowdy slapstick , the basic plot of `` lilo '' could have been pulled from a tear-stained vintage shirley temple script ."
1,"there is a beautiful , aching sadness to it all ."
1,the history is fascinating ; the action is dazzling .
0,but its storytelling prowess and special effects are both listless .
1,intriguing and stylish .
0,stay away .
0,the action quickly sinks into by-the-numbers territory .
0,"its impressive images of crematorium chimney fires and stacks of dead bodies are undermined by the movie 's presentation , which is way too stagy ."
0,too infuriatingly quirky and taken with its own style .
0,"there 's a little violence and lots of sex in a bid to hold our attention , but it grows monotonous after a while , as do joan and philip 's repetitive arguments , schemes and treachery ."
0,everything -- even life on an aircraft carrier -- is sentimentalized .
1,thoroughly enjoyable .
0,what a great shame that such a talented director as chen kaige has chosen to make his english-language debut with a film so poorly plotted and scripted .
1,it 's made with deftly unsettling genre flair .
1,"while not for every taste , this often very funny collegiate gross-out comedy goes a long way toward restoring the luster of the national lampoon film franchise , too long reduced to direct-to-video irrelevancy ."
0,"some of the computer animation is handsome , and various amusing sidekicks add much-needed levity to the otherwise bleak tale , but overall the film never rises above mediocrity ."
0,the santa clause 2 's plot may sound like it was co-written by mattel executives and lobbyists for the tinsel industry .
0,yet another arnold vehicle that fails to make adequate use of his particular talents .
0,"the whole thing 's fairly lame , making it par for the course for disney sequels ."
1,"the film brilliantly shines on all the characters , as the direction is intelligently accomplished ."
0,"one of those pictures whose promising , if rather precious , premise is undercut by amateurish execution ."
1,"it excels because , unlike so many other hollywood movies of its ilk , it offers hope ."
1,much of the movie 's charm lies in the utter cuteness of stuart and margolo .
0,"it 's unfortunate that wallace , who wrote gibson 's braveheart as well as the recent pearl harbor , has such an irrepressible passion for sappy situations and dialogue ."
0,"wanders all over the map thematically and stylistically , and borrows heavily from lynch , jeunet , and von trier while failing to find a spark of its own ."
1,"a hugely rewarding experience that 's every bit as enlightening , insightful and entertaining as grant 's two best films -- four weddings and a funeral and bridget jones 's diary ."
0,it 's all surface psychodramatics .
0,and adults will at least have a dream image of the west to savor whenever the film 's lamer instincts are in the saddle .
0,"terminally bland , painfully slow and needlessly confusing ... the movie , shot on digital videotape rather than film , is frequently indecipherable ."
1,"challenging , intermittently engrossing and unflaggingly creative ."
0,"for each chuckle there are at least 10 complete misses , many coming from the amazingly lifelike tara reid , whose acting skills are comparable to a cardboard cutout ."
0,"yes , spirited away is a triumph of imagination , but it 's also a failure of storytelling ."
1,"if you 're looking for an intelligent movie in which you can release your pent up anger , enough is just the ticket you need ."
0,"... the efforts of its star , kline , to lend some dignity to a dumb story are for naught ."
1,"as much as i laughed throughout the movie , i can not mount a cogent defense of the film as entertainment , or even performance art , although the movie does leave you marveling at these guys ' superhuman capacity to withstand pain ."
0,but i had a lot of problems with this movie .
0,"it 's the kind of under-inspired , overblown enterprise that gives hollywood sequels a bad name ."
1,most of the things that made the original men in black such a pleasure are still there .
1,that it 'll probably be the best and most mature comedy of the 2002 summer season speaks more of the season than the picture
1,"this charming , thought-provoking new york fest of life and love has its rewards ."
0,but they lack their idol 's energy and passion for detail .
1,the difference between cho and most comics is that her confidence in her material is merited .
1,the slam-bang superheroics are kinetic enough to engross even the most antsy youngsters .
0,"let 's see , a haunted house , a haunted ship , what 's next ... ghost blimp ?"
1,"a miraculous movie , i 'm going home is so slight , yet overflows with wisdom and emotion ."
0,a bloated gasbag thesis grotesquely impressed by its own gargantuan aura of self-importance ...
1,the mesmerizing performances of the leads keep the film grounded and keep the audience riveted .
0,the disjointed mess flows as naturally as jolie 's hideous yellow ` do .
0,"` it looks good , sonny , but you missed the point . '"
0,it 's quite diverting nonsense .
0,some body smacks of exhibitionism more than it does cathartic truth telling .
1,not to mention absolutely refreshed .
1,"a movie i loved on first sight and , even more important , love in remembrance ."
1,matthew lillard is born to play shaggy !
0,"not only does leblanc make one spectacularly ugly-looking broad , but he appears miserable throughout as he swaggers through his scenes ."
0,"director yu seems far more interested in gross-out humor than in showing us well-thought stunts or a car chase that we have n't seen 10,000 times ."
0,"the plot has a number of holes , and at times it 's simply baffling ."
0,mendes still does n't quite know how to fill a frame .
1,"rich in shadowy metaphor and as sharp as a samurai sword , jiang wen 's devils on the doorstep is a wartime farce in the alternately comic and gut-wrenching style of joseph heller or kurt vonnegut ."
0,just another generic drama that has nothing going for it other than its exploitive array of obligatory cheap thrills .
0,"spectators will indeed sit open-mouthed before the screen , not screaming but yawning ."
1,"keenly observed and refreshingly natural , swimming gets the details right , from its promenade of barely clad bodies in myrtle beach , s.c. , to the adrenaline jolt of a sudden lunch rush at the diner ."
1,the mothman prophecies is best when illustrating the demons bedevilling the modern masculine journey .
0,"every so often a film comes along that is so insanely stupid , so awful in so many ways that watching it leaves you giddy ."
0,"lookin ' for sin , american-style ?"
1,"-lrb- jeff 's -rrb- gorgeous , fluid compositions , underlined by neil finn and edmund mcwilliams 's melancholy music , are charged with metaphor , but rarely easy , obvious or self-indulgent ."
0,"i just saw this movie ... well , it 's probably not accurate to call it a movie ."
1,"-lrb- russell -rrb- makes good b movies -lrb- the mask , the blob -rrb- , and the scorpion king more than ably meets those standards ."
0,most of the storylines feel like time fillers between surf shots .
0,jackass is a vulgar and cheap-looking version of candid camera staged for the marquis de sade set .
0,seems like someone going through the motions .
1,"if ayurveda can help us return to a sane regimen of eating , sleeping and stress-reducing contemplation , it is clearly a good thing ."
0,not at all clear what it 's trying to say and even if it were -- i doubt it would be all that interesting .
0,the film is so bad it does n't improve upon the experience of staring at a blank screen .
1,"at times , the movie looks genuinely pretty ."
0,forget the psychology 101 study of romantic obsession and just watch the procession of costumes in castles and this wo n't seem like such a bore .
