class,text
0,"carrying this wafer-thin movie on his nimble shoulders , chan wades through putrid writing , direction and timing with a smile that says , ` if i stay positive , maybe i can channel one of my greatest pictures , drunken master . '"
1,"by the standards of knucklehead swill , the hot chick is pretty damned funny ."
1,"while i ca n't say it 's on par with the first one , stuart little 2 is a light , fun cheese puff of a movie ."
0,a wretched movie that reduces the second world war to one man 's quest to find an old flame .
1,"the underworld urban angst is derivative of martin scorsese 's taxi driver and goodfellas , but this film speaks for itself ."
0,this is just lazy writing .
1,high crimes steals so freely from other movies and combines enough disparate types of films that it ca n't help but engage an audience .
1,"it 's a wonderful , sobering , heart-felt drama ."
0,"lisa rinzler 's cinematography may be lovely , but love liza 's tale itself virtually collapses into an inhalant blackout , maintaining consciousness just long enough to achieve callow pretension ."
1,makes one thing abundantly clear .
0,"the film has -lrb- its -rrb- moments , but they are few and far between ."
0,um ... is n't that the basis for the entire plot ?
0,at once overly old-fashioned in its sudsy plotting and heavy-handed in its effort to modernize it with encomia to diversity and tolerance .
0,"it 's a frightful vanity film that , no doubt , pays off what debt miramax felt they owed to benigni ."
0,"-lrb- lin chung 's -rrb- voice is rather unexceptional , even irritating -lrb- at least to this western ear -rrb- , making it awfully hard to buy the impetus for the complicated love triangle that develops between the three central characters ."
0,"the film is all over the place , really ."
1,we have n't seen such hilarity since say it is n't so !
0,"for every articulate player , such as skateboarder tony hawk or bmx rider mat hoffman , are about a half dozen young turks angling to see how many times they can work the words `` radical '' or `` suck '' into a sentence ."
1,"delia , greta , and paula rank as three of the most multilayered and sympathetic female characters of the year ."
1,a weird and wonderful comedy .
1,"a cartoon that 's truly cinematic in scope , and a story that 's compelling and heartfelt -- even if the heart belongs to a big , four-legged herbivore ."
0,"jaw-droppingly superficial , straining to get by on humor that is not even as daring as john ritter 's glory days on three 's company ."
1,"if cinema had been around to capture the chaos of france in the 1790 's , one imagines the result would look like something like this ."
0,i can analyze this movie in three words : thumbs friggin ' down .
0,"` it 's painful to watch witherspoon 's talents wasting away inside unnecessary films like legally blonde and sweet home abomination , i mean , alabama . '"
0,"deep down , i realized the harsh reality of my situation : i would leave the theater with a lower i.q. than when i had entered ."
1,"scooby doo is surely everything its fans are hoping it will be , and in that sense is a movie that deserves recommendation ."
1,"a strong and confident work which works so well for the first 89 minutes , but ends so horrendously confusing in the final two"
1,reggio and glass put on an intoxicating show .
0,looks and feels like a project better suited for the small screen .
1,"it looks closely , insightfully at fragile , complex relationships ."
0,-lrb- a -rrb- crushing disappointment .
0,"ah , yes , that would be me : fighting off the urge to doze ."
0,"as it is , it 's too long and unfocused ."
0,"you leave the same way you came -- a few tasty morsels under your belt , but no new friends ."
1,"insomnia is one of the year 's best films and pacino gives one of his most daring , and complicated , performances ."
1,a beguiling evocation of the quality that keeps dickens evergreen : the exuberant openness with which he expresses our most basic emotions .
0,a string of rehashed sight gags based in insipid vulgarity .
0,"a movie you observe , rather than one you enter into ."
1,"-lrb- city -rrb- reminds us how realistically nuanced a robert de niro performance can be when he is not more lucratively engaged in the shameless self-caricature of ` analyze this ' -lrb- 1999 -rrb- and ` analyze that , ' promised -lrb- or threatened -rrb- for later this year ."
0,"though impostor deviously adopts the guise of a modern motion picture , it too is a bomb ."
1,a psychic journey deep into the very fabric of iranian ... life .
0,"quite frankly , i ca n't see why any actor of talent would ever work in a mcculloch production again if they looked at how this movie turned out ."
1,"... once the true impact of the day unfolds , the power of this movie is undeniable ."
0,the problem with this film is that it lacks focus .
1,it 's the kind of effectively creepy-scary thriller that has you fixating on a far corner of the screen at times because your nerves just ca n't take it any more .
0,it hates its characters .
0,"the film is so busy making reference to other films and trying to be other films that it fails to have a heart , mind or humor of its own ."
1,"definitely in the guilty pleasure b-movie category , reign of fire is so incredibly inane that it is laughingly enjoyable ."
0,fails so fundamentally on every conventional level that it achieves some kind of goofy grandeur .
1,"a powerful , chilling , and affecting study of one man 's dying fall ."
1,family fare .
1,morvern rocks .
1,"a deft , delightful mix of sulky teen drama and overcoming-obstacles sports-movie triumph ."
1,"jae-eun jeong 's take care of my cat brings a beguiling freshness to a coming-of-age story with such a buoyant , expressive flow of images that it emerges as another key contribution to the flowering of the south korean cinema ."
1,"the pain , loneliness and insecurity of the screenwriting process are vividly and painfully brought to slovenly life in this self-deprecating , biting and witty feature written by charlie kaufman and his twin brother , donald , and directed by spike jonze ."
1,allen 's funniest and most likeable movie in years .
0,"it does n't flinch from its unsettling prognosis , namely , that the legacy of war is a kind of perpetual pain ."
0,the original was n't a good movie but this remake makes it look like a masterpiece !
1,beresford nicely mixes in as much humor as pathos to take us on his sentimental journey of the heart .
0,there 's already been too many of these films ...
0,"it 's got the brawn , but not the brains ."
0,"sounding like arnold schwarzenegger , with a physique to match , -lrb- ahola -rrb- has a wooden delivery and encounters a substantial arc of change that does n't produce any real transformation ."
1,"may be far from the best of the series , but it 's assured , wonderfully respectful of its past and thrilling enough to make it abundantly clear that this movie phenomenon has once again reinvented itself for a new generation ."
1,"as it turns out , you can go home again ."
1,"a warm , funny , engaging film ."
1,"not only a reminder of how they used to make movies , but also how they sometimes still can be made ."
0,there 's not enough here to justify the almost two hours .
1,"fathers and sons , and the uneasy bonds between them , rarely have received such a sophisticated and unsentimental treatment on the big screen as they do in this marvelous film ."
1,rifkin 's references are ... impeccable throughout .
0,"a broad , melodramatic estrogen opera that 's pretty toxic in its own right ."
0,"it 's a glorified sitcom , and a long , unfunny one at that ."
1,but mr. polanski creates images even more haunting than those in mr. spielberg 's 1993 classic .
0,"it 's a hellish , numbing experience to watch , and it does n't offer any insights that have n't been thoroughly debated in the media already , back in the dahmer heyday of the mid - '90s ."
1,-lrb- leigh -rrb- has a true talent for drawing wrenching performances from his actors -lrb- improvised over many months -rrb- and for conveying the way tiny acts of kindness make ordinary life survivable .
1,`` mr. deeds '' is suitable summer entertainment that offers escapism without requiring a great deal of thought .
0,i could n't help but feel the wasted potential of this slapstick comedy .
1,plummer steals the show without resorting to camp as nicholas ' wounded and wounding uncle ralph .
0,"what we have here is n't a disaster , exactly , but a very handsomely produced let-down ."
1,what 's so striking about jolie 's performance is that she never lets her character become a caricature -- not even with that radioactive hair .
1,spielberg 's realization of a near-future america is masterful .
1,"does paint some memorable images ... , but makhmalbaf keeps her distance from the characters"
1,"informative , intriguing , observant , often touching ... gives a human face to what 's often discussed in purely abstract terms ."
0,"trying to figure out the rules of the country bear universe -- when are bears bears and when are they like humans , only hairier -- would tax einstein 's brain ."
1,"piercingly affecting ... while clearly a manipulative film , emerges as powerful rather than cloying ."
1,`` austin powers in goldmember '' has the right stuff for silly summer entertainment and has enough laughs to sustain interest to the end .
1,it will guarantee to have you leaving the theater with a smile on your face .
1,i have n't laughed that hard in years !
0,"the words , ` frankly , my dear , i do n't give a damn , ' have never been more appropriate ."
0,one lousy movie .
0,"a series of escapades demonstrating the adage that what is good for the goose is also good for the gander , some of which occasionally amuses but none of which amounts to much of a story ."
0,there 's no good answer to that one .
0,the only excitement comes when the credits finally roll and you get to leave the theater .
1,if you open yourself up to mr. reggio 's theory of this imagery as the movie 's set ... it can impart an almost visceral sense of dislocation and change .
0,"a long , dull procession of despair , set to cello music culled from a minimalist funeral ."
0,"first , for a movie that tries to be smart , it 's kinda dumb ."
1,"fierce , glaring and unforgettable ."
0,thoroughly engrossing and ultimately tragic .
0,"there 's not a spark of new inspiration in it , just more of the same , done with noticeably less energy and imagination ."
1,the film is darkly funny in its observation of just how much more grueling and time-consuming the illusion of work is than actual work .
0,"after an hour and a half of wondering -- sometimes amusedly , sometimes impatiently -- just what this strenuously unconventional movie is supposed to be , you discover that the answer is as conventional as can be ."
0,daughter from danang reveals that efforts toward closure only open new wounds .
0,"lazily and glumly settles into a most traditional , reserved kind of filmmaking ."
1,an ingenious and often harrowing look at damaged people and how families can offer either despair or consolation .
1,several of steven soderbergh 's earlier films were hailed as the works of an artist .
0,"most of the problems with the film do n't derive from the screenplay , but rather the mediocre performances by most of the actors involved"
1,one of the most gloriously unsubtle and adrenalized extreme shockers since the evil dead .
1,"a rather brilliant little cult item : a pastiche of children 's entertainment , superhero comics , and japanese animation ."
1,a sentimental hybrid that could benefit from the spice of specificity .
0,"ultimately , sarah 's dedication to finding her husband seems more psychotic than romantic , and nothing in the movie makes a convincing case that one woman 's broken heart outweighs all the loss we witness ."
1,it 's a ripper of a yarn and i for one enjoyed the thrill of the chill .
1,with exquisite craftsmanship ... olivier assayas has fashioned an absorbing look at provincial bourgeois french society .
0,a few pieces of the film buzz and whir ; very little of it actually clicks .
1,"watching these two actors play against each other so intensely , but with restraint , is a treat ."
1,"a delectable and intriguing thriller filled with surprises , read my lips is an original ."
0,parker can not sustain the buoyant energy level of the film 's city beginnings into its country conclusion '
1,"best of all is garcia , who perfectly portrays the desperation of a very insecure man ."
0,... in the pile of useless actioners from mtv schmucks who do n't know how to tell a story for more than four minutes .
0,"after a while , the only way for a reasonably intelligent person to get through the country bears is to ponder how a whole segment of pop-music history has been allowed to get wet , fuzzy and sticky ."
1,"-lrb- kline 's -rrb- utterly convincing -- and deeply appealing -- as a noble teacher who embraces a strict moral code , and as a flawed human being who ca n't quite live up to it ."
0,a cheap scam put together by some cynical creeps at revolution studios and imagine entertainment to make the suckers out there surrender $ 9 and 93 minutes of unrecoverable life .
0,serving sara should be served an eviction notice at every theater stuck with it .
0,looks more like a travel-agency video targeted at people who like to ride bikes topless and roll in the mud than a worthwhile glimpse of independent-community guiding lights .
0,there 's surely something wrong with a comedy where the only belly laughs come from the selection of outtakes tacked onto the end credits .
0,"about as enjoyable , i would imagine , as searching for a quarter in a giant pile of elephant feces ... positively dreadful ."
1,"she is a lioness , protecting her cub , and he a reluctant villain , incapable of controlling his crew ."
1,"in addition to hoffman 's powerful acting clinic , this is that rare drama that offers a thoughtful and rewarding glimpse into the sort of heartache everyone has felt , or will feel someday ."
1,`` the road paved with good intentions leads to the video store ''
0,"never does `` lilo & stitch '' reach the emotion or timelessness of disney 's great past , or even that of more recent successes such as `` mulan '' or `` tarzan . ''"
0,the action clichés just pile up .
0,a major waste ... generic .
1,cho continues her exploration of the outer limits of raunch with considerable brio .
1,"meeting , even exceeding expectations , it 's the best sequel since the empire strikes back ... a majestic achievement , an epic of astonishing grandeur and surprising emotional depth ."
1,a film that begins with the everyday lives of naval personnel in san diego and ends with scenes so true and heartbreaking that tears welled up in my eyes both times i saw the film .
0,"the sum of all fears pretends to be a serious exploration of nuclear terrorism , but it 's really nothing more than warmed-over cold war paranoia ."
0,the film 's desire to be liked sometimes undermines the possibility for an exploration of the thornier aspects of the nature\/nurture argument in regards to homosexuality .
1,"bloody sunday has the grace to call for prevention rather than to place blame , making it one of the best war movies ever made ."
1,collateral damage finally delivers the goods for schwarzenegger fans .
0,"a superfluous sequel ... plagued by that old familiar feeling of ` let 's get this thing over with ' : everyone has shown up at the appointed time and place , but visible enthusiasm is mighty hard to find ."
0,"has nothing good to speak about other than the fact that it is relatively short , tries its best to hide the fact that seagal 's overweight and out of shape ."
1,"it moves quickly , adroitly , and without fuss ; it does n't give you time to reflect on the inanity -- and the cold war datedness -- of its premise ."
1,forget about one oscar nomination for julianne moore this year - she should get all five .
0,"the story is -- forgive me -- a little thin , and the filmmaking clumsy and rushed ."
0,a soulless jumble of ineptly assembled cliches and pabulum that plays like a 95-minute commercial for nba properties .
0,sometimes makes less sense than the bruckheimeresque american action flicks it emulates .
0,how inept is serving sara ?
1,"it 's a boring movie about a boring man , made watchable by a bravura performance from a consummate actor incapable of being boring ."
1,"the weight of the piece , the unerring professionalism of the chilly production , and the fascination embedded in the lurid topic prove recommendation enough ."
0,"squandering his opportunity to make absurdist observations , burns gets caught up in the rush of slapstick thoroughfare ."
0,"no matter how much he runs around and acts like a doofus , accepting a 50-year-old in the role is creepy in a michael jackson sort of way ."
1,"first-time writer-director dylan kidd also has a good ear for dialogue , and the characters sound like real people ."
1,a solid examination of the male midlife crisis .
1,bring on the sequel .
1,"k-19 will not go down in the annals of cinema as one of the great submarine stories , but it is an engaging and exciting narrative of man confronting the demons of his own fear and paranoia ."
1,"a lovely film ... elegant , witty and beneath a prim exterior unabashedly romantic ... hugely enjoyable in its own right though not really faithful to its source 's complexity ."
1,"an entertaining , if somewhat standardized , action movie ."
1,strange and beautiful film .
0,an uneasy mix of run-of-the-mill raunchy humor and seemingly sincere personal reflection .
0,wishy-washy .
0,trying to make head or tail of the story in the hip-hop indie snipes is enough to give you brain strain -- and the pay-off is negligible .
1,"the salton sea has moments of inspired humour , though every scrap is of the darkest variety ."
0,aggressive self-glorification and a manipulative whitewash .
0,needed a little less bling-bling and a lot more romance .
1,probes in a light-hearted way the romantic problems of individuals for whom the yearning for passion spells discontent .
0,both deserve better .
0,"a hit - and-miss affair , consistently amusing but not as outrageous or funny as cho may have intended or as imaginative as one might have hoped ."
1,too clever by about nine-tenths .
0,one of those films that started with a great premise and then just fell apart .
0,"it 's a feel-bad ending for a depressing story that throws a bunch of hot-button items in the viewer 's face and asks to be seen as hip , winking social commentary ."
1,"when the movie mixes the cornpone and the cosa nostra , it finds a nice rhythm ."
0,festers in just such a dungpile that you 'd swear you were watching monkeys flinging their feces at you .
1,bring tissues .
1,"feeling to it , but like the 1920 's , the trip there is a great deal of fun ."
1,"a few nonbelievers may rethink their attitudes when they see the joy the characters take in this creed , but skeptics are n't likely to enter the theater ."
1,"like a skillful fisher , the director uses the last act to reel in the audience since its poignancy hooks us completely ."
0,the trappings of i spy are so familiar you might as well be watching a rerun .
1,"it 's a wise and powerful tale of race and culture forcefully told , with superb performances throughout ."
0,the adventures of pluto nash is a whole lot of nada .
0,"a little too ponderous to work as shallow entertainment , not remotely incisive enough to qualify as drama , monsoon wedding serves mostly to whet one 's appetite for the bollywood films ."
0,predictably soulless techno-tripe .
0,"sunk by way too much indulgence of scene-chewing , teeth-gnashing actorliness ."
0,-lrb- a -rrb- stale retread of the '53 original .
0,"as an entertainment destination for the general public , kung pow sets a new benchmark for lameness ."
1,-lrb- an -rrb- absorbing documentary .
0,"one hour photo may seem disappointing in its generalities , but it 's the little nuances that perhaps had to escape from director mark romanek 's self-conscious scrutiny to happen , that finally get under your skin ."
0,exploitative and largely devoid of the depth or sophistication that would make watching such a graphic treatment of the crimes bearable .
1,the film 's intimate camera work and searing performances pull us deep into the girls ' confusion and pain as they struggle tragically to comprehend the chasm of knowledge that 's opened between them .
0,"this movie is something of an impostor itself , stretching and padding its material in a blur of dead ends and distracting camera work ."
1,"while there are times when the film 's reach exceeds its grasp , the production works more often than it does n't ."
1,"a charming , banter-filled comedy ... one of those airy cinematic bon bons whose aims -- and by extension , accomplishments -- seem deceptively slight on the surface ."
1,... one of the more influential works of the ` korean new wave ' .
1,"the off-center humor is a constant , and the ensemble gives it a buoyant delivery ."
0,"as the latest bid in the tv-to-movie franchise game , i spy makes its big-screen entry with little of the nervy originality of its groundbreaking small-screen progenitor ."
0,the film can depress you about life itself .
1,a living testament to the power of the eccentric and the strange .
0,adam sandler 's 8 crazy nights is 75 wasted minutes of sandler as the voice-over hero in columbia pictures ' perverse idea of an animated holiday movie .
0,"even by the intentionally low standards of frat-boy humor , sorority boys is a bowser ."
1,"whether or not you buy mr. broomfield 's findings , the film acquires an undeniable entertainment value as the slight , pale mr. broomfield continues to force himself on people and into situations that would make lesser men run for cover ."
1,"finely crafted , finely written , exquisitely performed"
0,this is a movie so insecure about its capacity to excite that it churns up not one but two flagrantly fake thunderstorms to underscore the action .
0,"a disappointment for those who love alternate versions of the bard , particularly ones that involve deep fryers and hamburgers ."
1,... takes the beauty of baseball and melds it with a story that could touch anyone regardless of their familiarity with the sport
0,woefully pretentious .
0,"takes a clunky tv-movie approach to detailing a chapter in the life of the celebrated irish playwright , poet and drinker ."
1,"if you ever wanted to be an astronaut , this is the ultimate movie experience - it 's informative and breathtakingly spectacular ."
1,10 minutes into the film you 'll be white-knuckled and unable to look away .
1,"a good film with a solid pedigree both in front of and , more specifically , behind the camera ."
1,"as the movie traces mr. brown 's athletic exploits , it is impossible not to be awed by the power and grace of one of the greatest natural sportsmen of modern times ."
1,but darned if it does n't also keep us riveted to our seats .
0,"it 's clear why deuces wild , which was shot two years ago , has been gathering dust on mgm 's shelf ."
1,changing lanes tries for more .
1,"wiseman is patient and uncompromising , letting his camera observe and record the lives of women torn apart by a legacy of abuse ."
0,"despite the fact that this film was n't as bad as i thought it was going to be , it 's still not a good movie"
1,"more intimate than spectacular , e.t. is carried less by wow factors than by its funny , moving yarn that holds up well after two decades ."
0,"... begins with promise , but runs aground after being snared in its own tangled plot ."
1,"even when there are lulls , the emotions seem authentic , and the picture is so lovely toward the end ... you almost do n't notice the 129-minute running time ."
0,the thought of watching this film with an audience full of teenagers fixating on its body humour and reinforcement of stereotypes -lrb- of which they 'll get plenty -rrb- fills me with revulsion .
1,"this is human comedy at its most amusing , interesting and confirming ."
1,"the fascination comes in the power of the huston performance , which seems so larger than life and yet so fragile , and in the way the ivan character accepts the news of his illness so quickly but still finds himself unable to react ."
0,attempts by this ensemble film to impart a message are so heavy-handed that they instead pummel the audience .
1,"cold , nervy and memorable ."
0,"is the time really ripe for a warmed-over james bond adventure , with a village idiot as the 007 clone ?"
1,"a smart , provocative drama that does the nearly impossible : it gets under the skin of a man we only know as an evil , monstrous lunatic ."
1,an instance of an old dog not only learning but inventing a remarkable new trick .
1,"if you 're hard up for raunchy college humor , this is your ticket right here ."
1,a film with a great premise but only a great premise .
1,"despite besson 's high-profile name being wasabi 's big selling point , there is no doubt that krawczyk deserves a huge amount of the credit for the film 's thoroughly winning tone ."
0,"cacoyannis ' vision is far less mature , interpreting the play as a call for pity and sympathy for anachronistic phantasms haunting the imagined glory of their own pasts ."
1,the beauty of the piece is that it counts heart as important as humor .
1,"there are a couple of things that elevate `` glory '' above most of its ilk , most notably the mere presence of duvall ."
1,"if you can stomach the rough content , it 's worth checking out for the performances alone ."
1,arteta directs one of the best ensemble casts of the year
1,one of those terrific documentaries that collect a bunch of people who are enthusiastic about something and then figures out how to make us share their enthusiasm .
0,less than fresh .
